date_utc,timestamp,title,text,subreddit,comments,url
NA,NA,NA,NA,NA,NA,NA
2024-03-14,1710423942,I was a Tyler Herro hater,Not anymore& I was an advocate of bringing Herro off the bench but now I see how much we need him because we lack versatility scoring and its a reason why Herro does good against Denver ,heat,91,https://www.reddit.com/r/heat/comments/1belj2j/i_was_a_tyler_herro_hater/
2024-01-24,1706136468,Terry Rozier on playing with Bam Adebayo: The pick and roll is gonna be special. You have to pick your poison.,,heat,27,https://www.reddit.com/r/heat/comments/19etrp5/terry_rozier_on_playing_with_bam_adebayo_the_pick/
2024-09-12,1726152438,My first Heat jersey of the Nike era =ª<þ=%,"Never really wanted to spend the big money on a jersey tbh but my girlfriend decided to bless me =-d might have to put a ring on it! 

BAM FC STAND UP =$=%",heat,17,https://www.reddit.com/r/heat/comments/1ff4d5p/my_first_heat_jersey_of_the_nike_era/
2024-07-12,1720765790,"Keshad and his ""50 strong"" came out to support him","Kehad ""Showtime"" Johnson had his family members came out to watch him play in the last California Classic Summer League game. Nice to see hif family is very tight-knit and supportive of him. 

He really looks like a positive and good kid and hopefully earns himself a guaranteed contract with us sooner or later and show out on the court!",heat,19,https://www.reddit.com/r/heat/comments/1e1aqf7/keshad_and_his_50_strong_came_out_to_support_him/
2024-06-05,1717594515,What do you guys think? ,,heat,180,https://www.reddit.com/r/heat/comments/1d8q3e3/what_do_you_guys_think/
2024-05-30,1717068102,Emo Jimmy on mural,Drive past this mural almost everyday thought Id share ,heat,35,https://www.reddit.com/r/heat/comments/1d41nqp/emo_jimmy_on_mural/
2024-05-02,1714612239,Tyler Herro This Off-Season,,heat,26,https://www.reddit.com/r/heat/comments/1ci2xkx/tyler_herro_this_offseason/
2024-04-29,1714420868,HEAT NATION- send a Spirit Bomb..,"ITS TIME, PROVE TO THESE DOUBTERS WE NEVER NEEDED A 50 million a year guard&

show them you are taking that next leap Tyler&

show them you are clutch in the 4th Bam&

show them you really ARE a Jimmy compare Jaime..

show them why we wanted Boston, and do it because you guys deserve that praise because HEAT NATION HAS RODE WITH YOU AND WE ARE BEHIND YOU

F- BOSTON",heat,14,https://www.reddit.com/r/heat/comments/1cg8sj9/heat_nation_send_a_spirit_bomb/
2024-04-21,1713741857,I got banned for 1 day in the main NBA subreddit due to this post for violating something I guess?,Link is to a Heat injury report for this season,heat,108,https://www.reddit.com/r/heat/comments/1c9vxmn/i_got_banned_for_1_day_in_the_main_nba_subreddit/
2024-03-04,1709540107,"Miami HEAT on X: ""Orlando and Niko are comedy =""",,heat,14,https://www.reddit.com/r/heat/comments/1b65pwi/miami_heat_on_x_orlando_and_niko_are_comedy/
2024-01-30,1706649380,JJJ has been selected to play in the NBA Rising Stars game,,heat,16,https://www.reddit.com/r/heat/comments/1aezlsl/jjj_has_been_selected_to_play_in_the_nba_rising/
2024-01-30,1706642799,"[Barry Jackson] Bam said there was film session today with candid communication among everyone in which players were ""vulnerable"" with each other and they now have clarity. An intense, resolute Spo said nothing discussed today was any of our business (none of us were offended by that obviously)",,heat,60,https://www.reddit.com/r/heat/comments/1aewx4f/barry_jackson_bam_said_there_was_film_session/
2024-01-25,1706151430,9/4/5 and 3 steals. early thoughts?,,heat,114,https://www.reddit.com/r/heat/comments/19ez5lb/945_and_3_steals_early_thoughts/
2023-11-13,1699883364,"Simon Smith no X - Jaime Jaquez Jr. among rookies, per @nbastats No. 1 in total steals (13) No. 3 in total deflections (21) No. 3 in total loose balls (8) No. 7 in total points &amp; assists In 21.9 mins per game",,heat,54,https://www.reddit.com/r/heat/comments/17ub132/simon_smith_no_x_jaime_jaquez_jr_among_rookies/
2024-10-16,1729109852,Bench cheering after Jimmy fouls Paul lmao,,heat,11,https://www.reddit.com/r/heat/comments/1g58yb4/bench_cheering_after_jimmy_fouls_paul_lmao/
2024-04-25,1714055702,That was Herros best game in the playoffs since the bubble,"You gotta be happy for him. It's been a real struggle for him these past few postseasons, it's amazing to see him get his mojo back in this part of the season. Him and Bam have the chance to etch their names in NBA history leading this injured 8 seed. Despite all the shit thrown at them through the years, these two guys always put their head down and get to it. 

Culture baby Culture<",heat,33,https://www.reddit.com/r/heat/comments/1cctj1n/that_was_herros_best_game_in_the_playoffs_since/
2024-03-30,1711783249,"Not One, But TWO KaBams!! ",BAM ADD A BIIIOOOOOOOO 3EEEEEEEEEEEEEEEEEEEEEEEEEEEEEEEEE,heat,16,https://www.reddit.com/r/heat/comments/1brbys2/not_one_but_two_kabams/
2023-12-26,1703562167,Jimmy dropped 30/10 today =$,,heat,5,https://www.reddit.com/r/heat/comments/18qyu4m/jimmy_dropped_3010_today/
2023-12-07,1701917757,Celtics fans watching Caleb get back to his playoffs form.,,heat,7,https://www.reddit.com/r/heat/comments/18clomb/celtics_fans_watching_caleb_get_back_to_his/
2024-07-27,1722050638,Heat lifer Josh Christopher,,heat,7,https://www.reddit.com/r/heat/comments/1ed6r5p/heat_lifer_josh_christopher/
2024-05-14,1715700195,Former Heat Legend Kendrick Nunn makes EuroLeague All First Team,,heat,23,https://www.reddit.com/r/heat/comments/1cruthv/former_heat_legend_kendrick_nunn_makes_euroleague/
2024-05-07,1715097504,"Tim Reynolds: It's May 7. The draft is in like seven weeks. Free agency is nearly two months away. Camp is five months away. Everyone, I beg you, stop going crazy about what the Heat will or will not do and whether they can get the ghost of Wilt Chamberlain in a sign-and-trade for pick swaps.",,heat,28,https://www.reddit.com/r/heat/comments/1cmfc7f/tim_reynolds_its_may_7_the_draft_is_in_like_seven/
2024-05-06,1715022320,Pat Riley on Jaime and Niko,,heat,33,https://www.reddit.com/r/heat/comments/1clr6pc/pat_riley_on_jaime_and_niko/
2024-05-05,1714877210,Jimmy Butler at the Miami Grand Prix,,heat,12,https://www.reddit.com/r/heat/comments/1ckhdf6/jimmy_butler_at_the_miami_grand_prix/
2024-04-26,1714152340,Celtics calling in the big dog for the next game. ,,heat,24,https://www.reddit.com/r/heat/comments/1cdr7eh/celtics_calling_in_the_big_dog_for_the_next_game/
2024-04-24,1713967655,He threw what at the refs? =,,heat,9,https://www.reddit.com/r/heat/comments/1cbz45s/he_threw_what_at_the_refs/
2024-04-20,1713576251,Last time I made one of these was for Gogi in the bubble finals. We have the chance to do something real funny against Boston - LETS GO HEAT,,heat,4,https://www.reddit.com/r/heat/comments/1c8dowa/last_time_i_made_one_of_these_was_for_gogi_in_the/
2024-02-11,1707621326,Lowry getting bought out and joining the 76ers,,heat,66,https://www.reddit.com/r/heat/comments/1any50q/lowry_getting_bought_out_and_joining_the_76ers/
2024-01-26,1706237819,5th straight loss...,,heat,7,https://www.reddit.com/r/heat/comments/1ab81dr/5th_straight_loss/
2023-12-26,1703562006,I never believed in Jesus until I saw him on a basketball court today. I'm a believer =%,,heat,44,https://www.reddit.com/r/heat/comments/18qys7x/i_never_believed_in_jesus_until_i_saw_him_on_a/
2023-11-25,1700882507,UD speaks following tonights fourth quarter collapse,,heat,9,https://www.reddit.com/r/heat/comments/183aaa7/ud_speaks_following_tonights_fourth_quarter/
2023-11-23,1700774907,Happy Thanksgiving! >,,heat,19,https://www.reddit.com/r/heat/comments/182bew5/happy_thanksgiving/
2024-06-27,1719527531,"Undrafted Keshad Johnson of San Diego State has agreed to a two-way NBA deal with the Miami Heat, sources said.",,heat,49,https://www.reddit.com/r/heat/comments/1dq44u8/undrafted_keshad_johnson_of_san_diego_state_has/
2024-05-02,1714650718,It was a fun season Heat Fam. The journey continues with the Cats!,,heat,7,https://www.reddit.com/r/heat/comments/1cidpue/it_was_a_fun_season_heat_fam_the_journey/
2024-04-05,1712326749,This Jimmy Hate is Wild,"Like I understand being mad at this team, but some of y'all going mental trash talking Jimmy. Dude got some weird ways but we've been one of the best and by far the most feared team in the East for years now cause of what Jimmy does for us in the playoffs. Apparently multiple ECF and Finals appearances with all time great performances not enough for some in this sub. Sad. If Jimmy goes crazy again don't turn around and post ""JIMBO!!!"" all over the place. Go hang out in the Knicks sub.",heat,113,https://www.reddit.com/r/heat/comments/1bwj7tw/this_jimmy_hate_is_wild/
2024-03-16,1710606581,Tyler Herro received a platelet-rich plasma injection Friday to treat his injured right foot and will be re-evaluated in one to two weeks.,,heat,111,https://www.reddit.com/r/heat/comments/1bg9zjd/tyler_herro_received_a_plateletrich_plasma/
2024-01-29,1706541578,We need playoff Jimmy today we can't lose 7 in a row,I might go crazy if we lose 7 in a row,heat,26,https://www.reddit.com/r/heat/comments/1adxqex/we_need_playoff_jimmy_today_we_cant_lose_7_in_a/
2024-10-05,1728094108,Dru Smith with the game winner in Bahamas,Duncan is loving it >#,heat,15,https://www.reddit.com/r/heat/comments/1fwfyos/dru_smith_with_the_game_winner_in_bahamas/
2024-10-01,1727808857,"Jimmy Butler acknowledged enjoying the Bahamian nightlife, in his own, unique way, ""They play dominos at a high level. I literally stayed up 'til 4 a.m. last night playing dominoes with the locals, man. I love you all. I'm going to be back, staying up to 5.""",The Heat are holding training camp at the Baha Mar in the Bahamas until October 5th,heat,12,https://www.reddit.com/r/heat/comments/1ftvwc7/jimmy_butler_acknowledged_enjoying_the_bahamian/
2024-05-08,1715208571,Fun fact: Nikola Jovic has made more threes than Nikola Jokic this postseason.,,heat,44,https://www.reddit.com/r/heat/comments/1cnhvzd/fun_fact_nikola_jovic_has_made_more_threes_than/
2024-04-29,1714426240,<÷<ø>Å,,heat,28,https://www.reddit.com/r/heat/comments/1cgb342/_/
2024-04-25,1714009226,I love this team,,heat,4,https://www.reddit.com/r/heat/comments/1ccfrvf/i_love_this_team/
2024-02-19,1708324718,"[Chiang] Asked about his pull-up three in the All-Star Game, Bam Adebayo joked: ""Tell Spo. Pull the clip up, show Spo.""",,heat,42,https://www.reddit.com/r/heat/comments/1augrjv/chiang_asked_about_his_pullup_three_in_the/
2024-02-15,1707964000,B2B 20 PIECES FOR DROB!! HAPPY BIRTHDAY,,heat,20,https://www.reddit.com/r/heat/comments/1ar4w0r/b2b_20_pieces_for_drob_happy_birthday/
2024-01-24,1706073738,Terry Really Is A Lifer =),,heat,16,https://www.reddit.com/r/heat/comments/19e9k81/terry_really_is_a_lifer/
2023-12-29,1703827534,[Post Game] Heat defeat the Warriors | Herro 26pts 7rebs,https://www.nba.com/game/MIA-vs-GSW-0022300426/box-score,heat,150,https://www.reddit.com/r/heat/comments/18tfblo/post_game_heat_defeat_the_warriors_herro_26pts/
2023-12-26,1703605095,NBACentral (@TheDunkCentral) no X - Rookie leading scorers in December: 1. Jaime Jaquez Jr. - 16.6 PTS 2. Victor Wembanyama - 16.4 PTS 3. Chet Holmgren - 15.8 PTS 4. Brandon Miller - 14.9 PTS 5. Keyonte George - 14.6 PTS,,heat,45,https://www.reddit.com/r/heat/comments/18raq7b/nbacentral_thedunkcentral_no_x_rookie_leading/
2023-12-23,1703303324,Duncan joins the club,,heat,10,https://www.reddit.com/r/heat/comments/18owwq1/duncan_joins_the_club/
2024-06-26,1719433403,The Locksmiths agent is a fucking savage,,heat,17,https://www.reddit.com/r/heat/comments/1dp8jp6/the_locksmiths_agent_is_a_fucking_savage/
2024-05-03,1714747249,How many of you agree that letting Jimmy go feels like a huge mistake.,"Im not here to argue with anyone.

I get that hes getting older but its not like hes showing real signs of falling off. If he was injured last season before the playoffs we would be sitting here having this conversation last year. He averaged the same regular season numbers as he has for the past three seasons, with real improvement with his 3pt shot and a similar record to last season. Do we forget that he lead us to the finals just last year? We were hoping to sign Dame last season to have him and Jimmy play out Dames contract together. Now a year later its time to move on? Jimmy Butler is consistently a border line all-nba caliber player in the regular season and in recent years I would argue hes at least a top 5 player in the playoffs. Hes consistently outperformed guys that are regarded as MVP contenders (Tatum, Embiid).  

Lets talk about his playing style. Sure hes incredibly athletic, but his game is slow, methodical and about him getting to his spots. His athleticism may drop off, but his IQ and strength are what he relies most on. Not to mention his impact as a leader on this team. 

And one last thing, from a fans perspective - this guy has given his all to this team, hes a Heat guy and if two years ago after he missed the shot in game 7, or last year after bringing us to the finals, you knew that people were confidently saying its time to go youd assume he fell off big time. It feels a bit like when Wade came back to Miami, Jimmy belongs in a Heat jersey, even if you may not think its the smartest decision.",heat,139,https://www.reddit.com/r/heat/comments/1cjacgz/how_many_of_you_agree_that_letting_jimmy_go_feels/
2024-04-24,1713961535,ITS GAMEDAY. Get ready for this version of Herro tonight. ,,heat,56,https://www.reddit.com/r/heat/comments/1cbwui6/its_gameday_get_ready_for_this_version_of_herro/
2024-02-20,1708465424,First look at Delon Wright =,,heat,28,https://www.reddit.com/r/heat/comments/1avttr5/first_look_at_delon_wright/
2024-02-16,1708114837,Few players in the NBA have defensive instincts &amp; motor like Delon Wright  Hes a joy to watch give everyone hell on the perimeter. Has incredible hands &amp; sense for the ball. 99th percentile steals per 75 poss. 98th percentile deflections. ELITE passing lane deterrent. Underrated,,heat,57,https://www.reddit.com/r/heat/comments/1asii2b/few_players_in_the_nba_have_defensive_instincts/
2024-02-01,1706755711,We Back,,heat,4,https://www.reddit.com/r/heat/comments/1ag0gx7/we_back/
2023-11-02,1698894287,Why is this guy getting so much hate on r/nba?,,heat,130,https://www.reddit.com/r/heat/comments/17lu2p8/why_is_this_guy_getting_so_much_hate_on_rnba/
2024-10-19,1729304271,[Post Game] Heat defeat Grizzlies in final preseason game of '24/25 season,**ESPN Box Score:** https://www.espn.com/nba/boxscore/_/gameId/401717023,heat,66,https://www.reddit.com/r/heat/comments/1g6ywrs/post_game_heat_defeat_grizzlies_in_final/
2024-08-27,1724786924,Weekly Tyler gains post ,Im posting until the season starts. My brother is beefing up regardless of what all the haters say. All Star 2025 incoming ,heat,114,https://www.reddit.com/r/heat/comments/1f2pvo1/weekly_tyler_gains_post/
2024-07-18,1721287170,"Caleb Martin's camp never gave Miami the opportunity to match Philadelphia's offer, per @flasportsbuzz","On top of missing out on the $65M deal we offered. 

He would have made a lot more with the same deal due to tax reasons in Florida, he should double fire his agent for this epic fumble.",heat,66,https://www.reddit.com/r/heat/comments/1e65ecf/caleb_martins_camp_never_gave_miami_the/
2024-07-14,1720979260,Jamie growth next season ,Im expecting a leap offensively in Jamie growth especially with his play making. Im hoping his 3 point shot becomes consistent. My thing is this sometimes I feel like hes a starter and Im kinda entertaining the idea of him playing next to butler. His IQ is better than Herro and Duncan on top of his defense which isnt great. He just cant shoot the ball consistently. Where do you think hes starts? 2/3 or 4 ,heat,27,https://www.reddit.com/r/heat/comments/1e38d3e/jamie_growth_next_season/
2024-04-30,1714442739,Haynes also reports that Kevin Love spoke up in the team meeting and said  I dont know how much basketball I have left in me.,Wish Heat picked him over Beasley in 08 =,heat,30,https://www.reddit.com/r/heat/comments/1cghb7h/haynes_also_reports_that_kevin_love_spoke_up_in/
2024-04-26,1714151147,How it feels watching this series,,heat,7,https://www.reddit.com/r/heat/comments/1cdqpy4/how_it_feels_watching_this_series/
2024-03-03,1709462377,Terry Rozier,I think Rozier is becoming what the heat wanted to get from Victor Oladipo. Someone who can attack the basket at will and has great defense,heat,41,https://www.reddit.com/r/heat/comments/1b5eaen/terry_rozier/
2024-02-18,1708229546,=ø,,heat,13,https://www.reddit.com/r/heat/comments/1atl99i/_/
2024-01-23,1706025339,"Amazing to see this happen in real time: about 25 NBA Twitter fan bases shifting their thinking from ""Kyle Lowry is washed"" to ""let's get Kyle Lowry in a buyout!""",,heat,44,https://www.reddit.com/r/heat/comments/19drk2e/amazing_to_see_this_happen_in_real_time_about_25/
2024-09-10,1725932733,There could be no other winner for best Rim Defender than Alonzo Mourning. Who is our most athletic player of all time?,I will be posting the top 5 Best Rim Defenders in the comments. The winner of Most Athletic will be the player with the most upvotes across all comments.,heat,136,https://www.reddit.com/r/heat/comments/1fd6kha/there_could_be_no_other_winner_for_best_rim/
2024-08-10,1723324399,Walk with me,,heat,50,https://www.reddit.com/r/heat/comments/1ep3j3e/walk_with_me/
2024-04-04,1712265195,Knicks fans have decided to attack Jaime Jaquez in his IG comments,,heat,110,https://www.reddit.com/r/heat/comments/1bvz2w4/knicks_fans_have_decided_to_attack_jaime_jaquez/
2024-03-30,1711826091,"For my Papa Johns Heat fans, a small tip.",Dont add specials like the garlic stuffed crust pepperoni for $13.99. Heatwin doesnt work on that. Instead just create your own and add the options. The pepperoni garlic stuffed crust is $13. If you build your own its $20. With half off its $10. Youre welcome.,heat,13,https://www.reddit.com/r/heat/comments/1brpree/for_my_papa_johns_heat_fans_a_small_tip/
2024-02-24,1708747201,THAT Was Smooth,,heat,8,https://www.reddit.com/r/heat/comments/1ayl113/that_was_smooth/
2023-11-12,1699757616,Heat fans watching JJJ.,,heat,10,https://www.reddit.com/r/heat/comments/17taxus/heat_fans_watching_jjj/
2024-07-26,1721986200,Jovi looks like a kid compared to his teammates ,Jokic looks like that one cool dad.,heat,19,https://www.reddit.com/r/heat/comments/1ecjup4/jovi_looks_like_a_kid_compared_to_his_teammates/
2024-04-21,1713730756,Tyler Herro is shooting 26.5% from 3 in the playoffs since 2021,,heat,77,https://www.reddit.com/r/heat/comments/1c9rllt/tyler_herro_is_shooting_265_from_3_in_the/
2024-04-17,1713362617,Bam Adebayo is the first player to receive his jersey from Team USA for the Olympics =%,,heat,31,https://www.reddit.com/r/heat/comments/1c6apkv/bam_adebayo_is_the_first_player_to_receive_his/
2024-02-21,1708505188,"Podz wanted to be drafted by Miami. While both Heat and Warriors were interested in the same prospects (Podz and Jaime). If Miami took Podz with 18th pick, then Jaime would have landed in Golden State with 19th pick.",,heat,54,https://www.reddit.com/r/heat/comments/1aw7e37/podz_wanted_to_be_drafted_by_miami_while_both/
2024-01-02,1704212229,Going on either subreddit has been insufferable lately.,"Buck up Doomers, we are the 4th seed in the east and one of the most injured teams in the whole league. We arent wasting anyones prime and the front office was being praised a week and a half ago.",heat,28,https://www.reddit.com/r/heat/comments/18wt4np/going_on_either_subreddit_has_been_insufferable/
2023-11-23,1700709348,"New career high 22 points (4 for 4 on threes) and 7 rebounds for Jaquez. Can't believe Joe Cronin worked in a Pac-10 state and it didn't occur to him to re-engage the Heat and ask for Jaquez, instead opting to ghost Miami... Heat obviously thrilled to have Jaime.",,heat,17,https://www.reddit.com/r/heat/comments/181rlfs/new_career_high_22_points_4_for_4_on_threes_and_7/
2023-11-13,1699901991,"@CoupNBA Over his last four games, Bam Adebayo has averaged 25.5 points on 53.7% shooting , 14.5 rebounds, 5.3 assists, 2.0 steals and 1.8 blocks. The only other players in NBA history to do that over four games are: Hakeem (2x) Bird (2x) Giannis (2x) Kareem (13x)",,heat,26,https://www.reddit.com/r/heat/comments/17uhwcr/coupnba_over_his_last_four_games_bam_adebayo_has/
2024-10-19,1729309130,Pelle Larsson Really Exceeding Expectations For Being a 44th Pick; Spo is Gonna Love This Kid,,heat,17,https://www.reddit.com/r/heat/comments/1g70ba3/pelle_larsson_really_exceeding_expectations_for/
2024-10-17,1729200753,Niko and Jaime with the S.L champs on Friday vs. Memphis ,,heat,71,https://www.reddit.com/r/heat/comments/1g621cv/niko_and_jaime_with_the_sl_champs_on_friday_vs/
2024-07-07,1720378860,OFFICIAL: The Miami HEAT have waived Orlando Robinson.,,heat,64,https://www.reddit.com/r/heat/comments/1dxo0hj/official_the_miami_heat_have_waived_orlando/
2024-07-02,1719924931,"[Wojnarowski] BREAKING: Cleveland Cavaliers All-Star guard Donovan Mitchell has agreed on a three-year, $150.3 million maximum contract extension that includes a player option for the 2027-2028 season, sources tell ESPN.",,heat,255,https://www.reddit.com/r/heat/comments/1dtl5k8/wojnarowski_breaking_cleveland_cavaliers_allstar/
2024-05-20,1716236470,What does everyone think of this Donavon Mitchell trade idea?,,heat,11,https://www.reddit.com/r/heat/comments/1cwpd7n/what_does_everyone_think_of_this_donavon_mitchell/
2024-04-29,1714350846,"Sleep tight Boston, series gets tied tomorrow&",,heat,8,https://www.reddit.com/r/heat/comments/1cflsx0/sleep_tight_boston_series_gets_tied_tomorrow/
2024-04-03,1712159100,Seeing the play-in tournament looming again,Need a strong finish to the season for that 6th seed.,heat,14,https://www.reddit.com/r/heat/comments/1buvvya/seeing_the_playin_tournament_looming_again/
2024-01-08,1704689035,Once again&.the Miami Heat run this city.,"*sigh*

What can I say, I get my hopes up so much and they are destroyed in the most devastating way possible.

I think I now look at the Heats Final run last year with a whole new level of appreciation.

Regardless of everything, what the Miami Heat have done in the last 20 or so years has been truly amazing.

We take it for granted as fans, we complain and bitch because we dont get our way 100% of the time, but&.we should never forget that winning is extremely difficult.",heat,75,https://www.reddit.com/r/heat/comments/191crdq/once_againthe_miami_heat_run_this_city/
2023-11-15,1700016754,J for Jaime,Im posting this shit every time we win and he does well. Thats all there is too it. =$,heat,11,https://www.reddit.com/r/heat/comments/17vjtk3/j_for_jaime/
2024-10-18,1729277443,"[NBACentral] Pat Riley says he wasnt ready to give up on the Heat roster, even though they were a play-in team last season","""I wasn't comfortable in just saying, 'OK, I'm going to give up on this team this year because we're a play-in team.' If you get in, you get in and then you go from there. Two years ago was an anomaly and we ended up in the Finals. I'll take the anomaly any day. But we do have a very good team.""",heat,86,https://www.reddit.com/r/heat/comments/1g6pnhx/nbacentral_pat_riley_says_he_wasnt_ready_to_give/
2024-09-05,1725569600,Tyler Gains,,heat,17,https://www.reddit.com/r/heat/comments/1f9x6sw/tyler_gains/
2024-07-08,1720465252,"LeBron James Made The Decision to Join the Miami Heat | July 8, 2010","It led to 4 straight Finals appearances and 2 NBA Championships, the Miami Heat was on top of the Basketball world",heat,17,https://www.reddit.com/r/heat/comments/1dygzwc/lebron_james_made_the_decision_to_join_the_miami/
2024-06-28,1719614662,"The Hawks have traded Dejounte Murray to the Pelicans, sources said. Firesale time =@",,heat,147,https://www.reddit.com/r/heat/comments/1dqwgkc/the_hawks_have_traded_dejounte_murray_to_the/
2024-04-17,1713396043,LFG!,,heat,24,https://www.reddit.com/r/heat/comments/1c6ofk3/lfg/
2024-03-26,1711478441,"Dwyane Wade Banks in WILD Game Winner vs Golden State Warriors #OneLastDance | February 27th, 2019",,heat,16,https://www.reddit.com/r/heat/comments/1boffep/dwyane_wade_banks_in_wild_game_winner_vs_golden/
2024-03-03,1709498655,Anyone else noticing that Caleb is the one giving teams the dagger lately?,,heat,59,https://www.reddit.com/r/heat/comments/1b5rhs7/anyone_else_noticing_that_caleb_is_the_one_giving/
2024-03-01,1709258461,"Michael Malone on Heats 31 starting lineups says, Thats crazy. Says Spoelstra deserves every dollar in his extension.",,heat,9,https://www.reddit.com/r/heat/comments/1b3ien1/michael_malone_on_heats_31_starting_lineups_says/
2024-01-17,1705511789,"Terry Rozier would prefer to join the Miami Heat, per @JakeLFischer Terry Roziers strong play has made the combo guard a more viable trade candidate than ever at his $24 million average annual salary, with a known preference in joining the Miami Heat, league sources told Yahoo Sports.",,heat,250,https://www.reddit.com/r/heat/comments/1991wsp/terry_rozier_would_prefer_to_join_the_miami_heat/
2023-11-04,1699065928,Double-Digit Scorers,,heat,18,https://www.reddit.com/r/heat/comments/17nc4ut/doubledigit_scorers/
2024-10-18,1729224571,Tyler Herro made the top 50 on both Charles Barkley and Shaqs 2024-2025 player rankings =@,,heat,50,https://www.reddit.com/r/heat/comments/1g69nys/tyler_herro_made_the_top_50_on_both_charles/
2024-09-30,1727709433,Tyler Herro on his mindset this year:  Last year I came in saying I want to average 25 PPG.  Im just here to play&Whatever I end up averaging I end up averaging. Not here to push any agendas like all star or anything.,,heat,39,https://www.reddit.com/r/heat/comments/1fsy15w/tyler_herro_on_his_mindset_this_year_last_year_i/
