date_utc,timestamp,title,text,subreddit,comments,url
2023-11-09,1699505970,"Maybe the NBA will give him an assist overnight, give him that triple-double Erik Spoelstra's comments on Kyle Lowry's 17-11-9 performance tonight",,heat,8,https://www.reddit.com/r/heat/comments/17r5hpn/maybe_the_nba_will_give_him_an_assist_overnight/
2024-06-27,1719517146,"My toughest opponent in the NBA is Father Time. Im not getting any younger, Im getting older  Jimmy Butler  ",,heat,28,https://www.reddit.com/r/heat/comments/1dq02td/my_toughest_opponent_in_the_nba_is_father_time_im/
2024-04-04,1712231710,DJIMBO UNTAMED,Version 1,heat,13,https://www.reddit.com/r/heat/comments/1bvl81m/djimbo_untamed/
2024-04-03,1712112089,Locksmith Is Scary Too,,heat,18,https://www.reddit.com/r/heat/comments/1buhmjn/locksmith_is_scary_too/
2024-03-06,1709715514,"Duncan Robinson takes the #1 spot on NBA's Top 10 Plays of the Night | March 5, 2024","I know Dunc will be here, surprised that he's on top! Let them know Duncan! ",heat,33,https://www.reddit.com/r/heat/comments/1b7v5jl/duncan_robinson_takes_the_1_spot_on_nbas_top_10/
2024-09-18,1726661867,Take your pick ,,heat,117,https://www.reddit.com/r/heat/comments/1fjrd1s/take_your_pick/
2024-06-27,1719523142,"With the 44th pick, the Miami Heat select Pelle Larson",,heat,132,https://www.reddit.com/r/heat/comments/1dq2gnd/with_the_44th_pick_the_miami_heat_select_pelle/
2024-04-25,1714088517,Boston Celtics broadcast&.yikes,"Decided I would watch a replay of last nights game, and decided to hear how salty the Cs commentators were so I watched the Celtics feed. 

I CANNOT believe how bad the call was of the game. In the moments where it wasnt complete radio silence (which would carry on way longer than anticipated), you have Scalabrine whining half the time. Extremely unprofessional to say the least. Saying garbage on air like Ive done my fair share of hating Tyler Herro. Whaaaa???? What kind of man child says shit like this on live TV, let alone an ex player. 

0 basketball insight. 0 stats. 0 preparation.

Their guys literally do the bare minimum all the while being insane homers and nothing else. No flare&.no extra tidbits&.no chemistry between the 2. My girl fell asleep within the 1st quarter&.at 4pm. 

Naturally I switched it to E. Reid and Crotty and holy hell the change in energy and complete know-how on what the job entails is unmatched. Actually felt like a gaddamn playoff game. 

Never take our broadcast team for granted Heat nation. 


TLDR: Boston commentators have the charisma and personality of a dead fish. 
",heat,63,https://www.reddit.com/r/heat/comments/1cd6hjn/boston_celtics_broadcastyikes/
2024-02-14,1707880818,New career stats for Jovic >s,Creds to @JovicNation on Instagram,heat,23,https://www.reddit.com/r/heat/comments/1aqcxy0/new_career_stats_for_jovic/
2024-06-15,1718421557,"Please God, give us a sequel ",,heat,20,https://www.reddit.com/r/heat/comments/1dg8nxd/please_god_give_us_a_sequel/
2024-02-19,1708308061,we know how to chose em ,,heat,14,https://www.reddit.com/r/heat/comments/1aubnm1/we_know_how_to_chose_em/
2024-01-23,1706024656,Terry Rozier ranks second in the #NBA in pick and roll scoring efficiency this season.,,heat,50,https://www.reddit.com/r/heat/comments/19draou/terry_rozier_ranks_second_in_the_nba_in_pick_and/
2023-12-17,1702784161,Jaime Jaquez did everything he could to get them back into this game tonight 18 points on 8 for 14 shooting He energized the team and energized the building Then Baby Jimmy watched real Jimmy send them home,,heat,47,https://www.reddit.com/r/heat/comments/18k88sc/jaime_jaquez_did_everything_he_could_to_get_them/
2024-10-13,1728849748,Duncan Robinson is Like That,,heat,18,https://www.reddit.com/r/heat/comments/1g2yfqn/duncan_robinson_is_like_that/
2024-08-25,1724597127,JRich is one of us,,heat,11,https://www.reddit.com/r/heat/comments/1f0xze5/jrich_is_one_of_us/
2024-05-29,1717018018,I dont care what the trade offers are. Keep Jimmy Mcbuckets,Jimmy brought us back to contenders again and his presence on the team is so beneficial.. no better leader to hype up our guys than Jimmy!!!,heat,208,https://www.reddit.com/r/heat/comments/1d3n65g/i_dont_care_what_the_trade_offers_are_keep_jimmy/
2024-05-24,1716591799,Jovic left Heat impressed after productive season: I often have to remind myself that Niko is 20 ,"Hes 20. So I always do need to remind myself of that, Spoelstra said. I hold him to an incredibly high standard because our standards are not going to change. Our expectations are always going to be championship-level expectations. Yes, Im expecting him to rise to that. Is he there now? No. Am I going to stop driving him and pushing him? No. But Ive been very encouraged by the progress that hes made, in particular in the last 12 months.


By the end of Jovics second NBA season, the 20-year-old started more regular-season games for the Heat than any other player his age or younger in franchise history. Jovic, who started his final 26 appearances of the regular season, started 38 games for the Heat this regular season before starting in each of the Heats five playoff games this season.

",heat,39,https://www.reddit.com/r/heat/comments/1czxx5v/jovic_left_heat_impressed_after_productive_season/
2024-04-21,1713720347,Doris Burke,"Why does she hate the heat so much.  It seems like every time she comments on a Heat game she always goes against the heat, she did it when we played the 76ers and now already on her bs now lmao.",heat,133,https://www.reddit.com/r/heat/comments/1c9netx/doris_burke/
2024-03-06,1709694089,NIKO WITH THE CULTURE TONIGHT =ã,,heat,24,https://www.reddit.com/r/heat/comments/1b7owxv/niko_with_the_culture_tonight/
2024-01-24,1706108709,Yall leave Caleb alone. Hes a good player and we still need him.,,heat,100,https://www.reddit.com/r/heat/comments/19ej5b8/yall_leave_caleb_alone_hes_a_good_player_and_we/
2024-07-19,1721378245,Dwyane Wade on Why Hes Overlooked in All-Time Discussions,,heat,69,https://www.reddit.com/r/heat/comments/1e6yw1v/dwyane_wade_on_why_hes_overlooked_in_alltime/
2024-07-04,1720120512,"The Heat offered Caleb Martin a multi-year contract extension before he opted out of a contract that would have paid him $7.1 million this season. In retrospect, Martins decision seems regrettable, because he apparently hasnt found similar money on the open market (@flasportsbuzz). ",,heat,69,https://www.reddit.com/r/heat/comments/1dveuwc/the_heat_offered_caleb_martin_a_multiyear/
2024-03-02,1709403647,"Tyler Herro is shooting 47.6% on 3 pointers from top of the key, which leads the NBA",,heat,41,https://www.reddit.com/r/heat/comments/1b4uuef/tyler_herro_is_shooting_476_on_3_pointers_from/
2024-01-15,1705351024,13 is player of the week,,heat,10,https://www.reddit.com/r/heat/comments/197j6js/13_is_player_of_the_week/
2024-07-15,1721069567,Bam Adebayo Locking up Patty Mills =,,heat,31,https://www.reddit.com/r/heat/comments/1e42t6m/bam_adebayo_locking_up_patty_mills/
2024-05-07,1715110002,KD trade potentially in the works,,heat,154,https://www.reddit.com/r/heat/comments/1cmkal7/kd_trade_potentially_in_the_works/
2024-04-25,1714010026,Shaq was on the =° ,,heat,3,https://www.reddit.com/r/heat/comments/1ccg1wp/shaq_was_on_the/
2024-03-17,1710703097,"Duncan Robinson Hits His 1000th 3, the Fastest Player to do it in NBA History!",,heat,10,https://www.reddit.com/r/heat/comments/1bh5xhg/duncan_robinson_hits_his_1000th_3_the_fastest/
2024-03-04,1709596771,WHAT ARE THEY FEEDING HIM?,,heat,43,https://www.reddit.com/r/heat/comments/1b6qiq1/what_are_they_feeding_him/
2024-01-16,1705375339,Heat Big 3 Tonight,Hopefully they can get more playing time together,heat,54,https://www.reddit.com/r/heat/comments/197smnr/heat_big_3_tonight/
2024-10-07,1728342265,Heat Nation& This mf Bam Adebayo has 5 3s in the first quarter at the scrimmage,,heat,31,https://www.reddit.com/r/heat/comments/1fyld4x/heat_nation_this_mf_bam_adebayo_has_5_3s_in_the/
2024-08-17,1723912568,That moment when you realize we can stop playing 65 guys at power forward ,,heat,32,https://www.reddit.com/r/heat/comments/1eulxp2/that_moment_when_you_realize_we_can_stop_playing/
2024-07-23,1721703781,THE CULTURE.,,heat,14,https://www.reddit.com/r/heat/comments/1e9xctd/the_culture/
2024-03-30,1711764757,LARGEST WIN IN FRANCHISE HISTORY!,,heat,8,https://www.reddit.com/r/heat/comments/1br6hfo/largest_win_in_franchise_history/
2024-03-08,1709905636,"Terry Rozier since returning from his knee injury (5 games): 19.2 points, 3.8 rebounds, 6.8 assists 48.6%/41.4%/93.3% shooting splits",,heat,46,https://www.reddit.com/r/heat/comments/1b9obd6/terry_rozier_since_returning_from_his_knee_injury/
2023-11-20,1700441639,Jimmy Butler sitting Courtside at the Sioux Fall Skyforce game vs Wisconsin Herd,,heat,22,https://www.reddit.com/r/heat/comments/17zc3yv/jimmy_butler_sitting_courtside_at_the_sioux_fall/
2024-07-24,1721785698,Congratulations to Coach Daniel Bisaccio!,"Just like our Head Coach Erik Spoelstra who started out as video coordinator and Assistant Coach/Player Development Eric Glass who previously served as video coordinator and coached our summer league teams in 2018 and 2019 that featured guys like Bam Adebayo, Duncan Robinson, Derrick Jones Jr, Tyler Herro and Kendrick Nunn.",heat,16,https://www.reddit.com/r/heat/comments/1eapgu1/congratulations_to_coach_daniel_bisaccio/
2024-06-12,1718160066,Alonzo Mourning Was at the Panthers Game Last Night (Game 2 Stanley Cup Finals),,heat,12,https://www.reddit.com/r/heat/comments/1ddw6yr/alonzo_mourning_was_at_the_panthers_game_last/
2024-02-09,1707515400,This Court was better than the present Culture design...change my mind,,heat,46,https://www.reddit.com/r/heat/comments/1amzo8c/this_court_was_better_than_the_present_culture/
2023-12-13,1702464852,Duncan Robinson repping,,heat,31,https://www.reddit.com/r/heat/comments/18he92f/duncan_robinson_repping/
2024-09-04,1725485052,Your Miami Heat NBA2K25 Face Scans,,heat,52,https://www.reddit.com/r/heat/comments/1f951rx/your_miami_heat_nba2k25_face_scans/
2024-08-17,1723852952,Bam Adebayo will win the 2024-25 NBA MVP award,"Heat fans, what do we think of this? I believe in Bam taking the next step this season, and I believe in him having an MVP run.",heat,75,https://www.reddit.com/r/heat/comments/1eu40h9/bam_adebayo_will_win_the_202425_nba_mvp_award/
2024-01-24,1706064127,Absolute music to my ears,,heat,38,https://www.reddit.com/r/heat/comments/19e6iv0/absolute_music_to_my_ears/
2023-12-21,1703128670,"Bam Adebayo: Duncan Robinson should be a leading candidate for Most Improved Player, for sure.",,heat,24,https://www.reddit.com/r/heat/comments/18nd08m/bam_adebayo_duncan_robinson_should_be_a_leading/
2024-05-11,1715446347,"Bam Adebayo is eligible for a supermax extension of 4-year, $245M if he makes an All-NBA team. (Its a 3-year, $165M if he doesnt make any All-NBA team).",,heat,85,https://www.reddit.com/r/heat/comments/1cplt4t/bam_adebayo_is_eligible_for_a_supermax_extension/
2024-04-19,1713562474,All you charmin soft trey styles from boyz in the hood punching the air ass doomers can go to bed early the diehards will be here to hold it down =$,,heat,48,https://www.reddit.com/r/heat/comments/1c88naa/all_you_charmin_soft_trey_styles_from_boyz_in_the/
2024-03-21,1710984722,Terry Rozier appreciation post,CLUTCH AS FUCK,heat,26,https://www.reddit.com/r/heat/comments/1bjunom/terry_rozier_appreciation_post/
2024-02-08,1707360903,"Tyler Herro with a game high tonight with 24pts, 6 reb, 7ast, 10/15 shooting and 4/7 from the three",,heat,53,https://www.reddit.com/r/heat/comments/1allgvb/tyler_herro_with_a_game_high_tonight_with_24pts_6/
2023-11-23,1700707912,[Post Game] Heat destroy the Cavs by 30+ | Lowry erupts from beyond the arc (7/9) with 28 PTS | Jaquez 22 PTS,"[box score](https://www.espn.com/nba/boxscore/_/gameId/401584857)
    
Eight Heat players in double digits 
    
# HAPPY THANKSGIVING!",heat,161,https://www.reddit.com/r/heat/comments/181r4px/post_game_heat_destroy_the_cavs_by_30_lowry/
2023-11-09,1699501312,=%,,heat,20,https://www.reddit.com/r/heat/comments/17r46n0/_/
2023-11-03,1698987806,Can we just take the time to appreciate how fucking good this guy is gonna be? League is fucked,,heat,110,https://www.reddit.com/r/heat/comments/17mninl/can_we_just_take_the_time_to_appreciate_how/
2024-10-21,1729547291,Report: Jimmy Butler will pass on contract extension even if Heat offer it according to Miami Herald,,heat,125,https://www.reddit.com/r/heat/comments/1g91tvy/report_jimmy_butler_will_pass_on_contract/
2024-07-05,1720187118,The Heat have expressed interest in Lauri Markkanen (@ZachLowe_NBA).,,heat,144,https://www.reddit.com/r/heat/comments/1dvyd8k/the_heat_have_expressed_interest_in_lauri/
2024-03-02,1709391059,As Fanbase we need to do a better Job at protecting our Players. Herro has no business being on a List like this,,heat,164,https://www.reddit.com/r/heat/comments/1b4pzkl/as_fanbase_we_need_to_do_a_better_job_at/
2023-12-17,1702783319,[Post Game] Heat WIN Heat WIN on Butler buzzer beater,"https://www.espn.com/nba/game/_/gameId/401584965
    
Heat win with Jimmy Butler buzzer beater (28pts)
    
Love with his best game 22pts, 7 reb
    
Duncan reaches 900 career triples. Fastest player to hit 900.",heat,170,https://www.reddit.com/r/heat/comments/18k8090/post_game_heat_win_heat_win_on_butler_buzzer/
2024-07-24,1721823208,Congratulations to Heat Lifer Coco Gauff on her selection as the USA flag bearer for the Olympics opening ceremony ,,heat,23,https://www.reddit.com/r/heat/comments/1eazxj8/congratulations_to_heat_lifer_coco_gauff_on_her/
2024-05-06,1715020748,Were gonna see this everywhere now smh ,Thoughts?,heat,64,https://www.reddit.com/r/heat/comments/1clqjqw/were_gonna_see_this_everywhere_now_smh/
2023-12-29,1703879253,The Dame trade really does not need to be discussed anymore,"Please Heat fans lets just leave the Blazers alone. Lets move on. Yes, I know the media and portland fans shit on our assets all summer and now they are performing well. The media is consistently wrong about the Heat so that is nothing new and Portland fans havent seen winning basketball in their lifetimes so why do we give a shit about their opinions? 

Another note is we havent really done anything this year yet, there's been clear improvement and I'm optimistic, but I dont think it's time for victory laps just yet. 

Anyway, fuck em. Lets go Heat!",heat,122,https://www.reddit.com/r/heat/comments/18tvmjt/the_dame_trade_really_does_not_need_to_be/
2024-04-05,1712356910,They say you a liability. They say Dunc should start over you. They say the offense dont need you. Every trade package has you included in it. How will you respond???,,heat,47,https://www.reddit.com/r/heat/comments/1bwvi62/they_say_you_a_liability_they_say_dunc_should/
2024-07-06,1720300310,[Team USA Basketball] Bam scores over Lebron,,heat,19,https://www.reddit.com/r/heat/comments/1dwzra0/team_usa_basketball_bam_scores_over_lebron/
2024-04-30,1714504239,"[Barry Jackson] Jaquez ruled out tomorrow for Heat. What they're missing -- Butler, Rozier, Duncan Robinson (available but not really, totally available because of irksome back issue), Jaquez and Josh Richardson - would probably be an Eastern playoff team if augmented by a good bench.",,heat,76,https://www.reddit.com/r/heat/comments/1ch0zvj/barry_jackson_jaquez_ruled_out_tomorrow_for_heat/
2024-03-14,1710453876,You assumed Luol Deng wouldnt appear on Reddit.,You were wrong. ,heat,15,https://www.reddit.com/r/heat/comments/1bexgna/you_assumed_luol_deng_wouldnt_appear_on_reddit/
2024-02-04,1707064426,Bruh& them poses tho =,,heat,168,https://www.reddit.com/r/heat/comments/1airwuu/bruh_them_poses_tho/
2024-01-24,1706134818,Tears in my eyes,,heat,26,https://www.reddit.com/r/heat/comments/19et3zl/tears_in_my_eyes/
2024-10-24,1729777719,Squad was NOT ready for the season,,heat,18,https://www.reddit.com/r/heat/comments/1gb3225/squad_was_not_ready_for_the_season/
2024-10-23,1729682326,Do the heat have a chance at a ring?,"The heat have a genuine chance at a great playoff run this year with bam being more of a perimeter threat now, Jaime developing nicely and Jimmy showing up with his regular hair=
",heat,37,https://www.reddit.com/r/heat/comments/1ga80po/do_the_heat_have_a_chance_at_a_ring/
2024-10-20,1729388455,The vibes are up but that side eye was crazy =,https://x.com/miamiheat/status/1847747985985220859?s=46&amp;t=8wijmCttUA_3P2p2L5HsyQ,heat,15,https://www.reddit.com/r/heat/comments/1g7o1rc/the_vibes_are_up_but_that_side_eye_was_crazy/
2024-02-25,1708888797,"Heat Nation (@HeatNationCom) no X - BREAKING: Jimmy Butler (one game), Nikola Jovic (one game) and Thomas Bryant (three games) have all been issued suspensions following the Heat-Pelicans altercation on Friday.",,heat,79,https://www.reddit.com/r/heat/comments/1azwa00/heat_nation_heatnationcom_no_x_breaking_jimmy/
2024-02-12,1707780591,nobody scared of this =-,,heat,38,https://www.reddit.com/r/heat/comments/1apehm4/nobody_scared_of_this/
2024-01-07,1704602039,Bam Adebayo throws shade at Darvin Ham: Spoelstra is never going to lower himself to blame guys being out if we lose. You got 15 guys in the roster for a reason.,,heat,37,https://www.reddit.com/r/heat/comments/190jphq/bam_adebayo_throws_shade_at_darvin_ham_spoelstra/
2023-12-21,1703170023,"Leaked footage of Joe Cronin calling the owners after trading Dame for a Bucks and Celtics 1RP and Rob Williams, instead of 24/5/5 Herro, top 5 rookie Jaquez, Jovic and 2 future Heat 1RPs",,heat,117,https://www.reddit.com/r/heat/comments/18noodz/leaked_footage_of_joe_cronin_calling_the_owners/
2023-11-22,1700640247,HoopsHype moved Juan Wick up the rookie ladder today... to #3 (!!!),,heat,77,https://www.reddit.com/r/heat/comments/18143ym/hoopshype_moved_juan_wick_up_the_rookie_ladder/
2024-05-21,1716263161,Tyler Herro's $13 Million Mansion for Sale in Miami,"https://www.treasurecoastmlssearch.com/blog/tyler-herros-13-million-mansion-sale-miami/

",heat,141,https://www.reddit.com/r/heat/comments/1cwyq5e/tyler_herros_13_million_mansion_for_sale_in_miami/
2024-07-11,1720656242,Bam says he cant wait to play with AD and Joel because hes never been able to be a 4 ,,heat,97,https://www.reddit.com/r/heat/comments/1e0b4gc/bam_says_he_cant_wait_to_play_with_ad_and_joel/
2024-06-30,1719765213,Pelles all-around game and defensive intensity are going to fit right in here =%,,heat,43,https://www.reddit.com/r/heat/comments/1ds5ha8/pelles_allaround_game_and_defensive_intensity_are/
2024-05-01,1714577858,NO NO NO NO WAIT WAIT WAIT,,heat,52,https://www.reddit.com/r/heat/comments/1chp6ug/no_no_no_no_wait_wait_wait/
2024-04-28,1714264033,Im torn>z,,heat,18,https://www.reddit.com/r/heat/comments/1cete3r/im_torn/
2024-04-06,1712411395,"Herro on coming off the bench:  Obviously, everybody knows Im a starter in the league. But like I said, to come back with six games left, its tough to just implement me into the lineup like that.","[From Anthony Chiang](https://www.miamiherald.com/sports/nba/miami-heat/article287423695.html)

&gt;Its not an easy decision. Obviously, everybody knows Im a starter in the league. But like I said, to come back with six games left, its tough to just implement me into the lineup like that. But ultimately, Im going to get starter minutes and thats all that matters. Im a starter, but Ill come off the bench for now.",heat,74,https://www.reddit.com/r/heat/comments/1bxc1di/herro_on_coming_off_the_bench_obviously_everybody/
2024-04-03,1712170298,I think we broke him. Someone hit the reset button,,heat,49,https://www.reddit.com/r/heat/comments/1bv0rjs/i_think_we_broke_him_someone_hit_the_reset_button/
2024-10-09,1728484941,Netflix series reveals pain and grief that Heats Jimmy Butler endured off court last season,,heat,75,https://www.reddit.com/r/heat/comments/1fzt1ll/netflix_series_reveals_pain_and_grief_that_heats/
2024-05-24,1716586686,=@,,heat,43,https://www.reddit.com/r/heat/comments/1czw1t2/_/
2024-04-30,1714444374,"Spo: Theres not a ton in the tank left defensively, we need to put up more points   I know in my heart, we have a game thats there, you know, its just a matter of the ball going in a few more times and all of a sudden it ignites and it just keeps on going.",,heat,84,https://www.reddit.com/r/heat/comments/1cghv2q/spo_theres_not_a_ton_in_the_tank_left_defensively/
2024-07-23,1721742783,Championship parade last night!,,heat,16,https://www.reddit.com/r/heat/comments/1ea8e22/championship_parade_last_night/
2024-04-01,1711938187,"The Heat reached 41 wins tonight, so its still just five losing seasons since Pat Riley arrived 29 years ago. I know thats not the big thing, but its definitely something.",,heat,19,https://www.reddit.com/r/heat/comments/1bss6gn/the_heat_reached_41_wins_tonight_so_its_still/
2024-02-14,1707935773,Niko GOAT journey incoming????,,heat,34,https://www.reddit.com/r/heat/comments/1aqu5bg/niko_goat_journey_incoming/
2023-12-27,1703650656,Sometimes the best deal is the deal you dont make&,,heat,41,https://www.reddit.com/r/heat/comments/18rrjjk/sometimes_the_best_deal_is_the_deal_you_dont_make/
2023-11-23,1700779111,Pat and Spo after failing to reel in a white whale to South Beach yet hitting on a star rook &amp; undrafted gem.,,heat,14,https://www.reddit.com/r/heat/comments/182cw2m/pat_and_spo_after_failing_to_reel_in_a_white/
2024-03-17,1710710946,"Ive seen enough. Make Bam shoot the 3 more often, Spo.",,heat,16,https://www.reddit.com/r/heat/comments/1bh97ds/ive_seen_enough_make_bam_shoot_the_3_more_often/
2024-02-15,1707963902,"[Post Game] Heat defeat Sixers before the All-Star break | Herro 23 pts, 7 reb, 7 ast | Bam 23 pts, 14 reb | Duncan adds 20 pts",[box score](https://www.espn.com/nba/boxscore/_/gameId/401585407),heat,193,https://www.reddit.com/r/heat/comments/1ar4uxm/post_game_heat_defeat_sixers_before_the_allstar/
2023-11-14,1699979554,"[Miami Heat on IG] ""All Duncan wanted for his birthday was an ice sculpture so he made one himself >v""",,heat,18,https://www.reddit.com/r/heat/comments/17v62bc/miami_heat_on_ig_all_duncan_wanted_for_his/
2024-05-08,1715196350,"The Heat are near the top of Donovan Mitchells wishlist, if he requests a trade this offseason from the Cavaliers, Mitchell has a strong bond with Bam Adebayo, and Miami is reportedly trying to find another star on a similar timeline as their All-Star center.  ",,heat,222,https://www.reddit.com/r/heat/comments/1cnd1wv/the_heat_are_near_the_top_of_donovan_mitchells/
2024-03-05,1709674450,This is easily the best roster in the Jimmy Butler era ,Imagine we had this roster in 2020 or 2022 easy 2 rings ngl =-,heat,68,https://www.reddit.com/r/heat/comments/1b7hb8l/this_is_easily_the_best_roster_in_the_jimmy/
2023-12-23,1703301944,The new splash brothers,,heat,34,https://www.reddit.com/r/heat/comments/18owikk/the_new_splash_brothers/
2024-10-09,1728438818,One-man block party ,,heat,16,https://www.reddit.com/r/heat/comments/1fzgmq2/oneman_block_party/
2024-02-05,1707155750,Being a Heat fan&,Whats yours?,heat,67,https://www.reddit.com/r/heat/comments/1ajmt3k/being_a_heat_fan/
2024-03-12,1710246051,Least accurate Tyler Herro calendar,,heat,57,https://www.reddit.com/r/heat/comments/1bcvwtu/least_accurate_tyler_herro_calendar/
2024-08-20,1724198023,BANG!!!!!!!!!!!!! TIE GAME WITH 5 SECONDS REMAINING!!!!!!!! THE SPURS DO NOT HAVE A TIMEOUT..........,,heat,18,https://www.reddit.com/r/heat/comments/1exazx2/bang_tie_game_with_5_seconds_remaining_the_spurs/
2024-04-26,1714156326,Can we wish this guy a happy 32nd birthday real fast.,,heat,33,https://www.reddit.com/r/heat/comments/1cdsu24/can_we_wish_this_guy_a_happy_32nd_birthday_real/
2024-04-20,1713576781,Heat vs. Celtics with no Jimbo?,,heat,12,https://www.reddit.com/r/heat/comments/1c8dv77/heat_vs_celtics_with_no_jimbo/
2024-02-21,1708540771,Story of the Bam/Lillard romance,,heat,10,https://www.reddit.com/r/heat/comments/1awjo6b/story_of_the_bamlillard_romance/
2024-08-25,1724548661,Time flies.,"2016, and 2024
Chris Bosh, and Goran Dragi",heat,7,https://www.reddit.com/r/heat/comments/1f0kt58/time_flies/
2024-07-23,1721702062,Josh Christopher is Your Summer League Finals MVP,,heat,10,https://www.reddit.com/r/heat/comments/1e9wstk/josh_christopher_is_your_summer_league_finals_mvp/
2024-07-09,1720550007,"Heat on Twitter: Yes, we have the selfies everyone is talking about =ø",,heat,18,https://www.reddit.com/r/heat/comments/1dz9u2o/heat_on_twitter_yes_we_have_the_selfies_everyone/
2024-05-04,1714840801,Jimmy Butler interviewed here at the Miami Grand Prix just now:  I love that this is here in Miami. A city I adore and that I love.,,heat,41,https://www.reddit.com/r/heat/comments/1ck4jau/jimmy_butler_interviewed_here_at_the_miami_grand/
2023-12-17,1702783380,Jimmy Butler game winner,,heat,18,https://www.reddit.com/r/heat/comments/18k80vj/jimmy_butler_game_winner/
2023-11-23,1700747130,And 64.7 3P%. We have a great player in a rookie contract for 4 years,,heat,44,https://www.reddit.com/r/heat/comments/1821iky/and_647_3p_we_have_a_great_player_in_a_rookie/
2024-06-17,1718585660,Dame and bam seen at Aces game =@,,heat,27,https://www.reddit.com/r/heat/comments/1dhlxoq/dame_and_bam_seen_at_aces_game/
2024-04-03,1712173765,New Jimmy Butler side quest just dropped ,,heat,19,https://www.reddit.com/r/heat/comments/1bv2ayy/new_jimmy_butler_side_quest_just_dropped/
2024-08-15,1723746367,NYTimes taste-tested celebrity coffees. Jimmy's Big Face won by a landslide.,,heat,35,https://www.reddit.com/r/heat/comments/1et2hwa/nytimes_tastetested_celebrity_coffees_jimmys_big/
