date_utc,timestamp,title,text,subreddit,comments,url
2023-11-25,1700883534,Miami heat when they enter the 4th quarter ahead in points.,,heat,12,https://www.reddit.com/r/heat/comments/183alzd/miami_heat_when_they_enter_the_4th_quarter_ahead/
2024-09-20,1726876627,The secret that Heat fans ignore ,We all know Duncan Robison played well for us last season and fans were noticing how better we were with him in the starting lineup& but did you also know this secret? The two times Miami Heat went to the NBA finals Duncan was our starting shooting guard. ,heat,42,https://www.reddit.com/r/heat/comments/1flq64j/the_secret_that_heat_fans_ignore/
2024-01-24,1706130666,New Miami Heat guard Terry Rozier has been cleared to make his debut tonight vs. the Grizzlies,,heat,47,https://www.reddit.com/r/heat/comments/19erf6m/new_miami_heat_guard_terry_rozier_has_been/
2023-11-15,1700020151,Undefeated in Haywood Locksmith starting era=$,,heat,25,https://www.reddit.com/r/heat/comments/17vkxcp/undefeated_in_haywood_locksmith_starting_era/
2024-10-20,1729451591,"Herro on IG: if you ain't riding for life, then id just rather ride alone",https://www.instagram.com/p/DBSIQRQRhzw/?igsh=ODUwdnp4b25mY2Nm,heat,31,https://www.reddit.com/r/heat/comments/1g86hi6/herro_on_ig_if_you_aint_riding_for_life_then_id/
2024-09-29,1727654122,You can always come back Caleb ,,heat,53,https://www.reddit.com/r/heat/comments/1fsibq4/you_can_always_come_back_caleb/
2024-04-20,1713622874,"Tyler Herro: I think honestly, we can just play free. Having Jimmy out and then being on the road, all the odds are against us, no one expects us to win. But I think things can change if we do get one in Boston. So, we're going to bring everything we can to try to get one.",,heat,66,https://www.reddit.com/r/heat/comments/1c8r5kw/tyler_herro_i_think_honestly_we_can_just_play/
2024-02-28,1709097900,"[Post Game] Heat take care of business on the second night of a back-to-back | Butler 22 pts, 9 ast, 2 blk | Rozier 19 pts on his return","[box score](https://www.espn.com/nba/game/_/gameId/401585470)
    
Heat win five in a row",heat,165,https://www.reddit.com/r/heat/comments/1b1y5kt/post_game_heat_take_care_of_business_on_the/
2023-12-14,1702522590,We have enough,,heat,63,https://www.reddit.com/r/heat/comments/18hypg4/we_have_enough/
2023-11-17,1700191894,Jimmy Butler on what has gone right in the 7-game winning streak: Haywood. -when asked why: Because hes starting.,,heat,28,https://www.reddit.com/r/heat/comments/17x5yn5/jimmy_butler_on_what_has_gone_right_in_the_7game/
2024-07-16,1721088272,"Hang his Jersey, hes a lifer already.",,heat,19,https://www.reddit.com/r/heat/comments/1e4af43/hang_his_jersey_hes_a_lifer_already/
2024-03-27,1711560202,Interesting,,heat,83,https://www.reddit.com/r/heat/comments/1bp7ha4/interesting/
2024-03-07,1709838238,Duncan Robinson High School Highlight of The Move,,heat,23,https://www.reddit.com/r/heat/comments/1b92nbw/duncan_robinson_high_school_highlight_of_the_move/
2024-03-03,1709493358,Jimmy Butler =¬=¨=%,,heat,9,https://www.reddit.com/r/heat/comments/1b5p9fx/jimmy_butler/
2024-01-21,1705874005,Former NBA player Terrence Ross comment on Paul Pierce saying UD jersey retirement was given,,heat,14,https://www.reddit.com/r/heat/comments/19cexst/former_nba_player_terrence_ross_comment_on_paul/
2024-08-30,1725052676,Bosh was voted most underrated. Who is the most overrated in Heat history?,Ill post the top five in the comments. Results are based off the total upvotes across comments for players.,heat,285,https://www.reddit.com/r/heat/comments/1f56glq/bosh_was_voted_most_underrated_who_is_the_most/
2024-08-16,1723819839,Heat Archive: Shane Battier drills 6 3 Pointers in Game 7 of the 2013 NBA Finals.,,heat,26,https://www.reddit.com/r/heat/comments/1etqsrb/heat_archive_shane_battier_drills_6_3_pointers_in/
2023-12-17,1702849999,LETS GOOOOOOOO,,heat,46,https://www.reddit.com/r/heat/comments/18ksbb9/lets_goooooooo/
2024-02-27,1709016186,So heres Jimmy Butler and Nikola Jovic watching the Heat game tonight while on suspension LOL,We need a buddy cop movie starring these two,heat,26,https://www.reddit.com/r/heat/comments/1b15cmb/so_heres_jimmy_butler_and_nikola_jovic_watching/
2024-01-20,1705722485,.,,heat,24,https://www.reddit.com/r/heat/comments/19b2ky4/_/
2024-01-24,1706055345,===,"All seriousness tho, Lowry did a lot for this team with his veteran presence and some solid playoffs moments. He also cant be blamed since hes getting old and lets be real if the Heat offered any of us that money were taking it in an instant. Thank you for everything kyle and good luck with the rest of your career",heat,14,https://www.reddit.com/r/heat/comments/19e3gd3/_/
2023-11-13,1699841962,"[Post Game] Heat come fighting back to extend the winning streak to five | Duncan 26 PTS, 4/7 from three | Bam 24 PTS, 11 REB","https://www.espn.com/nba/boxscore/_/gameId/401584812
    
Seven Heat players in double figures
    
Duncan Robinson puts on a masterpiece of a game. Drops ten in the fourth
    
Jrich makes some late game shots to end the game",heat,288,https://www.reddit.com/r/heat/comments/17u0h2d/post_game_heat_come_fighting_back_to_extend_the/
2023-11-12,1699810658,Year 7 Bam vs KG comparison =@,,heat,50,https://www.reddit.com/r/heat/comments/17tp7pc/year_7_bam_vs_kg_comparison/
2024-10-13,1728861045,Spo is a Menace,,heat,35,https://www.reddit.com/r/heat/comments/1g32e91/spo_is_a_menace/
2024-08-25,1724624087,This is Only But a Glimpse of the Kind of Leader That Goran Dragi Was | 2017 FIBA EuroBasket,"Goran was just built different, he was always strived to be great and nothing less than that.",heat,17,https://www.reddit.com/r/heat/comments/1f18gga/this_is_only_but_a_glimpse_of_the_kind_of_leader/
2024-07-11,1720736664,I hope these arent the jerseys we wearing next year.,"In my opinion these jerseys are terrible, the wholeheat culture thing shouldve been left in the drafts.",heat,89,https://www.reddit.com/r/heat/comments/1e11iiu/i_hope_these_arent_the_jerseys_we_wearing_next/
2024-06-30,1719785045,"[Charania] Free agent F/C Kevin Love is finalizing a two-year, $8 million-plus deal to return to the Miami Heat, sources tell @TheAthletic @Stadium.",,heat,54,https://www.reddit.com/r/heat/comments/1dscv7y/charania_free_agent_fc_kevin_love_is_finalizing_a/
2024-04-22,1713806891,NBA Players vote Spoelstra as the coach they most wanna play for- this can help the Heat land their next Star ,,heat,55,https://www.reddit.com/r/heat/comments/1cagpjl/nba_players_vote_spoelstra_as_the_coach_they_most/
2024-04-13,1712975116,Jimbo is happy,,heat,45,https://www.reddit.com/r/heat/comments/1c2r673/jimbo_is_happy/
2023-12-23,1703342586,"In the last 3 games while on the floor together (30 minutes), Herro and Robinson have an offensive rating of 156. Thats 34 points higher than the league leader Pacers",,heat,23,https://www.reddit.com/r/heat/comments/18p72xf/in_the_last_3_games_while_on_the_floor_together/
2024-04-16,1713285661,New NBA playoffs ad shamelessly steals Jimmy's flow without him on it,,heat,129,https://www.reddit.com/r/heat/comments/1c5kqqi/new_nba_playoffs_ad_shamelessly_steals_jimmys/
2024-02-28,1709140274,Jimmy Going Full Emo ,https://youtu.be/EOBJmhh5EGc?si=VnPumQTh2VsOebcb,heat,76,https://www.reddit.com/r/heat/comments/1b2bbtf/jimmy_going_full_emo/
2024-07-20,1721446473,Your Summer League Heat just made the playoffs!,,heat,23,https://www.reddit.com/r/heat/comments/1e7medr/your_summer_league_heat_just_made_the_playoffs/
2024-05-16,1715903094,How the Miami Heat offseason about to look in the next few months ,Cant wait HeatNation ,heat,73,https://www.reddit.com/r/heat/comments/1ctreoh/how_the_miami_heat_offseason_about_to_look_in_the/
2024-07-28,1722189085,=%,,heat,12,https://www.reddit.com/r/heat/comments/1eed9y4/_/
2024-02-15,1708039143,Report: People around NBA believe Nikola Jovic could be surprise weapon for Miami Heat in playoffs,,heat,73,https://www.reddit.com/r/heat/comments/1artgbl/report_people_around_nba_believe_nikola_jovic/
2024-08-07,1723065221,Kyle Guy is retiring from the game of basketball at 26.,https://basketnews.com/news-210290-kyle-guy-retires-from-basketball-at-26-moves-to-work-at-us-university.html,heat,34,https://www.reddit.com/r/heat/comments/1emnkjy/kyle_guy_is_retiring_from_the_game_of_basketball/
2024-07-31,1722455053,"Bam goes from screening for Curry at the 3pt line, to beating everyone for the rebound in the paint and dunking it",,heat,15,https://www.reddit.com/r/heat/comments/1egwemm/bam_goes_from_screening_for_curry_at_the_3pt_line/
2024-04-03,1712109604,[Post Game] Heat defeat the Knicks 109 - 99,[Box score](https://www.nba.com/game/nyk-vs-mia-0022301096/box-score),heat,186,https://www.reddit.com/r/heat/comments/1bugrm3/post_game_heat_defeat_the_knicks_109_99/
2024-02-09,1707502567,"Yes, today was a Terry Roziers first full Heat practice since he was acquired three weeks ago. Rozier said hes still looking for a spot to live in Miami.",,heat,55,https://www.reddit.com/r/heat/comments/1amuouj/yes_today_was_a_terry_roziers_first_full_heat/
2024-02-01,1706755674,[Post Game] Heat Snap Losing Streak Against Kings,"[box score](https://www.espn.com/nba/game/_/gameId/401585306)
     
Butler drops 31 points
    
Franchise high 40 team assists ",heat,280,https://www.reddit.com/r/heat/comments/1ag0ghk/post_game_heat_snap_losing_streak_against_kings/
2023-10-30,1698706140,>,,heat,32,https://www.reddit.com/r/heat/comments/17k63fb/_/
2023-10-29,1698547327,Jimmys reaction to crowd chanting Where is Jimmy?,,heat,23,https://www.reddit.com/r/heat/comments/17itjg4/jimmys_reaction_to_crowd_chanting_where_is_jimmy/
2024-07-22,1721620860,Summer League Finals tomorrow,Meme tag but true feelings,heat,10,https://www.reddit.com/r/heat/comments/1e951j1/summer_league_finals_tomorrow/
2024-07-20,1721445155,Kel'el Ware Finishes With 17 PTS/10 REB/4 STL/1 BLK/50 FG% in Miami Heat's 36 Point Summer League Victory Over Toronto Raptors | NBA Summer League,,heat,89,https://www.reddit.com/r/heat/comments/1e7m04a/kelel_ware_finishes_with_17_pts10_reb4_stl1_blk50/
2024-05-04,1714846647,Hypocrisy at its finest,,heat,34,https://www.reddit.com/r/heat/comments/1ck6q2x/hypocrisy_at_its_finest/
2024-04-26,1714159370,"Kevin Love: ""We're going to fight. We're going to give ourselves a chance. We're going to have a good game plan. We're going to pivot and figure things out. We're going to keep doing what's right, making the right play. ... You can never, ever count us out.""",,heat,30,https://www.reddit.com/r/heat/comments/1cdu29u/kevin_love_were_going_to_fight_were_going_to_give/
2024-02-12,1707701909,Shout-out to the dogs of the team,,heat,31,https://www.reddit.com/r/heat/comments/1aoodhq/shoutout_to_the_dogs_of_the_team/
2024-07-07,1720394583,The 44th Pick,,heat,48,https://www.reddit.com/r/heat/comments/1dxu2o3/the_44th_pick/
2024-03-06,1709748948,Barry Jackson on why Spo seems to hesitant on the Tyler-Duncan Starting Lineup swap: You risk losing Tyler mentally after all he's been through If you bench him after averaging 20 plus a game and shooting 40 percent on 3s this year. Don't see Spo doing that,Thoughts >?,heat,158,https://www.reddit.com/r/heat/comments/1b86uk1/barry_jackson_on_why_spo_seems_to_hesitant_on_the/
2024-02-29,1709226510,Who's your favorite player on the team besides Jimmy/Bam/JJJ,Duncan isn't some superstar or allstar but I just love the dude.,heat,113,https://www.reddit.com/r/heat/comments/1b35ftt/whos_your_favorite_player_on_the_team_besides/
2024-02-29,1709243827,"Throwback to when the Heat handed Denver their only home loss of the Finals, and also of the entire playoffs",,heat,41,https://www.reddit.com/r/heat/comments/1b3cnuk/throwback_to_when_the_heat_handed_denver_their/
2023-10-29,1698583315,Im emo. -Jimmy Butler,,heat,25,https://www.reddit.com/r/heat/comments/17j243a/im_emo_jimmy_butler/
2024-07-23,1721767435,=3,,heat,26,https://www.reddit.com/r/heat/comments/1eaijv3/_/
2024-06-08,1717826851,"""What do you do for a living?""  Jaime Jaquez Jr, wears a Rolex White Gold Yacht Master on OysterFlex (42MM)",source: @itzivtamir  https://www.tiktok.com/@itszivtamir/video/7377871407050444075?_t=8n1MNAqOD87&amp;_r=1,heat,47,https://www.reddit.com/r/heat/comments/1daw5lo/what_do_you_do_for_a_living_jaime_jaquez_jr_wears/
2024-04-20,1713580820,Remember remember,,heat,12,https://www.reddit.com/r/heat/comments/1c8f5uo/remember_remember/
2023-12-17,1702850759,Both Bam &amp; Tyler are cleared to play tomorrow =% via Miami Heat IG Account,,heat,45,https://www.reddit.com/r/heat/comments/18ksln5/both_bam_tyler_are_cleared_to_play_tomorrow_via/
2024-09-24,1727191023,Jimmy Butler on the red carpet for Starting 5 on Netflix coming October 9th,,heat,30,https://www.reddit.com/r/heat/comments/1foezwy/jimmy_butler_on_the_red_carpet_for_starting_5_on/
2024-03-22,1711099210,Spo could've ended WW2 in a year with a bunch of G-Leaguers,,heat,10,https://www.reddit.com/r/heat/comments/1bkv1hr/spo_couldve_ended_ww2_in_a_year_with_a_bunch_of/
2023-12-01,1701401159,"Jaime Jaquez Jr with season high 24pts, 5 reb, 1ast, 7/7 from the FT line and clutch after clutch shots in the 4th including this alley from Jrich late in the 4th.",,heat,72,https://www.reddit.com/r/heat/comments/1881q5s/jaime_jaquez_jr_with_season_high_24pts_5_reb_1ast/
2024-06-28,1719536241,Alonzo Mourning welcomes Kelel Ware to the Heat,,heat,22,https://www.reddit.com/r/heat/comments/1dq766k/alonzo_mourning_welcomes_kelel_ware_to_the_heat/
2024-06-25,1719284643,Wasn't A Hospital Run Either Like Boston Congratulations CHAMPS=@<Æ=$,,heat,36,https://www.reddit.com/r/heat/comments/1dnvy24/wasnt_a_hospital_run_either_like_boston/
2024-04-25,1714009214,Apologize ,,heat,23,https://www.reddit.com/r/heat/comments/1ccfrpc/apologize/
2024-03-28,1711588924,Michael Beasley says Bam Adebayo is the only player in the NBA whos beat him in a 1 on 1. Thats the only n**** that beat me& Yall dont know how good Bam is. (via @theOGsShow / youtu.be/nGwEPHm7RDc?si&),,heat,46,https://www.reddit.com/r/heat/comments/1bpj312/michael_beasley_says_bam_adebayo_is_the_only/
2024-07-10,1720635421,e,,heat,26,https://www.reddit.com/r/heat/comments/1e02t2t/_/
2023-11-23,1700710044,Cleveland how do u fuck this up this bad? NBA needs to fix this,,heat,105,https://www.reddit.com/r/heat/comments/181rszf/cleveland_how_do_u_fuck_this_up_this_bad_nba/
2024-08-06,1722908112,Durant wearing a Marlins cap in Paris,,heat,56,https://www.reddit.com/r/heat/comments/1el5cbs/durant_wearing_a_marlins_cap_in_paris/
2024-07-23,1721701320,Is This the Greatest Team Ever Assembled? I Think So!,,heat,43,https://www.reddit.com/r/heat/comments/1e9wjp4/is_this_the_greatest_team_ever_assembled_i_think/
2024-06-20,1718904680,"The Miami Heat Win Their First NBA Championship in Franchise History | June 20, 2006",,heat,31,https://www.reddit.com/r/heat/comments/1dkhemz/the_miami_heat_win_their_first_nba_championship/
2024-03-19,1710814046,Miss you guys =,,heat,32,https://www.reddit.com/r/heat/comments/1bi91cp/miss_you_guys/
2023-11-21,1700537914,Bam Adebayo over his last 8 games:,https://x.com/thedunkcentral/status/1726805879536640118?s=46&amp;t=Ko2laA3UahM4baOxGGOq4w,heat,54,https://www.reddit.com/r/heat/comments/1807mf7/bam_adebayo_over_his_last_8_games/
2023-11-21,1700531155,Jimmy Butler yelling SKY HOOK as he hits the running hook shot through the lane.,,heat,9,https://www.reddit.com/r/heat/comments/1805ehu/jimmy_butler_yelling_sky_hook_as_he_hits_the/
2024-04-18,1713409255,"[Charania] Miami Heat star Jimmy Butler is feared to have an MCL injury in his knee, sources tell @TheAthletic @Stadium. The injury could sideline Butler for an indefinite period. MRI to come.",,heat,296,https://www.reddit.com/r/heat/comments/1c6sz3h/charania_miami_heat_star_jimmy_butler_is_feared/
2023-12-25,1703513453,Could Miami Heats Jimmy Butler be a great NBA coach one day? #nba #miamiheat #jimmybutler,,heat,32,https://www.reddit.com/r/heat/comments/18qjdy6/could_miami_heats_jimmy_butler_be_a_great_nba/
2024-04-18,1713474849,Jimmy Butler comments under his injury update telling Oubre he wants to throw hands. ,,heat,40,https://www.reddit.com/r/heat/comments/1c7etwg/jimmy_butler_comments_under_his_injury_update/
2024-02-27,1709011113,Spo Masterpiece tonight,,heat,20,https://www.reddit.com/r/heat/comments/1b13uqy/spo_masterpiece_tonight/
2023-10-28,1698461315,Time to bring out the relevant graphic,,heat,58,https://www.reddit.com/r/heat/comments/17i4cnw/time_to_bring_out_the_relevant_graphic/
2024-04-24,1713989948,UD x 14,,heat,25,https://www.reddit.com/r/heat/comments/1cc8gpt/ud_x_14/
2024-06-29,1719620721,The Dragons Blessing =	,https://x.com/miamiheat/status/1806839123434430572?s=46&amp;t=8wijmCttUA_3P2p2L5HsyQ,heat,22,https://www.reddit.com/r/heat/comments/1dqyjj2/the_dragons_blessing/
2024-02-28,1709151696,"Terry Rozier says he is willing to adjust his game in order to win more games

Just understanding going from losing to winning, man. Whatever you gotta do to get over that hump to win, Im all for it. I dont care if I gotta play in the dunker every night, if I gotta set screens, Im all about winn",,heat,94,https://www.reddit.com/r/heat/comments/1b2gaij/terry_rozier_says_he_is_willing_to_adjust_his/
2024-01-10,1704853396,From the ground up& deserves every penny,,heat,13,https://www.reddit.com/r/heat/comments/192x2fs/from_the_ground_up_deserves_every_penny/
2024-02-14,1707879517,FREE JOVIC!!!!,Coach Spo Please dont bury this man back on the bench we need him for the title Run,heat,40,https://www.reddit.com/r/heat/comments/1aqci0p/free_jovic/
2023-11-23,1700708150,JAIME: 22/7/1 4/4 FROM 3,,heat,63,https://www.reddit.com/r/heat/comments/181r7j0/jaime_2271_44_from_3/
2024-03-25,1711333528,Most iconic moment of the Jimmy Era?,,heat,60,https://www.reddit.com/r/heat/comments/1bn2qeb/most_iconic_moment_of_the_jimmy_era/
2024-02-27,1709028852,Best Buyout Player Ever.,"I love, love. I hope he retires in South Beach.",heat,18,https://www.reddit.com/r/heat/comments/1b18h75/best_buyout_player_ever/
2024-02-27,1708998782,"Messis son wearing a Jimmy Butler jersey =>ñ<û>ò<ÿ>£",,heat,14,https://www.reddit.com/r/heat/comments/1b0zp4g/messis_son_wearing_a_jimmy_butler_jersey/
2024-02-01,1706756857,d,,heat,29,https://www.reddit.com/r/heat/comments/1ag0uy7/_/
2024-01-04,1704346299,Jaun Wick Cooks LeBron James,,heat,25,https://www.reddit.com/r/heat/comments/18y5efp/jaun_wick_cooks_lebron_james/
2023-12-17,1702790421,Delivered on his Promise =%,,heat,5,https://www.reddit.com/r/heat/comments/18k9zi8/delivered_on_his_promise/
2024-09-15,1726375459,"Bam Adebayo Gets One of the Biggest Blocks in Miami Heat Franchise History in Game 1 of the 2020 Eastern Conference Finals to Seal the Win Over the Boston Celtics | September 15th, 2020",,heat,23,https://www.reddit.com/r/heat/comments/1fh4m35/bam_adebayo_gets_one_of_the_biggest_blocks_in/
2024-05-02,1714615144,Finally free from watching this teams ugly ass boring offense ,1950s ass offense ,heat,49,https://www.reddit.com/r/heat/comments/1ci3x2v/finally_free_from_watching_this_teams_ugly_ass/
2023-11-12,1699757639,BAM: 26/17/4 WITH 2 BLOCKS AND A STEAL ON 75% SHOOTING,,heat,39,https://www.reddit.com/r/heat/comments/17tay2r/bam_26174_with_2_blocks_and_a_steal_on_75_shooting/
2023-10-31,1698769376,posted by jimmys friend on twitter then deleted,,heat,336,https://www.reddit.com/r/heat/comments/17koxrl/posted_by_jimmys_friend_on_twitter_then_deleted/
2024-06-03,1717439584,Am I tripping or does he kinda look like Jimmy Butler?,,heat,32,https://www.reddit.com/r/heat/comments/1d7bqle/am_i_tripping_or_does_he_kinda_look_like_jimmy/
2024-03-19,1710845957,Kyle flipping off his old teammates in the middle of a game =,,heat,14,https://www.reddit.com/r/heat/comments/1bihi24/kyle_flipping_off_his_old_teammates_in_the_middle/
2024-03-03,1709425692,JIMMY BUCKETS: 37/3/7 AND A STEAL AND A BLOCK ,,heat,13,https://www.reddit.com/r/heat/comments/1b53h25/jimmy_buckets_3737_and_a_steal_and_a_block/
2024-02-26,1708905935,Jovic responds to Jimmy,,heat,8,https://www.reddit.com/r/heat/comments/1b03d2g/jovic_responds_to_jimmy/
2023-12-26,1703559603,Jaime Jaquez is riding a wave like a durag right now,Hell of a call,heat,46,https://www.reddit.com/r/heat/comments/18qy1cb/jaime_jaquez_is_riding_a_wave_like_a_durag_right/
2023-11-17,1700191326,Worth every penny,"Wow. Just wow. This dude has been playing out of his fucking mind. That's it, I have to get a #55 jersey.",heat,27,https://www.reddit.com/r/heat/comments/17x5rxy/worth_every_penny/
2024-10-19,1729369230,"[Paul Pierce] Bam Adebayo  you can put him on anybody. He can switch on the point guard, hell be physical with your big. Hes probably the most versatile defender in the league. ",,heat,29,https://www.reddit.com/r/heat/comments/1g7hr06/paul_pierce_bam_adebayo_you_can_put_him_on/
2024-02-24,1708749727,Who wants to poke the bear next?,,heat,35,https://www.reddit.com/r/heat/comments/1ayltqf/who_wants_to_poke_the_bear_next/
2024-04-23,1713903731,Pat Riley dont mess around,,heat,33,https://www.reddit.com/r/heat/comments/1cbeury/pat_riley_dont_mess_around/
2024-06-15,1718419805,DONT GIVE US ONE,"FUCK BOSTON AND FUCK JAYLEN BROWN

MAVS ARE GOING TO DO IT, THEY HAVE THE CELTICS FIGURED OUT

HAHAHAHA

EAT SHIT BOSTON",heat,86,https://www.reddit.com/r/heat/comments/1dg85qu/dont_give_us_one/
2024-04-18,1713405198,"Please save us Scary Terry, we miss you",,heat,104,https://www.reddit.com/r/heat/comments/1c6rmzv/please_save_us_scary_terry_we_miss_you/
2024-10-24,1729793271,This disgrace right here,,heat,154,https://www.reddit.com/r/heat/comments/1gb96lh/this_disgrace_right_here/
2024-07-23,1721701062,[Post Game] The Heat defeat the Grizzlies in a OT thriller to win the 2024 Summer League Championship!,"**ESPN Box Score:** https://www.espn.com/nba-summer-league/game/_/gameId/401686911/league/nba-summer-las-vegas

POP THE CHAMPAGNE Y'ALL!!!",heat,138,https://www.reddit.com/r/heat/comments/1e9wgjo/post_game_the_heat_defeat_the_grizzlies_in_a_ot/
2024-05-27,1716823020,K-Nunn became the Euroleague champion with Panathinaikos. He averaged 16/2.7/2.3 at 46/41/96 shooting and 27 minutes per game.,,heat,47,https://www.reddit.com/r/heat/comments/1d1tvxp/knunn_became_the_euroleague_champion_with/
2024-03-26,1711418044,Love to see it,,heat,90,https://www.reddit.com/r/heat/comments/1bnvz5r/love_to_see_it/
2024-07-19,1721388583,The right way to pronounce Kel'el.,"Kel'el's name comes from Superman's birthname ""Kal-El"". Should the fanbase start giving him nicknames related to Superman??",heat,47,https://www.reddit.com/r/heat/comments/1e71gg1/the_right_way_to_pronounce_kelel/
2024-05-06,1715004227,"Heat culture was better as something that was shown through our play and alluded to, it never should've been marketed ","Sorry I just hate the fact we just kept on mentioning our ""culture""

Everybody knew the Miami heat was about business, hard work and grit. As soon as we put it on a jersey and started mentioning it in commercials heat culture lost its meaning in my opinion ",heat,64,https://www.reddit.com/r/heat/comments/1cljuvz/heat_culture_was_better_as_something_that_was/
2024-10-07,1728334598,[Miami Heat] From now on we'll be playing on Pat Riley Court at Kaseya Center,"Full Tweet:

From now on we'll be playing on Pat Riley Court at Kaseya Center <À
 
Well be dedicating our court and honoring Pat on Opening Night as he goes into his 30th season. Be in the building - gohe.at/3zWTVzi",heat,41,https://www.reddit.com/r/heat/comments/1fyieym/miami_heat_from_now_on_well_be_playing_on_pat/
2024-10-01,1727812936,Hit the ground running in our first practice back on the hardwood =ª,,heat,44,https://www.reddit.com/r/heat/comments/1ftxkxi/hit_the_ground_running_in_our_first_practice_back/
2024-07-11,1720698665,I REALLY want to see Jovic do this in a Heat uniform,,heat,58,https://www.reddit.com/r/heat/comments/1e0n1fq/i_really_want_to_see_jovic_do_this_in_a_heat/
2024-06-12,1718205625,"REPORT: Jimmy Butler doesnt want to play anywhere but Miami, per @ShamsCharania.  There are multiple teams out there that would give him an extension& The Heat dont want to trade him; he wants an extension. Will they give him an extension? Thats the question.",https://x.com/legionhoops/status/1800877712699248755?s=46,heat,295,https://www.reddit.com/r/heat/comments/1de99db/report_jimmy_butler_doesnt_want_to_play_anywhere/
2024-05-04,1714848263,"Jimmy Butler  If I was playing, Boston would be at home. New York Damn sure would be at home   Thibs, you want me, I dont want to beat you but I love you",,heat,118,https://www.reddit.com/r/heat/comments/1ck7but/jimmy_butler_if_i_was_playing_boston_would_be_at/
2024-04-26,1714153539,"Bam Adebayo: ""People still doubt us. People still think were not going to win the series, people still have their opinions about us. For us, we won one game. Its still first to four.",,heat,48,https://www.reddit.com/r/heat/comments/1cdroug/bam_adebayo_people_still_doubt_us_people_still/
2024-04-25,1714009070,lets go!!!!!!!!,,heat,14,https://www.reddit.com/r/heat/comments/1ccfpxk/lets_go/
2024-04-24,1713980086,They be hating on your name 14. They are saying you are a negative asset 14. Prove them wrong 14,,heat,125,https://www.reddit.com/r/heat/comments/1cc4bop/they_be_hating_on_your_name_14_they_are_saying/
2024-02-28,1709148102,Knock! Knock! Open up! ,You're next!,heat,32,https://www.reddit.com/r/heat/comments/1b2eqty/knock_knock_open_up/
2023-11-07,1699331203,Kyle got himself a hat as big as his ass,,heat,23,https://www.reddit.com/r/heat/comments/17pmaqm/kyle_got_himself_a_hat_as_big_as_his_ass/
2024-07-07,1720313086,"Kelel Ware in His Summer League Debut Had 12 Points, 6 Rebounds, and 5 Blocks",,heat,65,https://www.reddit.com/r/heat/comments/1dx45oh/kelel_ware_in_his_summer_league_debut_had_12/
