date_utc,timestamp,title,text,subreddit,comments,url
NA,NA,NA,NA,NA,NA,NA
2023-12-27,1703642590,Compilation of Giannis/Dame two man actions in the last 3 games,,MkeBucks,22,https://www.reddit.com/r/MkeBucks/comments/18rov3h/compilation_of_giannisdame_two_man_actions_in_the/
2023-12-24,1703444122,NBA on ESPN Instagram,,MkeBucks,2,https://www.reddit.com/r/MkeBucks/comments/18q1cns/nba_on_espn_instagram/
2023-11-18,1700311078,"Over the last 3 games the bucks are top 3 in points per game, defensive rating and offensive rating","I know the sample size is quite small at only 3 games, but expanding the sample size to 6 games (half the season) doesnt show much drop-off. Over the last 6 games the bucks are also top 10 in both offensive and defensive ratings. Its very encouraging to see that the bucks are playing like a top team both offensively and defensively. The stats can be seen here: https://www.statmuse.com/nba/ask/nba-team-defensive-rating-ranking-last-3-games.",MkeBucks,46,https://www.reddit.com/r/MkeBucks/comments/17y5m6v/over_the_last_3_games_the_bucks_are_top_3_in/
2023-11-14,1699998503,Grant Williams praising Celtics Killer Khris Middleton on the Kenny Beecham Podcast,,MkeBucks,9,https://www.reddit.com/r/MkeBucks/comments/17vd88u/grant_williams_praising_celtics_killer_khris/
2024-10-25,1729867055,OTD in 1987: The Milwaukee Bucks defeat the Soviet Union 127-100 to win the McDonald's Championship and $50K,,MkeBucks,12,https://www.reddit.com/r/MkeBucks/comments/1gbvrqd/otd_in_1987_the_milwaukee_bucks_defeat_the_soviet/
2024-09-02,1725306435,Generational aura ,,MkeBucks,4,https://www.reddit.com/r/MkeBucks/comments/1f7g0ae/generational_aura/
2024-08-07,1723063659,Pat Bev says hes happy to be playing basketball again instead of standing in the corner and being a role player with the Bucks ,"
",MkeBucks,88,https://www.reddit.com/r/MkeBucks/comments/1emmxo2/pat_bev_says_hes_happy_to_be_playing_basketball/
2024-05-03,1714702105,Ummmmmm . . . what??!!,,MkeBucks,9,https://www.reddit.com/r/MkeBucks/comments/1cixc62/ummmmmm_what/
2024-04-28,1714324433,Dogfred is ready for the fulfillment of the sacred prophecy: Bucks in 6!!!,,MkeBucks,19,https://www.reddit.com/r/MkeBucks/comments/1cfbhok/dogfred_is_ready_for_the_fulfillment_of_the/
2024-03-20,1710905849,"The Philadelphia 76ers plan to sign former Bucks first-round pick DJ Wilson to a 10-day contract, sources tell @TheAthletic @Stadium. The 6-foot-10 C/F has averaged 19.4 points, 9.5 rebounds and 4.8 assists for the Osceola Magic in the NBA G League this season.",,MkeBucks,29,https://www.reddit.com/r/MkeBucks/comments/1bj479u/the_philadelphia_76ers_plan_to_sign_former_bucks/
2024-03-05,1709609439,Bobby and Dame playing like Shaq and Kobe tonight! LFG GREAT WIN,,MkeBucks,3,https://www.reddit.com/r/MkeBucks/comments/1b6v88y/bobby_and_dame_playing_like_shaq_and_kobe_tonight/
2024-02-11,1707636591,Is it cool if I become a bucks fan because of Pat Bev?,"Big fan of basketball, but Ive never found a team to root for. Always just followed players more. Pat Bev has become my favorite player these last two seasons (guy is hilarious) is it cool if I join the bandwagon?",MkeBucks,47,https://www.reddit.com/r/MkeBucks/comments/1ao2g8e/is_it_cool_if_i_become_a_bucks_fan_because_of_pat/
2024-02-07,1707328458,"Windhorst on the Milwaukee Bucks: ""I was talking to a team just last night where they have been talking with Milwaukee and they were like 'They must have dozens of trade scenarios they have been pitching. Trying three-way deals, all kinds of stuff.",,MkeBucks,94,https://www.reddit.com/r/MkeBucks/comments/1al911h/windhorst_on_the_milwaukee_bucks_i_was_talking_to/
2023-12-20,1703100725,[Cherry-Picked Stat] Andre Jackson Jr. is second among all rookies in 3pt% this season (min. 1 3PA/g).,"Disrespectfully, StatMuse does not have an image for Ajax, so please enjoy the image of Cason Wallace, who is 1st among rookies at 50% (compared to Ajaxs 47.8%).",MkeBucks,16,https://www.reddit.com/r/MkeBucks/comments/18n31u5/cherrypicked_stat_andre_jackson_jr_is_second/
2023-12-14,1702558815,LEAKED Audio Of Pacers Refusing To Give Giannis Antetokounmpo The Game Ball: Keep That Ball,,MkeBucks,128,https://www.reddit.com/r/MkeBucks/comments/18i83se/leaked_audio_of_pacers_refusing_to_give_giannis/
2024-10-22,1729612254,2024-25... BEGIN!!!,,MkeBucks,7,https://www.reddit.com/r/MkeBucks/comments/1g9lfs2/202425_begin/
2024-05-04,1714782330,Shout out Pat Bev,"Nobody is talking about the Bucks losing a series, all the talk is on him being a shit head (which is deserved).",MkeBucks,26,https://www.reddit.com/r/MkeBucks/comments/1cjnhbh/shout_out_pat_bev/
2024-03-10,1710106222,BELT2A$$2: ELECTRIC BOOGALOO - BUCKS TAKE THE CLIPS PARTY,,MkeBucks,2,https://www.reddit.com/r/MkeBucks/comments/1bblovs/belt2a2_electric_boogaloo_bucks_take_the_clips/
2024-03-07,1709847029,"Khris Middleton on his sprained ankle, recovery and being there to 'cheer my guys on'",,MkeBucks,20,https://www.reddit.com/r/MkeBucks/comments/1b960b5/khris_middleton_on_his_sprained_ankle_recovery/
2024-01-18,1705599310,"Maaaan, what is this =-",,MkeBucks,32,https://www.reddit.com/r/MkeBucks/comments/199vo09/maaaan_what_is_this/
2023-12-14,1702528541,Instant classic,,MkeBucks,4,https://www.reddit.com/r/MkeBucks/comments/18i0igj/instant_classic/
2023-11-25,1700931192,Noticing a trend here,,MkeBucks,9,https://www.reddit.com/r/MkeBucks/comments/183nyly/noticing_a_trend_here/
2024-10-15,1728954494,"""Physical taunting"" called on #34",,MkeBucks,47,https://www.reddit.com/r/MkeBucks/comments/1g3vxxn/physical_taunting_called_on_34/
2024-06-24,1719236639,"[HoppsHype] Bobby Portis and Pat Connaughton are available on the trade market, per @MikeAScotto ","Rival executives have also come away with the sense that Bobby Portis and Pat Connaughton are available on the trade market if Milwaukee can make a notable win-now upgrade. Both players, however, have been mentioned as possible trade candidates in the past, and nothing has come of it. Portis finished as a Sixth Man of the Year finalist for the second straight year.",MkeBucks,62,https://www.reddit.com/r/MkeBucks/comments/1dndtlf/hoppshype_bobby_portis_and_pat_connaughton_are/
2024-06-13,1718287960,I will not be giving this organization any of my attention next year unless they make this one move.,"BRING BACK BLIMP BANGO.
",MkeBucks,11,https://www.reddit.com/r/MkeBucks/comments/1dezzja/i_will_not_be_giving_this_organization_any_of_my/
2024-04-24,1713927321,Jae,"I actually took a solid amount of positives from the game.  Pat still has some playoff juice and did a little finishing.  AJ Green is a stamped playoff rotation member.  Dame is still Dame (hes real and hes spectacular)

Not even gonna touch on Bobbys stinker (it happens for him).  

But holy shit Jae Crowder is completely useless out there.  He provides exactly 0 skills useful in this playoff series.  He cant defend at all high level, he cant shoot at a high level, hes not athletic in the least (I am certain he cant dunk), and he turned the ball over one of the few times he tried to actively make something happen.  I do not give one single fuck that Ajax is a rookie and hasnt played.  I know that Ajax can rebound, defend, and get back in transition.  The Bucks cant play a guy who does NOTHING at even a remotely high level.  They especially cant do that when Giannis is out.  Unserious to play Jae Crowder.  Plz stop doing it.",MkeBucks,82,https://www.reddit.com/r/MkeBucks/comments/1cbnpcr/jae/
2024-03-15,1710469683,AJ Green says the 76ers are worth about $3.50,,MkeBucks,7,https://www.reddit.com/r/MkeBucks/comments/1bf3anm/aj_green_says_the_76ers_are_worth_about_350/
2024-02-09,1707444158,Update: Robin Lopez is reading Backstory 2 Interviews with Screenwriters of the 1940s and 50s,,MkeBucks,13,https://www.reddit.com/r/MkeBucks/comments/1amcu6p/update_robin_lopez_is_reading_backstory_2/
2024-01-25,1706153105,oh captain my captain,,MkeBucks,7,https://www.reddit.com/r/MkeBucks/comments/19ezpjp/oh_captain_my_captain/
2024-01-25,1706152607,Any reason the bucks don't just want to roll with PruntDawg?,"All this doc rivers nonsense got me thinking. I think the doc is a little overhated if we are being honest. People forget ben simmons completly forgot how to play basketball that one series. But why is the front office refusing to just ride the season out with the pruntster? There are plenty of reasons to stick with PruntCity:

\-Overachieved that one year when kidd got fired (21-16, albeit they won 60 the next year but there was holes on that team the year prior)

\- Has already stepped in rather successfully for multiple coaches... J-Kidd post DUI, J-Kidd post hip injury, J-Kidd post firing, McMillian (twice actually), now AG... also has served as a national team head coach for both the US and Great Britian (according to wikipedia). He is used to this like no other coach in the free agency pool is. Going to start 1-0 here btw.

\-Won three titles with the spurs as an assistant, was on multiple 60 win teams in dallas, has experience with championship caliber teams...usually this is enough to get assistants head coaching looks, apparently not for Big Game Joe.

\-Milwaukee cult hero

\-He has a cool, suave, slicked back hair look which is a relfection of the grace, elegance, and urgency his teams play with

&amp;#x200B;

&amp;#x200B;",MkeBucks,50,https://www.reddit.com/r/MkeBucks/comments/19ezjvv/any_reason_the_bucks_dont_just_want_to_roll_with/
2024-01-12,1705030723,"Dame, Giannis and Khris before the game",,MkeBucks,16,https://www.reddit.com/r/MkeBucks/comments/194la2n/dame_giannis_and_khris_before_the_game/
2023-12-17,1702786536,Giannis vs Joel Embiid foul comparison =- (aka two of the biggest free throw merchants according to the casual NBA fan),Had to include the last clip because it pretty much sums up the whole thing =-,MkeBucks,36,https://www.reddit.com/r/MkeBucks/comments/18k8wdi/giannis_vs_joel_embiid_foul_comparison_aka_two_of/
2023-12-15,1702622820,"One of the few times I fully agree with Stephen A Smith - his ""ballgate"" thoughts",,MkeBucks,57,https://www.reddit.com/r/MkeBucks/comments/18iu1e4/one_of_the_few_times_i_fully_agree_with_stephen_a/
2023-12-14,1702529906,"Oh how the tables have turned, and the Pacers handled it so well&",,MkeBucks,8,https://www.reddit.com/r/MkeBucks/comments/18i0wqj/oh_how_the_tables_have_turned_and_the_pacers/
2023-11-22,1700664684,Please drive safely!!! Bobby loves you!,,MkeBucks,27,https://www.reddit.com/r/MkeBucks/comments/181auc5/please_drive_safely_bobby_loves_you/
2023-11-20,1700456820,Dame in the Clutch,"This year in clutch time (last 5:00 of games within 5 points) Dame is:

* [#1 in total points scored (39)](https://www.nba.com/stats/players/clutch-traditional?PerMode=Totals&amp;dir=A&amp;sort=PTS&amp;GameSegment=Second+Half)

* [#1 in average points scored (7.8)](https://www.nba.com/stats/players/clutch-traditional?GameSegment=Second%20Half&amp;PerMode=PerGame&amp;dir=A&amp;sort=PTS)

* [17/18 on FT](https://www.nba.com/stats/players/clutch-traditional?GameSegment=Second%20Half&amp;PerMode=Totals&amp;dir=A&amp;sort=PTS)

* [Total box +/- of +30](https://www.nba.com/stats/players/clutch-traditional?GameSegment=Second%20Half&amp;PerMode=Totals&amp;dir=A&amp;sort=PTS)

* [0 Turnovers](https://www.nba.com/stats/players/clutch-traditional?GameSegment=Second%20Half&amp;PerMode=Totals&amp;dir=A&amp;sort=PTS)

* 5-0 record",MkeBucks,16,https://www.reddit.com/r/MkeBucks/comments/17zgxwc/dame_in_the_clutch/
2024-09-12,1726178603,Junior Bridgeman is set to buy a 10% stake in the Milwaukee Bucks,"The former Milwaukee Buck and current owner of both Ebony and Jet Magazines is paying $340m for a minority share in the Bucks.  Bridgeman's ten percent ownership comes at a 15% discount as the Bucks currently vaulation is $4b.

[https://www.cnbc.com/2024/09/12/junior-bridgeman-buying-stake-in-milwaukee-bucks-team-valued-at-4-billion.html](https://www.cnbc.com/2024/09/12/junior-bridgeman-buying-stake-in-milwaukee-bucks-team-valued-at-4-billion.html)",MkeBucks,10,https://www.reddit.com/r/MkeBucks/comments/1ffeqtj/junior_bridgeman_is_set_to_buy_a_10_stake_in_the/
2024-09-08,1725809377,"Ersan 0lyasova takes home Best Role Player and ends our grid. Its been a pleasure r/MkeBucks, here are our GOATs - are there any changes youd make? Any glaring omissions?",,MkeBucks,34,https://www.reddit.com/r/MkeBucks/comments/1fc0gcy/ersan_ilyasova_takes_home_best_role_player_and/
2024-06-17,1718659257,Iron sharpens iron ,,MkeBucks,23,https://www.reddit.com/r/MkeBucks/comments/1di9d53/iron_sharpens_iron/
2024-06-13,1718282313,I will not be watching next year unless serious changes are made.,"Build a canon with multiple barrels filled with bratwurst. The only way you eat this piece of meat is through great hand eye coordination and staying in front of it while considering the trajectory and all the guys around you trying to catch the brat.  Bucks promotions team needs to be more delicious. Stop shooting t-shirts into the crowd. Stop running the dunk team as a way to pump up the crowd, the bratzooka is a multifaceted promotion and the Bucks could use it in a better setting, like having Bango repel upside down Mission Impossible style while shooting kids with slightly 
warm wursts.  T-shirts, hats, + 2 bobblehead nights should be gone next season. The path to contention is putting the brats in that big t-shirt canon and resurrecting the legacy of the Bratzooka.",MkeBucks,31,https://www.reddit.com/r/MkeBucks/comments/1dexz67/i_will_not_be_watching_next_year_unless_serious/
2024-02-23,1708705977,Theyre still just pups,,MkeBucks,9,https://www.reddit.com/r/MkeBucks/comments/1ay4us9/theyre_still_just_pups/
2024-01-21,1705860558,"Welcome to r/MkeBucks, depressed Packers fans!",,MkeBucks,22,https://www.reddit.com/r/MkeBucks/comments/19c9j9w/welcome_to_rmkebucks_depressed_packers_fans/
2024-01-10,1704928240,Dame is playing Thursday vs the Celtics!,"Dame was back, in good spirits and practiced today, Griffin said Wednesday. Hell be available.",MkeBucks,66,https://www.reddit.com/r/MkeBucks/comments/193m8em/dame_is_playing_thursday_vs_the_celtics/
2023-12-17,1702832864,Were up against a real defense tonight.,"In their last five games, the Rockets have not gave up more than 106 points. Their defensive rating is 2nd in the league. Im excited to see how they match up against us.",MkeBucks,36,https://www.reddit.com/r/MkeBucks/comments/18klvbr/were_up_against_a_real_defense_tonight/
2023-11-09,1699495936,The Mayor lights it up in the 1st half,,MkeBucks,4,https://www.reddit.com/r/MkeBucks/comments/17r2eci/the_mayor_lights_it_up_in_the_1st_half/
2024-07-08,1720430219,Giannis on being the probable flag bearer for Greece during the opening ceremony in Paris,,MkeBucks,20,https://www.reddit.com/r/MkeBucks/comments/1dy4gwh/giannis_on_being_the_probable_flag_bearer_for/
2024-05-30,1717080270,"[Random Highlight] In front of a raucous Bradley Center crowd in the 2001 ECSF, Baron Davis hits a 3 late in the 3rd quarter&but Big Dog answers right back to beat the buzzer - 5/20/01",,MkeBucks,34,https://www.reddit.com/r/MkeBucks/comments/1d45q9u/random_highlight_in_front_of_a_raucous_bradley/
2024-04-20,1713652410,The Bucks just simply need to not shower for the entirety of the playoffs ,"Its famously known among former NBA players that Drazen Petrovic was so hard to guard because of his bad stench. Maybe his horrible musk that made him unguardable turned him into the great shooter he became. 

If the Bucks simply just dont shower or wash their jerseys, itll be smooth sailing throughout the playoffs. ",MkeBucks,22,https://www.reddit.com/r/MkeBucks/comments/1c92hjp/the_bucks_just_simply_need_to_not_shower_for_the/
2024-03-20,1710966114,Its Gaem Dae. Buck Foston. Lets do this again. ,,MkeBucks,8,https://www.reddit.com/r/MkeBucks/comments/1bjnbxw/its_gaem_dae_buck_foston_lets_do_this_again/
2024-03-19,1710814984,I need me one of these =% ,,MkeBucks,17,https://www.reddit.com/r/MkeBucks/comments/1bi9d3x/i_need_me_one_of_these/
2024-03-05,1709610242,The Milwaukee Bucks are 6-0 in the Danilo Gallinari Era,,MkeBucks,8,https://www.reddit.com/r/MkeBucks/comments/1b6vi96/the_milwaukee_bucks_are_60_in_the_danilo/
2024-02-16,1708126924,"Hey! Sixers fan here, can we have Pat Bev back? Pretty please? This brother is ass.",,MkeBucks,33,https://www.reddit.com/r/MkeBucks/comments/1asnbd3/hey_sixers_fan_here_can_we_have_pat_bev_back/
2024-01-29,1706542988,Today begins the toughest 10-day stretch on the Bucks schedule.,"Today the Bucks begin a grueling 8-day road trip with games in Denver, Portland, a Utah/Dallas B2B, and Phoenix, all before coming back to Fiserv to face the Timberwolves on 2/8. 

Before the doomers and media feast on any and every loss, remind yourselves that we have a brand new head coach who is starting at the hardest possible moment. That being said, were still 2nd in the East, and we still have Giannis and Dame. 

Bucks in 6!",MkeBucks,47,https://www.reddit.com/r/MkeBucks/comments/1ady9w0/today_begins_the_toughest_10day_stretch_on_the/
2023-12-24,1703419195,"Dont look now, but the Bucks defensive rating is now tied for 16th in the league","After a horrendous start to the season defensively after the first five games (27th in defensive rating), they have the 13th best defensive rating since the Knicks game on 11/4.

They have been hovering around 22nd-19th range for the majority of the season, but after yesterdays games, they are now tied for 16th and trending upwards. In December alone, they are tenth in defensive rating along with the second best offensive rating (BOS is first after they demolished the LAC).

If this trend continues, MIL has a chance at being a top ten defense by years end and all the negative talk early in the season goes down the drain.",MkeBucks,59,https://www.reddit.com/r/MkeBucks/comments/18ptwsd/dont_look_now_but_the_bucks_defensive_rating_is/
2023-12-20,1703055043,Dame approaching the top 50 All Time leaders in points,,MkeBucks,20,https://www.reddit.com/r/MkeBucks/comments/18mocoj/dame_approaching_the_top_50_all_time_leaders_in/
2023-11-30,1701377268,Reminder that Dogfred is officially banned from Chicago,"After a successful raid on Chicago turf last year, Mayor Lightfoot issued a decree that Dogfred is banned from Chicago, a decree that has not been rescinded by the current Chicago Mayor. Dogfred's official stance on the matter is that his only challenge was getting to Milwaukee to watch more Bucks games live. A goal he has now accomplished. He's not currently in search of any new challenges.",MkeBucks,19,https://www.reddit.com/r/MkeBucks/comments/187spfe/reminder_that_dogfred_is_officially_banned_from/
2023-11-16,1700148905,Dame should run the offense,"Giannis needs to let Dame bring the ball up and run the offense. Yesterday, the offense looked like it flowed alot better than usual. Giannis and Dame pick n roll would be \*Chef's Kiss\*",MkeBucks,59,https://www.reddit.com/r/MkeBucks/comments/17wpqwn/dame_should_run_the_offense/
2024-07-17,1721257948,Remember when lakers fan tried to compare bronny to aj Johnson lmao ==,,MkeBucks,42,https://www.reddit.com/r/MkeBucks/comments/1e5we2f/remember_when_lakers_fan_tried_to_compare_bronny/
2024-06-29,1719681458,Drew Dame Time,"Bro! I struggle with my English; help me, please. In return, I am willing to draw more about the Bucks, even your guys. Thanks 
",MkeBucks,9,https://www.reddit.com/r/MkeBucks/comments/1drg3op/drew_dame_time/
2024-06-19,1718775824,"People saying trade Brook or trade Pat need to have a realistic proposal in mind, otherwise its just whining.","The Bucks need to trade old guys like Brook or Pat for younger, more athletic players is a take I see all the time on this subreddit/Twitter and its getting on my nerves.

No team is going to give us a good young big for Lopez because hes 36 and on an expiring contract. No team is going to give us a good young wing for Pat because hes fallen off a lot since his wrist injury and turning 32 next season.

If people have realistic trade ideas for older veterans on the Bucks, it would be very interesting to talk about them, but otherwise I propose an indefinite moratorium on Trade old guys for better younger players talk.",MkeBucks,106,https://www.reddit.com/r/MkeBucks/comments/1djbq8u/people_saying_trade_brook_or_trade_pat_need_to/
2024-04-27,1714257157,In light of Damian Lillard news...,,MkeBucks,9,https://www.reddit.com/r/MkeBucks/comments/1ceqxdp/in_light_of_damian_lillard_news/
2024-03-23,1711174390,Blazers fan,"As a blazers loyalist and a huge fan of Dame, it brings me great joy seeing all you bucks fans loving and praising Dame. Yall better win this championship and celtics can suck my balls! 

HUGE FAN OF YALLS FANBASE dddd",MkeBucks,17,https://www.reddit.com/r/MkeBucks/comments/1blld1v/blazers_fan/
2024-02-22,1708627285,I guess we should join the party...,,MkeBucks,29,https://www.reddit.com/r/MkeBucks/comments/1axe1lp/i_guess_we_should_join_the_party/
2024-02-11,1707629103,Sometimes you need those get right games,,MkeBucks,9,https://www.reddit.com/r/MkeBucks/comments/1ao0fiy/sometimes_you_need_those_get_right_games/
2024-01-26,1706301723,"[Reiter] Doc Rivers will not make his debut tonight as the Milwaukee Bucks head coach, a sources tells @CBSSports . Joe Prunty remains the interim head coach.",,MkeBucks,47,https://www.reddit.com/r/MkeBucks/comments/1absd6c/reiter_doc_rivers_will_not_make_his_debut_tonight/
2024-06-27,1719461229,Sometimes we laugh at our younger selves& =,,MkeBucks,23,https://www.reddit.com/r/MkeBucks/comments/1dpib78/sometimes_we_laugh_at_our_younger_selves/
2024-05-03,1714777693,ESPN bans Patrick Beverley from any collaboration after rude incident with reporter,,MkeBucks,36,https://www.reddit.com/r/MkeBucks/comments/1cjlwnj/espn_bans_patrick_beverley_from_any_collaboration/
2024-05-02,1714686535,Dame walking in about to drop 50 on they ass,,MkeBucks,33,https://www.reddit.com/r/MkeBucks/comments/1cirv0i/dame_walking_in_about_to_drop_50_on_they_ass/
2024-04-11,1712879018,Not sure theyll ever let Giannis win another MVP,"Thats alright, let him win some more FMVPs",MkeBucks,86,https://www.reddit.com/r/MkeBucks/comments/1c1u7oz/not_sure_theyll_ever_let_giannis_win_another_mvp/
2024-02-14,1707921158,"Happy Valentines Day, Bucks fans!",,MkeBucks,15,https://www.reddit.com/r/MkeBucks/comments/1aqo8wy/happy_valentines_day_bucks_fans/
2024-02-08,1707428195,Soothsayer Pat Bev,,MkeBucks,11,https://www.reddit.com/r/MkeBucks/comments/1am6zc8/soothsayer_pat_bev/
2024-01-16,1705441372,The missing piece has been found,,MkeBucks,8,https://www.reddit.com/r/MkeBucks/comments/198eun7/the_missing_piece_has_been_found/
2023-12-14,1702531418,"[Brew Hoop] Giannis, on if he has the game ball: ""I have no idea, not gonna lie. I don't know. I really don't know. I have a ball but I don't know if it's the game ball... it feels like a brand new ball.""",,MkeBucks,54,https://www.reddit.com/r/MkeBucks/comments/18i1c9l/brew_hoop_giannis_on_if_he_has_the_game_ball_i/
2023-11-29,1701230215,"FIRST ON GROUP B EAST, CLINCHED NBA CUP PLAYOFF UPVOTE PARTY","the bucks literally 4-0'd group B with huge points diff, beat the Heat last game group stage, and there's no hype around. 


MAKE SOME NOISE FOLKS, BUCKS IN SIX",MkeBucks,19,https://www.reddit.com/r/MkeBucks/comments/186g91e/first_on_group_b_east_clinched_nba_cup_playoff/
2023-11-02,1698893800,"Former Virtus Bologna coach and current Spain NT coach Sergio Scariolo has received a proposal from the Milwaukee Bucks to return to the NBA and serve as Adrian Griffins first assistant coach, as reported by Superbasket.",,MkeBucks,38,https://www.reddit.com/r/MkeBucks/comments/17ltwre/former_virtus_bologna_coach_and_current_spain_nt/
2024-10-24,1729785772,Brook Lopez's 6 blocks are the most in a Bucks season opener since Alton Lister in 1983  Kareem Abdul-Jabbar (9) holds the record (of course he does),,MkeBucks,10,https://www.reddit.com/r/MkeBucks/comments/1gb66rm/brook_lopezs_6_blocks_are_the_most_in_a_bucks/
2024-09-03,1725402211,Sid the Squid,,MkeBucks,10,https://www.reddit.com/r/MkeBucks/comments/1f8d7ch/sid_the_squid/
2024-07-10,1720611787,Brother love,,MkeBucks,11,https://www.reddit.com/r/MkeBucks/comments/1dzto8o/brother_love/
2024-04-25,1714067094,"[Nehm] What was Giannis Antetokounmpo able to do today? Doc Rivers: ""Yeah, he did a lot of floor stuff today. Probably the most I've seen."" Just walking/jogging? Rivers: ""He was shooting and moving today."" Rivers also mentioned that Antetokounmpo was unable to do anything live though.",,MkeBucks,52,https://www.reddit.com/r/MkeBucks/comments/1ccxd9g/nehm_what_was_giannis_antetokounmpo_able_to_do/
2024-04-22,1713752488,"dame has averaged 0 points in the second half in the playoffs, is he washed?",,MkeBucks,22,https://www.reddit.com/r/MkeBucks/comments/1c9zhct/dame_has_averaged_0_points_in_the_second_half_in/
2024-02-27,1709061164,Is It Dame Time?,"A while back, a couple buddies and I had an idea to make a site tracking if and when it was Dame Time, so we built it. We launched last year towards the end of the season, then Dame was benched, then traded& Even though we designed everything with that eventuality in mind and planned to keep it going, as a Blazer fan, the wounds were too deep at the beginning of the season. However, were back!

Im proud to introduce the Bucks faithful to our silly little passion project [isitdametime.com](https://www.isitdametime.com/). Now reskinned for the Milwaukee Bucks!

If you have a moment, take a look. Its just a little thing, but we hope you enjoy it. Were looking forward to flipping that Dame Time switch many times through the rest of the season!",MkeBucks,27,https://www.reddit.com/r/MkeBucks/comments/1b1k6fi/is_it_dame_time/
