date_utc,timestamp,title,text,subreddit,comments,url
2023-11-21,1700530136,"[Melanie Ricks] And with that bucket, Khris Middleton has passed Sidney Moncreif to become the franchises 4th all-time leading scorer.",,MkeBucks,4,https://www.reddit.com/r/MkeBucks/comments/180526g/melanie_ricks_and_with_that_bucket_khris/
2023-11-02,1698931727,"So far this season, Lillard and Antetokounmpo have run 29 picks together, which ranks 61st among combos leaguewide. Seems underused!",,MkeBucks,87,https://www.reddit.com/r/MkeBucks/comments/17m3hw0/so_far_this_season_lillard_and_antetokounmpo_have/
2024-10-04,1728079227,Future Star ,,MkeBucks,16,https://www.reddit.com/r/MkeBucks/comments/1fwb21i/future_star/
2024-05-22,1716345486,"As much as I hate the pacers, fuck the Celtics more ",Anyone else feelin this way? Also think that theyre the easier team for whoever comes out of the west to beat. As long as neither team wins it all idrc. anyways just sad to see how open the east was this year.,MkeBucks,160,https://www.reddit.com/r/MkeBucks/comments/1cxpslu/as_much_as_i_hate_the_pacers_fuck_the_celtics_more/
2024-05-01,1714537161,YOUR TEAM JUST LOST TO THE ROOSTER,,MkeBucks,13,https://www.reddit.com/r/MkeBucks/comments/1chd4m8/your_team_just_lost_to_the_rooster/
2024-04-07,1712516146,"Doc Rivers Calls Out Bucks for 'Inexcusable' Losses to Raptors, Grizzlies, Wizards",It's a shame no one is in a position to.... You know..... Do something about it?!?!,MkeBucks,98,https://www.reddit.com/r/MkeBucks/comments/1byc3lo/doc_rivers_calls_out_bucks_for_inexcusable_losses/
2024-04-04,1712194204,"Fan hits the Half Court Jackpot Shot for $10,000 at tonights game!",,MkeBucks,14,https://www.reddit.com/r/MkeBucks/comments/1bvanml/fan_hits_the_half_court_jackpot_shot_for_10000_at/
2024-03-27,1711552367,PatBev expected to miss 3-4 months with torn ligament in his wrist,,MkeBucks,89,https://www.reddit.com/r/MkeBucks/comments/1bp4adc/patbev_expected_to_miss_34_months_with_torn/
2024-02-19,1708304483,this is very funny ,,MkeBucks,23,https://www.reddit.com/r/MkeBucks/comments/1auafq4/this_is_very_funny/
2024-09-28,1727564950,"Sources: Milwaukee Bucks star Khris Middleton (procedures on both ankles) has not been cleared for five-on-five action with training camp commencing Oct. 1. Hes progressing nicely, but team is taking a cautious approach as hes expected to take part in most of camp activities.",,MkeBucks,50,https://www.reddit.com/r/MkeBucks/comments/1frqnys/sources_milwaukee_bucks_star_khris_middleton/
2024-07-24,1721841754,Marjon. Lets be serious for a minute =,,MkeBucks,76,https://www.reddit.com/r/MkeBucks/comments/1eb7471/marjon_lets_be_serious_for_a_minute/
2024-06-11,1718129650,Marjon and Ajax are in Greece  ,,MkeBucks,23,https://www.reddit.com/r/MkeBucks/comments/1ddkxxk/marjon_and_ajax_are_in_greece/
2024-02-08,1707423190,.,,MkeBucks,71,https://www.reddit.com/r/MkeBucks/comments/1am50dl/_/
2024-06-23,1719155579,"[Sidery] The Bucks have been shopping Pat Connaughton for a more versatile rotation piece.  Connaughton makes $9.4 million in 2024-25, which also includes a player option for the following season.  Due to current second apron limitations, Milwaukee cant aggregate salaries in trades.",,MkeBucks,105,https://www.reddit.com/r/MkeBucks/comments/1dmocbo/sidery_the_bucks_have_been_shopping_pat/
2024-05-17,1715948290,The world's most beautiful bus stop,,MkeBucks,10,https://www.reddit.com/r/MkeBucks/comments/1cu3pc2/the_worlds_most_beautiful_bus_stop/
2024-04-04,1712257797,Its going to be alright guys >r,,MkeBucks,23,https://www.reddit.com/r/MkeBucks/comments/1bvvsr0/its_going_to_be_alright_guys/
2023-11-25,1700939315,Brook Lopez status has been upgraded to absolutely magnificent ahead of tomorrows contest with the Blazers.,,MkeBucks,8,https://www.reddit.com/r/MkeBucks/comments/183qz04/brook_lopez_status_has_been_upgraded_to/
2024-08-11,1723401172,34 is in a space of his own against the best in the world and still only got 2nd team& ,,MkeBucks,34,https://www.reddit.com/r/MkeBucks/comments/1eprw4q/34_is_in_a_space_of_his_own_against_the_best_in/
2024-05-02,1714679556,&..>Ã,,MkeBucks,76,https://www.reddit.com/r/MkeBucks/comments/1cip17c/_/
2024-04-24,1713978741,Trying to rush Giannis back could be one of the worst mistakes in franchise history,"You always have a chance with Giannis, yes, but next year is their best shot at a title. A full offseason program for Dame. A full offseason for Doc to coach up Giannis and Dame on how to play together. A full offseason where Ajax can show Doc that he will be a useful rotation player. A full offseason where Horst can find upgrades over Crowder and Beasley (not hard). And a full offseason where Pat Bev can make an impact on the young guys (bring him back on non-bird rights).

If Giannis tries to come back too soon and tears his achilles, the Bucks may be done as a franchise. The Bucks don't have control of their 2025 pick for next year. By the time Giannis comes back fully healthy, Dame will be on the down swing. Not to mention, I don't think he'll be very happy in Milwaukee anymore and the Bucks will be looking to move his contract to anyone who will take it. Giannis will be in his 30s coming off major injury, and the Bucks have no clear way to improve their roster in the meantime outside of lucking into a 2nd round all-star with the new league rules. If the Bucks aren't winning Giannis is gone, and we'll be watching the Pelicans and TrailBlazers drafting in the top 10 every year for the next decade while the Bucks bring in the 2028 version of Matthew Delledova as the big offseason headliner. Attendance will drop fast, no one is paying over $100 to watch that product. Edens will take his giant net worth profit and sell to highest bidder, and the NBA will be happy to see the Bucks on their way out to St. Louis, Kansas City, or Pittsburgh. Then the taxpayers will get to keep funding a stadium for a private college and Disney on Ice.",MkeBucks,85,https://www.reddit.com/r/MkeBucks/comments/1cc3qha/trying_to_rush_giannis_back_could_be_one_of_the/
2024-02-18,1708224699,WHAT TIME IT IS IN INDIANA???,,MkeBucks,15,https://www.reddit.com/r/MkeBucks/comments/1atjs61/what_time_it_is_in_indiana/
2024-02-10,1707533718,Malik making history,,MkeBucks,8,https://www.reddit.com/r/MkeBucks/comments/1an670k/malik_making_history/
2024-01-30,1706578846,Unexpected Matchup >,h/t @DannyMarang on X,MkeBucks,10,https://www.reddit.com/r/MkeBucks/comments/1aech6c/unexpected_matchup/
2024-09-17,1726609358,New city edition jersey,,MkeBucks,157,https://www.reddit.com/r/MkeBucks/comments/1fjbt2p/new_city_edition_jersey/
2024-07-19,1721424188,AJ Johnson step back ,,MkeBucks,19,https://www.reddit.com/r/MkeBucks/comments/1e7ev98/aj_johnson_step_back/
2024-03-05,1709662212,"At +117 in two games against Charlotte, Malik Beasley has posted the highest single-season plus-minus against one team in NBA history",,MkeBucks,8,https://www.reddit.com/r/MkeBucks/comments/1b7c2ut/at_117_in_two_games_against_charlotte_malik/
2024-02-26,1708977497,"Damian Lillard: Length, penetration, and making him feel you",,MkeBucks,28,https://www.reddit.com/r/MkeBucks/comments/1b0r0ao/damian_lillard_length_penetration_and_making_him/
2024-07-30,1722371827,Bobby is about to have a big year,,MkeBucks,16,https://www.reddit.com/r/MkeBucks/comments/1eg40hf/bobby_is_about_to_have_a_big_year/
2024-05-09,1715277694,The NBA has suspended Bucks guard Patrick Beverley for four games.,,MkeBucks,79,https://www.reddit.com/r/MkeBucks/comments/1co3knt/the_nba_has_suspended_bucks_guard_patrick/
2024-04-08,1712569151,Giannis tries to give light-hearted touch to recent Bucks misery ,,MkeBucks,23,https://www.reddit.com/r/MkeBucks/comments/1bytqax/giannis_tries_to_give_lighthearted_touch_to/
2024-03-27,1711581071,"Giannis ""I don't wanna get fined""",,MkeBucks,30,https://www.reddit.com/r/MkeBucks/comments/1bpg3xd/giannis_i_dont_wanna_get_fined/
2024-03-21,1710987641,Fuck Doris. ,Did anyone else hear her go Ehhh after Dame made the contested 3 late in the fourth.,MkeBucks,99,https://www.reddit.com/r/MkeBucks/comments/1bjvodp/fuck_doris/
2023-12-08,1701998185,The best is yet to come,,MkeBucks,38,https://www.reddit.com/r/MkeBucks/comments/18dazxu/the_best_is_yet_to_come/
2024-06-27,1719521062,Tyler Smith. 6 foot 11. Potential 2 way ability ,,MkeBucks,29,https://www.reddit.com/r/MkeBucks/comments/1dq1nhk/tyler_smith_6_foot_11_potential_2_way_ability/
2024-05-26,1716707811,"Remember, your team has to win at least 2 games on the way out of the playoffs to go to Cancun, otherwise they get sent to Galveston.",,MkeBucks,37,https://www.reddit.com/r/MkeBucks/comments/1d0vy95/remember_your_team_has_to_win_at_least_2_games_on/
2024-03-02,1709353282,Lopez range after making one 3,,MkeBucks,7,https://www.reddit.com/r/MkeBucks/comments/1b4fc9p/lopez_range_after_making_one_3/
2023-12-19,1703003600,All Star Voting is Open,,MkeBucks,18,https://www.reddit.com/r/MkeBucks/comments/18m61jw/all_star_voting_is_open/
2023-11-19,1700370538,Whole league fucked up for letting this happen...,,MkeBucks,6,https://www.reddit.com/r/MkeBucks/comments/17ypmar/whole_league_fucked_up_for_letting_this_happen/
2023-11-19,1700361225,Props to the Commentators,"Mavs fan coming in piece. I usually hate watching the other teams commentary team on league pass, but Ive really enjoyed the Bucks commentators. Very knowledgeable and complementary of the Bucks without being insufferable homers.",MkeBucks,47,https://www.reddit.com/r/MkeBucks/comments/17ymwzj/props_to_the_commentators/
2023-11-10,1699654045,This is why Giannis and Griffin were upset. Giannis body and arms are BLATANTLY held by BOTH Myles Turner and Bruce Brown when splitting the screen and no foul is called,,MkeBucks,21,https://www.reddit.com/r/MkeBucks/comments/17sf726/this_is_why_giannis_and_griffin_were_upset/
2024-10-23,1729652225,"The Celtics hit 29 three-pointers to match the Bucks 2020 record of most threes in a game, but missed their last 13 attempts and failed to break it.","The Bucks set the three-point record initially on December 29, 2020, shooting 29-51 from behind the arc in a 144-97 win over the Heat.",MkeBucks,17,https://www.reddit.com/r/MkeBucks/comments/1ga0fvp/the_celtics_hit_29_threepointers_to_match_the/
2024-09-09,1725922107,Giannis Graphic I Made!,,MkeBucks,14,https://www.reddit.com/r/MkeBucks/comments/1fd2wce/giannis_graphic_i_made/
2024-08-04,1722799999,"Giannis scoring the most on an absurd 72%TS in a league where there is no defensive 3 seconds, and only one of his teammates are on the list despite getting open shots. Poor spacing and no defensive 3 seconds and hes stilling the best player ",,MkeBucks,14,https://www.reddit.com/r/MkeBucks/comments/1ek3q8s/giannis_scoring_the_most_on_an_absurd_72ts_in_a/
2024-07-07,1720369900,Jrue with the Tenacious D (They only show Bucks' Finals highlights and see his Bucks ring),,MkeBucks,7,https://www.reddit.com/r/MkeBucks/comments/1dxkkbc/jrue_with_the_tenacious_d_they_only_show_bucks/
2024-03-11,1710198948,The only time I thought these two would ever colab was on a celebrity boxing match,,MkeBucks,27,https://www.reddit.com/r/MkeBucks/comments/1bcholt/the_only_time_i_thought_these_two_would_ever/
2024-01-31,1706724857,"Giannis: ""[Doc Rivers] emphasized like, go more to Dame""[..] When I have the ball, kick the ball ahead to Dame. Set more screens, roll out of the post, dribble handoffs -- he wants that more and we have to do it more.""","Full relevant part:

&gt;""\[Rivers\] emphasized like, go more to Dame,"" Antetokounmpo said Monday night. ""When I have the ball, kick the ball ahead to Dame. Set more screens, roll out of the post, dribble handoffs -- he wants that more and we have to do it more. Because at the end of the day, when Dame has the ball in his hands and I'm being a threat as a roller, we can cause some damage.""  
&gt;  
&gt;Per Second Spectrum, the Bucks are averaging 1.18 points per direct pick when Antetokounmpo sets an on-ball screen for Lillard. That's the third-best efficiency among duos in the NBA. It's the volume of those plays that had become a question under Griffin. They are running about 9.9 on-ball screens per game, which ranks outside the top 25 among duos this season.  
&gt;  
&gt;""It's been effective,"" Rivers said Monday night, ""but it should be dominant, in my opinion.""

Some good thoughts here by Doc Rivers, specially in their PnR. If this helps get Dame more under rythym, it's just what the bucks need. For example, last year in Philly he ran about 22.6 on-ball screens with Harden and Embiid, and this season Giannis and Dame are running about 10 a game. It has to be increased for sure.

Full article [here](https://www.espn.com/nba/story/_/id/39417736/after-unsettling-trade-damian-lillard-getting-comfortable-milwaukee-bucks) (although take the parts that aren't direct quotes with a grain of salt, as it says under there that Lillard likes playing under Griffin and there's other people saying that is not true).",MkeBucks,88,https://www.reddit.com/r/MkeBucks/comments/1afoffr/giannis_doc_rivers_emphasized_like_go_more_to/
2023-10-28,1698455625,Not perfect but Im still proud of it,,MkeBucks,15,https://www.reddit.com/r/MkeBucks/comments/17i2mmo/not_perfect_but_im_still_proud_of_it/
2024-02-20,1708453665,[Pat Bev] This Man Doc actually saved your career. Started you when no one else wanted 2. And u retire go on TV and say that. @jj_redick ,,MkeBucks,74,https://www.reddit.com/r/MkeBucks/comments/1avov4q/pat_bev_this_man_doc_actually_saved_your_career/
2024-03-10,1710107325,Giannis and Dame become the first duo to drop 20 points and 10 assists in back to back games,,MkeBucks,8,https://www.reddit.com/r/MkeBucks/comments/1bbm51k/giannis_and_dame_become_the_first_duo_to_drop_20/
2024-02-17,1708147279,Mikal on the 2021 team,,MkeBucks,23,https://www.reddit.com/r/MkeBucks/comments/1asu7us/mikal_on_the_2021_team/
2024-07-18,1721316386,Seeing the recent Summer league hype. ,,MkeBucks,11,https://www.reddit.com/r/MkeBucks/comments/1e6e7rl/seeing_the_recent_summer_league_hype/
2024-02-29,1709177662,Real,,MkeBucks,15,https://www.reddit.com/r/MkeBucks/comments/1b2qg30/real/
2023-11-21,1700536038,Wednesday,,MkeBucks,26,https://www.reddit.com/r/MkeBucks/comments/18070hd/wednesday/
2024-05-28,1716864875,Nearly 50 years of being irrelevant!,,MkeBucks,88,https://www.reddit.com/r/MkeBucks/comments/1d29e90/nearly_50_years_of_being_irrelevant/
2024-02-12,1707702678,Moistest Halftime,,MkeBucks,6,https://www.reddit.com/r/MkeBucks/comments/1aoom52/moistest_halftime/
2024-10-21,1729520767,"Milwaukee Bucks star Khris Middleton is expected to miss Wednesdays season opener vs. the Philadelphia 76ers, sources tell ESPN. Middleton is out to start the NBA season as he rehabs from offseason ankle surgeries. Bucks are cautiously progressing Middleton toward a return.",,MkeBucks,80,https://www.reddit.com/r/MkeBucks/comments/1g8qyny/milwaukee_bucks_star_khris_middleton_is_expected/
2024-05-28,1716915219,[Random Highlight] Giannis goes coast-to-coast against the Knicks - 4/10/15,,MkeBucks,36,https://www.reddit.com/r/MkeBucks/comments/1d2o90v/random_highlight_giannis_goes_coasttocoast/
2024-05-19,1716155126,Brunson fractured hand and wont return for the end of game 7. Pacers get to EFC = ,,MkeBucks,163,https://www.reddit.com/r/MkeBucks/comments/1cvz9zn/brunson_fractured_hand_and_wont_return_for_the/
2024-04-24,1713923459,Fuck Bally Sports,"Bally Sports is completely broken on the Xbox app. The app constantly buffers regardless of my fiber optic based internet connection. The nba wonders why its viewerships is tanking maybe they should make it easier to watch a fucking playoff game. 

I must not be the only one in this boat, all the usual stream sites were buffering like absolute crazy, probably due to traffic. ",MkeBucks,58,https://www.reddit.com/r/MkeBucks/comments/1cbmebl/fuck_bally_sports/
2024-02-18,1708224502,DAME TIME!!!,Lets fucking GO! Proud of you Dame >r,MkeBucks,65,https://www.reddit.com/r/MkeBucks/comments/1atjpwo/dame_time/
2023-11-30,1701347597,can this classy athlete save the Bucks season?,,MkeBucks,16,https://www.reddit.com/r/MkeBucks/comments/187hhq2/can_this_classy_athlete_save_the_bucks_season/
2023-11-04,1699069087,[Eric Nehm] Adrian Griffin tells reporters that the ATO that got Damian Lillard the 3 was not actually designed that way. Lillard saw that he was getting top-locked and changed the cut. Giannis Antetokounmpo read it and handed it off to him for a clutch 3.,,MkeBucks,46,https://www.reddit.com/r/MkeBucks/comments/17nd2qv/eric_nehm_adrian_griffin_tells_reporters_that_the/
2024-03-25,1711367819,MVP!<Ã†,,MkeBucks,11,https://www.reddit.com/r/MkeBucks/comments/1bnbtae/mvp/
2024-02-16,1708058201,Man,,MkeBucks,9,https://www.reddit.com/r/MkeBucks/comments/1arzz6g/man/
2024-01-15,1705287387,A BLAZERS FAN - This is what it feels like (DAME TIME),"Blazer's fan coming in peace and respect.

THIS is what it is like to watch Dame! I am so happy for him and your team. I know he has been in a slump but this is what this dude does! 

No matter what it takes he will find a way to beat the buzzer. Get ready for more Milwaukee!!!

Much love",MkeBucks,38,https://www.reddit.com/r/MkeBucks/comments/196y32l/a_blazers_fan_this_is_what_it_feels_like_dame_time/
2024-07-03,1720035364,Two way demon,,MkeBucks,12,https://www.reddit.com/r/MkeBucks/comments/1dun4vv/two_way_demon/
2024-05-01,1714536243,"""How about that crowd in Milwaukee Tyrese? That crowd is meee!""",This man next to the mic is a hero.,MkeBucks,25,https://www.reddit.com/r/MkeBucks/comments/1chcuqs/how_about_that_crowd_in_milwaukee_tyrese_that/
2024-03-02,1709381966,"In the last month, Giannis is averaging a higher field goal percentage (66.2%) than free throw percentage (65.9%) while averaging 31/10/7 with 46% 3PT","After a tough start in the Doc Rivers era, the Bucks are 5-0 in their last 5 games and a lot of that can be attributed to Giannis.

He's been locked in defensively and somehow he's been shooting the three ball a whole lot better. Here's a crazy stat for you all:

**Giannis has made 8 of his last 10 threes**. Yes I am not kidding.

Another fun fact: In his last 32 games, Giannis has shot under 50% **ONCE.** That was a game vs the Pistons where he had 31/17/10 on 44% FG.",MkeBucks,23,https://www.reddit.com/r/MkeBucks/comments/1b4n0li/in_the_last_month_giannis_is_averaging_a_higher/
2023-12-03,1701573404,I like the Milwaukee Bucks.,I like the Milwaukee Bucks. I like the players. I like the coaches. I like it when they play basketball. And I like it when they win basketball games.,MkeBucks,23,https://www.reddit.com/r/MkeBucks/comments/189k89n/i_like_the_milwaukee_bucks/
2024-04-28,1714336005,Y'all are not ready for him. Career-high inc,,MkeBucks,15,https://www.reddit.com/r/MkeBucks/comments/1cfg6f1/yall_are_not_ready_for_him_careerhigh_inc/
2024-04-08,1712543785,Doc you are the Coach. Do something about it. Holy shit ,,MkeBucks,65,https://www.reddit.com/r/MkeBucks/comments/1bymsse/doc_you_are_the_coach_do_something_about_it_holy/
2024-03-31,1711921892,Never Forget,The 2000s were a fun time!  ,MkeBucks,22,https://www.reddit.com/r/MkeBucks/comments/1bsm0l5/never_forget/
2023-11-12,1699762773,We have to take it up a notch. This is not who we are. This is not the Milwaukee Bucks. We gotta guard people. - Giannis,,MkeBucks,90,https://www.reddit.com/r/MkeBucks/comments/17tcdz7/we_have_to_take_it_up_a_notch_this_is_not_who_we/
2023-10-28,1698466900,"Some notes about how Dame played last night from a Blazer fan that has been watching him for years. First of all, did you notice that Dame only took 20 shots last night?","A lot of people think Dame is like Kobe or Harden or any number of guys who put up big numbers by taking lots of shots. They are wrong.

The Legend put up 39 points on 20 shots. Going 17 of 17 from the line. This type of efficiency is why Blazers fans know Lillard is a Legit Superstar and the rest of the league thinks he is ""just"" a good to great point guard.

Also, Dame scored the last 11 points of the game for the Bucks. That's what we know of as ""Dame Time"".

One of my big takeaways was that Dame wasn't tired at the end of the game. Usually in Portland he was just gassed at the final buzzer because if he wasn't running 110% there wasn't a chance at a win.

It must be quite surreal for him to be open sometimes too! At the Blazers he was 100% the focus of the opposing team's defense and he still put up big numbers. Seeing him open and not the core element of every single play made him so much more fun to watch, not to mention lethal. He even mentioned in the post game interview how nice it was that he wasn't organizing the offense and defense all the time and has a team around him that takes care of a lot of things he was used to running in Portland.

I'm so happy for your team and I'll be watching as many games as I can! Over here in Portland we're in full rebuild mode so I'm going to follow the Bucks for the next few years.",MkeBucks,37,https://www.reddit.com/r/MkeBucks/comments/17i5vbw/some_notes_about_how_dame_played_last_night_from/
2024-05-20,1716227451,"Me A Bucks Fan, Now That The Bucks Have Been Eliminated","https://preview.redd.it/6v9jh1p7dm1d1.png?width=1396&amp;format=png&amp;auto=webp&amp;s=5ae07500da99703a7b37d3e56b8980f906f2398f

",MkeBucks,22,https://www.reddit.com/r/MkeBucks/comments/1cwloyq/me_a_bucks_fan_now_that_the_bucks_have_been/
2024-04-30,1714520922,Giannis and Dame are out tonight.,,MkeBucks,152,https://www.reddit.com/r/MkeBucks/comments/1ch7na1/giannis_and_dame_are_out_tonight/
2024-02-12,1707769216,Its been a while. But its gaem dae.,,MkeBucks,10,https://www.reddit.com/r/MkeBucks/comments/1ap9ukp/its_been_a_while_but_its_gaem_dae/
2024-01-23,1706039871,DOOMERS GET IN HERE =,"This is a DOOMER only space where we can celebrate and cathartically laugh. 

All year we got gas lit by some holier-than-thou basketball *geniuses* who swore griffin was secretly a basketball savant that was just throwing games to experiment. 

They swore that we didnt know what we were watching as they gestured at largely useless and badly interpreted lineup ratings

That he was improving game over game by giving up 130 every night for a month straight. 

Were second in the east!!! they screamed as we were going down to the wire with the 4 win Cade-less pistons for the second night in a row. 

It was obvious all year, from terrys resignation to every single report that came out of the locker room that Griffin had no idea what he was doing. The team agrees, as this doesnt happen without support from Giannis/dame/Kris (probably all 3). 

I hope we dont end up with Doc rivers, but Im gonna take a lap and enjoy my I told you so moment and you should too ===",MkeBucks,168,https://www.reddit.com/r/MkeBucks/comments/19dxcv1/doomers_get_in_here/
2023-11-22,1700696553,Jrue Holiday inside the @Bucks locker room catching up with old friends.,,MkeBucks,41,https://www.reddit.com/r/MkeBucks/comments/181nd0m/jrue_holiday_inside_the_bucks_locker_room/
2024-10-02,1727890043,Bro looks like he just saw something mischievous and doesnt know what to say ,,MkeBucks,34,https://www.reddit.com/r/MkeBucks/comments/1fulv9x/bro_looks_like_he_just_saw_something_mischievous/
2024-07-30,1722356223,"The Athletic (@TheAthletic) on X: The @FIBA account said it best.  Giannis with another remarkable performance, but it wasnt enough for Greece.  With his nations Olympic hopes dangling by a thread, Antetokoumpo is frustrated  and silent, writes @sam_amick.",,MkeBucks,41,https://www.reddit.com/r/MkeBucks/comments/1efxi4m/the_athletic_theathletic_on_x_the_fiba_account/
2024-02-06,1707231345,Im tired of the Bobby slander so lets settle this once and for all.,"Subreddit meet up at a local court. 5 on 5. Pro Bobby team vs anti Bobby team. Game to 21, best of 3 series. Loser shuts up.",MkeBucks,112,https://www.reddit.com/r/MkeBucks/comments/1akbmr0/im_tired_of_the_bobby_slander_so_lets_settle_this/
2024-03-02,1709394916,"Following the NBA All-Star break, players are shooting 17-of-48 (35.4%) when being defended by Jae Crowder. Been a big part of the defensive turnaround.",,MkeBucks,15,https://www.reddit.com/r/MkeBucks/comments/1b4rexs/following_the_nba_allstar_break_players_are/
2024-01-26,1706227702,2024 East All-Star starters: Giannis Antetokounmpo (captain) Jayson Tatum Joel Embiid Tyrese Haliburton Damian Lillard,,MkeBucks,70,https://www.reddit.com/r/MkeBucks/comments/19fny34/2024_east_allstar_starters_giannis_antetokounmpo/
2024-07-20,1721493576,Didnt know Dame still lived in Portland ,,MkeBucks,53,https://www.reddit.com/r/MkeBucks/comments/1e7zsqo/didnt_know_dame_still_lived_in_portland/
2024-09-22,1726972556,Dame working on his jumper ,This,MkeBucks,22,https://www.reddit.com/r/MkeBucks/comments/1fmj7tk/dame_working_on_his_jumper/
