date_utc,timestamp,title,text,subreddit,comments,url
2024-09-18,1726654823,Video of Tyrese + team on NXT,Ma,pacers,6,https://www.reddit.com/r/pacers/comments/1fjpdyp/video_of_tyrese_team_on_nxt/
2024-05-20,1716187117,Let's talk about Ben Shepherd,"The dude was the less regarded of our rookies this year, and might have a lower ceiling than Walker eventually, but man has he been an awesome rotation player off the bench for us. There's obviously a reason the coaching staff trusts him in the minutes he's played in the postseason, and I love the energy he puts on the floor. Even if he got cooked by Brunson a few times (who hasn't), he's shown incredible maturity for a rookie. And he seems like a great dude off the court as well. ",pacers,49,https://www.reddit.com/r/pacers/comments/1cw91v1/lets_talk_about_ben_shepherd/
2024-05-09,1715278035,Pat Bev has been suspended four games,,pacers,100,https://www.reddit.com/r/pacers/comments/1co3pqu/pat_bev_has_been_suspended_four_games/
2024-05-09,1715258505,Pacers files complaint on 78 calls between the two games ,"https://www.espn.com/nba/story/_/id/40111250/pacers-file-complaint-78-calls-nba-source-says

Kinda curious on everyones opinion? The referees, at times, throughout both games were obnoxious and favored. I dont think its the only reason we lost. At least not in game 2.

Im just worried were too focused on the calls. It sucks, believe me, but were a small market team and we really gotta out perform if we want any chance to win. 

Im curious on everyones opinion though

Edit/Add on

I should have expressed this, but I dont disagree with him submitting these complaints. I think all teams should be given fair calls whether home or away. Reporting issues like this is important. I guess my fear is we only focus on this aspect",pacers,171,https://www.reddit.com/r/pacers/comments/1cnwbun/pacers_files_complaint_on_78_calls_between_the/
2024-04-08,1712618635,"Anyone else making the jump to WNBA fandom, and the Fever Caitlin Clark hype train? ","As a lifelong Pacers, and Indiana sports fan it feels crazy that the Fever are getting a generational player of Caitlin Clark's caliber. I know I'm gonna take this opportunity to finally get into the WNBA. Feels like the equivalent of Magic and Bird joining the NBA in the 80s. Anyone else here making the jump with me? ",pacers,81,https://www.reddit.com/r/pacers/comments/1bzcwz2/anyone_else_making_the_jump_to_wnba_fandom_and/
2024-03-13,1710296095,"Post-Game Thread: Pacers beat the Thunder, 121 - 111",,pacers,156,https://www.reddit.com/r/pacers/comments/1bdfvk5/postgame_thread_pacers_beat_the_thunder_121_111/
2024-01-17,1705520332,THEY TOLD ME WE NEEDED TO TRADE MATHURIN. THEY TOLD ME WE NEEDED TO TRADE JARACE. THEY TOLD ME WE NEEDED TO TRADE NEMBHARD. KEVIN PRITCHARD HAS DONE MIRACLES ON ME,"&amp;#x200B;

https://reddit.com/link/1995je3/video/85d2lbwkz1dc1/player",pacers,22,https://www.reddit.com/r/pacers/comments/1995je3/they_told_me_we_needed_to_trade_mathurin_they/
2023-11-22,1700621997,"Post-Game Thread: THAT'S MY BUDDY, GUY! Pacers win the game and the group, beat the Hawks 157 - 152",,pacers,148,https://www.reddit.com/r/pacers/comments/180z56n/postgame_thread_thats_my_buddy_guy_pacers_win_the/
2024-06-11,1718124796,"Shep did absolutely everything right to earn his minutes this season. Hustle plays, corner threes, and great defense!",It seems like this guy took a class on how to get minutes. Watching TJ will do that to you. Props to him!,pacers,37,https://www.reddit.com/r/pacers/comments/1ddiym6/shep_did_absolutely_everything_right_to_earn_his/
2024-05-29,1716961618,Aaron Nesmiths free throw shooting was unreal...95.8% since 3/5/24 at Dallas,"He made his last 35 reguar season free throw attempts.  Missed one in the 4th quarter @ Dalls 3/5/24. Then went 34 of 37 in the playoffs.  69 out of his 72 free throws.  Which is more than a flyer, I think.  I called him Aaron Threesmith at times this year, but here lately I guess its Aaron Freesmith",pacers,30,https://www.reddit.com/r/pacers/comments/1d34yfs/aaron_nesmiths_free_throw_shooting_was_unreal958/
2024-05-18,1716055436,On this day 11 years ago,,pacers,8,https://www.reddit.com/r/pacers/comments/1cv38h7/on_this_day_11_years_ago/
2024-04-29,1714399976,Pacers are headed to Paris for two regular season games against the Spurs in January 2025,,pacers,63,https://www.reddit.com/r/pacers/comments/1cg04og/pacers_are_headed_to_paris_for_two_regular_season/
2024-04-10,1712716573,Seeding Scenarios are Now Clear,"Updated Thursday at 10pm (after Knicks win)

**No worse than** **6 seed if ONE OF THE FOLLOWING:**

1. Win 1 game
2. Magic beat 76ers
3. 76ers lose final game vs. Nets
4. Magic win final game at Bucks

**No worse than 5 seed if\*:**

1. Win both remaining games

**Will be 4 seed if\*:**

1. Win both games AND EXACTLY 1 OF THE FOLLOWING HAPPEN:

* Magic lose at least 1 game
* Knicks lose final 2 games

**Will be 3 seed if win final 2 games and BOTH bulleted points above happen**

\*There are scenarios where we would get the 4 or 5 seed if we go 1-1...which will be addressed, if necessary, going into the final day of the season",pacers,39,https://www.reddit.com/r/pacers/comments/1c0arp7/seeding_scenarios_are_now_clear/
2024-03-13,1710304473,Thank the good lord we got Pascal Siakam,"Before we traded for Pascal, I honestly believed wed be just fine without him. Our offense was humming. But Siakam has really impressed me recently. Several times tonight, I found myself wondering what we would have done if he wasnt there. He has become essential. What he did tonight:

1. When the pace slows down, he is a steady presence. I loved our style of play in the first half of the year, but we had a glaring hole in needing someone who could really create their own shot. Siakam has filled that role, and it will be absolutely essential for a playoff grind. 

2. He reminded me of David West tonight. Obviously his style of play is different (Siakam is way more athletic at this point in his career than West was when we had him), but they are similar insofar as when we need a bucket after a tough stretch, we can reliably go to him. He also has the experience and gravitas West had with younger guys.

3. His experience is apparent. I hadnt really noticed the downside of having such a young team before, but Siakam offers a contrast that makes our youth more noticeable. For example, at one point near the end of the game tonight, Haliburton was going nuts trying to get the ball so he could facilitate. The defense was sticking to him, though, and it looked for a second like wed turn the ball over trying to get it to him. Siakam basically motioned Haliburton offPascal was capable of dribbling through the defense and facilitating himself, in this tough situation. I dont think anybody else on the team would have done that, but it was the right call. Siakam settled things down, and we got the bucket.

4. The dude is just fun to watch. He does things that a guy his size just shouldnt be doing. Particularly, his touch and razzle dazzle in the paint

5. Defense.",pacers,18,https://www.reddit.com/r/pacers/comments/1bdiryf/thank_the_good_lord_we_got_pascal_siakam/
2024-01-28,1706485022,There's a new Pacer Pest in town,,pacers,12,https://www.reddit.com/r/pacers/comments/1adgoni/theres_a_new_pacer_pest_in_town/
2024-01-06,1704507241,From the Hawks game thread,,pacers,57,https://www.reddit.com/r/pacers/comments/18zoq1e/from_the_hawks_game_thread/
2024-01-04,1704336875,Live Portis reaction,,pacers,4,https://www.reddit.com/r/pacers/comments/18y2bdr/live_portis_reaction/
2023-12-09,1702148639,Untitled,,pacers,16,https://www.reddit.com/r/pacers/comments/18ekhte/untitled/
2024-08-01,1722542902,"A pitbull is about to be let off the chain. Bennedict Mathurin, your 2025 MIP. ",,pacers,29,https://www.reddit.com/r/pacers/comments/1ehqemr/a_pitbull_is_about_to_be_let_off_the_chain/
2024-05-29,1717012966,Most people aren't mentioning it but we were missing one of our core players in Mathurin. His last 10 games he was averaging 19 points in 25 minutes a game,Most people aren't mentioning it but we were missing one of our core players in Mathurin. His last 10 games he was averaging 19 points in 25 minutes a game,pacers,91,https://www.reddit.com/r/pacers/comments/1d3ldua/most_people_arent_mentioning_it_but_we_were/
2024-05-22,1716379453,The day after a loss and I feel great,"Should we have won last night? Absolutely.  This team will be more than fine.  We just got done beating NY in game 7 and turned around on no rest and took the #1 seed to overtime in game 1 in a hostile building.  The team will have growing pains, thats part of the maturation process, but they dont back down and thats why theyre going to steal game 2.  Forget the last few minutes, 22 turnovers is uncharacteristic of the team.

Just think how much this team has grown from game 1 of the Milwaukee series to now.  Theyre so far ahead of schedule their time is NOW.  We arent front runners, we are going to be confident as all hell come Thursday night.  Gotta move on from game 1 and build on the positives.  Lets go",pacers,76,https://www.reddit.com/r/pacers/comments/1cxykuw/the_day_after_a_loss_and_i_feel_great/
2024-05-19,1716147099,this broadcast is already insufferable.,go cers!,pacers,30,https://www.reddit.com/r/pacers/comments/1cvw9c6/this_broadcast_is_already_insufferable/
2024-04-29,1714416275,Myles hitting the 3 while the crowd chants his name is a top all-time Pacers moment for me. Credit to r/ipacersdotcom for the coolest vid of the season,,pacers,12,https://www.reddit.com/r/pacers/comments/1cg6vij/myles_hitting_the_3_while_the_crowd_chants_his/
2024-04-24,1713927196,Shout out to these fans. You all in here?!?,,pacers,15,https://www.reddit.com/r/pacers/comments/1cbnnvc/shout_out_to_these_fans_you_all_in_here/
2024-02-05,1707165534,Tyrese Haliburton Named 3-Point Contest Participant,,pacers,26,https://www.reddit.com/r/pacers/comments/1ajqwn9/tyrese_haliburton_named_3point_contest_participant/
2023-11-10,1699583780,Post Game Thread: Pacers actually close it out vs the Bucks 126-124,,pacers,171,https://www.reddit.com/r/pacers/comments/17ru2fz/post_game_thread_pacers_actually_close_it_out_vs/
2024-06-01,1717246300,"No surprise, the comments on this are a toxic waste dump",Looks like a nice simple gesture and people are horrible about it. This is why we can't have nice things. ,pacers,293,https://www.reddit.com/r/pacers/comments/1d5maqo/no_surprise_the_comments_on_this_are_a_toxic/
2024-05-21,1716303078,Game 1,,pacers,26,https://www.reddit.com/r/pacers/comments/1cx9r28/game_1/
2024-04-29,1714406992,"NSFW Hostile act by Pascal Siakam in Game 4, not sure how he avoided an ejection",,pacers,14,https://www.reddit.com/r/pacers/comments/1cg2zv4/nsfw_hostile_act_by_pascal_siakam_in_game_4_not/
2024-02-08,1707421606,The Pacers are trading a future second round pick for Doug McDermott,,pacers,178,https://www.reddit.com/r/pacers/comments/1am4d88/the_pacers_are_trading_a_future_second_round_pick/
2024-01-28,1706482624,"Its officially a winning streak, bring out the dancing crabs!",,pacers,1,https://www.reddit.com/r/pacers/comments/1adfqui/its_officially_a_winning_streak_bring_out_the/
2024-01-26,1706275086,Chuck is on the pacers train now,,pacers,46,https://www.reddit.com/r/pacers/comments/1abi4z8/chuck_is_on_the_pacers_train_now/
2024-10-24,1729734966,"I dont want to brag, but since my son was born the Pacers and Colts are undefeated. ","Time for my family jewels to start getting some respect.
Bring on the Knicks and Texans. ",pacers,15,https://www.reddit.com/r/pacers/comments/1garmac/i_dont_want_to_brag_but_since_my_son_was_born_the/
2024-07-07,1720313521,AURA=%=%<<,,pacers,8,https://www.reddit.com/r/pacers/comments/1dx4ajp/aura/
2024-05-06,1714998036,Where we watching tonight,With our guys on the road for Game 1 is there a watch event at Gainbridge? Any other bars where pacers fans will be watching and actually engaged?,pacers,95,https://www.reddit.com/r/pacers/comments/1clhnnr/where_we_watching_tonight/
2024-04-15,1713210168,My playoff bracket,Yes I made a bracket where our favorite team won==,pacers,61,https://www.reddit.com/r/pacers/comments/1c4vg9h/my_playoff_bracket/
2024-02-11,1707626698,They big mad >#>#>#,,pacers,74,https://www.reddit.com/r/pacers/comments/1anzr10/they_big_mad/
2023-11-20,1700444085,I'm done,"I've had it with this team. Literally can't take the up and down BS anymore. I'm literally good getting rid of anyone and everyone on this team other than Haliburton, Heild, Mathurin, Toppin, Nesmith, Nembhard, McConnell, Turner, Smith, Jackson, Brown,  Nwora, Walker, Sheppard and Rick. Literally dump everyone else. Tired of those bums.",pacers,38,https://www.reddit.com/r/pacers/comments/17zcy0k/im_done/
2024-05-12,1715544592,These Knicks announcers on ABC are beyond annoying,,pacers,37,https://www.reddit.com/r/pacers/comments/1cqgr7f/these_knicks_announcers_on_abc_are_beyond_annoying/
2024-05-03,1714745275,anybody else disgusted about Beverly? ,"How embarrasing for the Bucks franchise. Throwing the ball into the stands and hitting a lady in the FACE....only to ask for the ball back and to throw it again?

After that beating in Game 6...where is your ""too small"" celebration now, Beverly? You all some ""frontrunning"" clowns.",pacers,102,https://www.reddit.com/r/pacers/comments/1cj9kxi/anybody_else_disgusted_about_beverly/
2024-02-26,1708964849,Pacers Gameday Doodle :),,pacers,11,https://www.reddit.com/r/pacers/comments/1b0lnzp/pacers_gameday_doodle/
2024-01-10,1704910464,"[Sidery] The Pacers are very, very determined to not include Jarace Walker in any trade, per @wojespn. Indiana is very high on Walkers long-term potential, as are other teams around the league. In a potential Pascal Siakam trade, Walker could be a key sticking point in negotiations.",,pacers,136,https://www.reddit.com/r/pacers/comments/193ewep/sidery_the_pacers_are_very_very_determined_to_not/
2024-09-15,1726429444,Cmon basketball start already ,Aye aye aye ,pacers,27,https://www.reddit.com/r/pacers/comments/1fhlal2/cmon_basketball_start_already/
2024-06-07,1717776280,Where does he rank all time as a Pacer for you after this season?,,pacers,178,https://www.reddit.com/r/pacers/comments/1daefwn/where_does_he_rank_all_time_as_a_pacer_for_you/
2024-05-28,1716886801,Live look at Knicks fans,,pacers,17,https://www.reddit.com/r/pacers/comments/1d2eyby/live_look_at_knicks_fans/
2024-02-19,1708315924,TYRESE Hits 5 STRAIGHT THREES To Start ASG! =%,,pacers,16,https://www.reddit.com/r/pacers/comments/1aue7gv/tyrese_hits_5_straight_threes_to_start_asg/
2023-12-07,1701981665,Ready for a big night,,pacers,10,https://www.reddit.com/r/pacers/comments/18d50u2/ready_for_a_big_night/
2024-07-10,1720623230,James Wiseman (presumably) making 24 straight corner 3s,,pacers,66,https://www.reddit.com/r/pacers/comments/1dzxrmd/james_wiseman_presumably_making_24_straight/
2024-05-28,1716862941,Shouldve been a flagrant foul,Thats some bullshit. WhILE UnFoRtUnAtE fuck off ,pacers,144,https://www.reddit.com/r/pacers/comments/1d28sn8/shouldve_been_a_flagrant_foul/
2024-05-20,1716240906,Knicks fan coming in peace! Made this music video to wish you good luck in the ECF. Beat Boston for all of us at Zombie Knicks Nation!,,pacers,54,https://www.reddit.com/r/pacers/comments/1cwr4u7/knicks_fan_coming_in_peace_made_this_music_video/
2024-05-17,1715905820,Secret move,"Obviously we know Hartenstein gets quite a few rebounds, but did you know he has a secret that even the refs dont see& look at how much hes grabbing on to Myles back cant even read his name. Investigate this goblin lmao",pacers,94,https://www.reddit.com/r/pacers/comments/1ctsb1b/secret_move/
2024-05-05,1714898499,Hot take: I don't want PG back in Indy,"PG hasn't performed in playoffs for ages now and has been so inconsistent throughout the playoffs, I don't believe he'd be a positive asset for the team. I know some are hoping for some sort of a reunion but we'd be better off elsewhere than having an old injury prone inconsistent player on the team.",pacers,70,https://www.reddit.com/r/pacers/comments/1ckmsbq/hot_take_i_dont_want_pg_back_in_indy/
2024-04-06,1712416709,[Highlight] Hali fading 3 to beat the buzzer!,,pacers,9,https://www.reddit.com/r/pacers/comments/1bxe1gh/highlight_hali_fading_3_to_beat_the_buzzer/
2024-03-06,1709697332,"First March win is in the books, bring out the dancing crabs! ",,pacers,12,https://www.reddit.com/r/pacers/comments/1b7q0z2/first_march_win_is_in_the_books_bring_out_the/
2024-01-29,1706502674,Pascal Siakam since he practiced,"Siakam since his first practice with the Pacers  32 Minutes Per Game 26 PPG 9 RPG 7 APG 1.4 SPG 65% FG 43 3pt%  70% TS 3-0 Has played All-Star All-NBA All-Defensive Level on both ends off the floor and has been clutch .

&amp;#x200B;

&amp;#x200B;

[All-Star All-NBA All-Defensive Level off play from Spicy P](https://preview.redd.it/808bus0r4bfc1.jpg?width=408&amp;format=pjpg&amp;auto=webp&amp;s=afdd53b44b78c9b6c5b9978b1f95bdf52561f44d)",pacers,34,https://www.reddit.com/r/pacers/comments/1admmpn/pascal_siakam_since_he_practiced/
2024-01-18,1705602773,[The Athletic] Bruce Brown was unhappy in Indiana,Bruce Brown unhappy here? WTF. Did I miss something or is this just John Hollinger making things up for clicks.,pacers,102,https://www.reddit.com/r/pacers/comments/199x2wt/the_athletic_bruce_brown_was_unhappy_in_indiana/
2024-09-21,1726937994,Fresh from Pascal's IG: Pre-Season Sessions Mixtape,,pacers,18,https://www.reddit.com/r/pacers/comments/1fm7kil/fresh_from_pascals_ig_preseason_sessions_mixtape/
2024-07-02,1719928607,The band ,So glad I dont have to buy an updated version of this T. So bummed I dont own an iron. ,pacers,30,https://www.reddit.com/r/pacers/comments/1dtmgy9/the_band/
2024-05-24,1716510975,Fuck ESPN,"I am so over the disrespect from these commentators. All they have done this game so far is shit on the Pacers. The large market bias is unreal, and they aren't even trying to hide it. ",pacers,71,https://www.reddit.com/r/pacers/comments/1cz88ew/fuck_espn/
2024-05-18,1716063117,Game 7,,pacers,22,https://www.reddit.com/r/pacers/comments/1cv64e8/game_7/
2024-05-11,1715391758,Me after that win. ,Ive had this pic saved since November. ,pacers,3,https://www.reddit.com/r/pacers/comments/1cp63w4/me_after_that_win/
2024-04-27,1714179765,The Playlog of Andrew Nembhard going full Dennis Rodman mode. ,,pacers,16,https://www.reddit.com/r/pacers/comments/1ce1wn9/the_playlog_of_andrew_nembhard_going_full_dennis/
2023-12-05,1701770387,Aaron Nesmith last night...,It would be a shame if this made it's way to r/bostonceltics  >#>#>#,pacers,8,https://www.reddit.com/r/pacers/comments/18b8pch/aaron_nesmith_last_night/
2024-09-28,1727526775,"Oh, so its like that??",,pacers,48,https://www.reddit.com/r/pacers/comments/1frd9l1/oh_so_its_like_that/
2024-07-08,1720447518,Jersey Concept,Saw on Facebook. Credit - Conscious basketball.,pacers,35,https://www.reddit.com/r/pacers/comments/1dy9rlq/jersey_concept/
2024-04-29,1714368540,Let the salt flow...,,pacers,15,https://www.reddit.com/r/pacers/comments/1cfra7c/let_the_salt_flow/
2024-03-30,1711761556,"Post-Game Thread: Pacers beat the Lakers, 109 - 90",,pacers,90,https://www.reddit.com/r/pacers/comments/1br5cz4/postgame_thread_pacers_beat_the_lakers_109_90/
2024-02-28,1709084565,Young fan made Bennedict Mathurin his very own friendship bracelet,,pacers,7,https://www.reddit.com/r/pacers/comments/1b1tmz2/young_fan_made_bennedict_mathurin_his_very_own/
2024-01-11,1704992833,"Tyrese leads all East Guards by 750,000+ votes",,pacers,25,https://www.reddit.com/r/pacers/comments/1946nef/tyrese_leads_all_east_guards_by_750000_votes/
2023-12-14,1702561207,Weve lost a legend.,,pacers,13,https://www.reddit.com/r/pacers/comments/18i8tvg/weve_lost_a_legend/
2024-05-12,1715553987,Props to the Pacers medical staff,,pacers,18,https://www.reddit.com/r/pacers/comments/1cqk8xk/props_to_the_pacers_medical_staff/
2024-02-06,1707249603,Quinn Buckner's 3 Keys to the Game =,,pacers,20,https://www.reddit.com/r/pacers/comments/1akiyzx/quinn_buckners_3_keys_to_the_game/
2024-09-20,1726850174,[LegionHoops] Caitlin Clarks first two playoff games are the most expensive WNBA playoff games ON RECORD,The face of the league.,pacers,15,https://www.reddit.com/r/pacers/comments/1flgd8z/legionhoops_caitlin_clarks_first_two_playoff/
2024-05-19,1716156321,WE WANT BOSTON!!!!,LETS GOOOOOOO,pacers,119,https://www.reddit.com/r/pacers/comments/1cvzput/we_want_boston/
2024-04-26,1714159210,Looks like Caitlin Clark is going to the Revving it Up tonight. LFG!,,pacers,15,https://www.reddit.com/r/pacers/comments/1cdtzxq/looks_like_caitlin_clark_is_going_to_the_revving/
2024-04-08,1712585552,Thought you all would appreciate this pic I took last night during the Heat game,,pacers,8,https://www.reddit.com/r/pacers/comments/1byywfa/thought_you_all_would_appreciate_this_pic_i_took/
2024-01-27,1706367282,"""I can get this shot off""",,pacers,24,https://www.reddit.com/r/pacers/comments/1acciz5/i_can_get_this_shot_off/
2024-08-02,1722619474,Nembhard: 18pts on 8/10 FG for Canada over Spain,"He has really stepped in his 6th man + closer role as SGA had an off day outside of drawing whistles.
Even made the crunch time inbound passes to close the 4th!",pacers,26,https://www.reddit.com/r/pacers/comments/1eifv3n/nembhard_18pts_on_810_fg_for_canada_over_spain/
2024-02-08,1707405948,"[Woj] The Indiana Pacers are trading Buddy Hield to the 76ers for Marcus Morris, Furkan Korkmaz and three second-round picks, sources tell ESPN.",,pacers,372,https://www.reddit.com/r/pacers/comments/1aly76h/woj_the_indiana_pacers_are_trading_buddy_hield_to/
2024-01-27,1706322569,pave,,pacers,25,https://www.reddit.com/r/pacers/comments/1ac03n1/pave/
2024-01-26,1706232188,Tyrese Haliburton is an All-Star starter!,,pacers,15,https://www.reddit.com/r/pacers/comments/1ab63m3/tyrese_haliburton_is_an_allstar_starter/
2023-11-22,1700624018,"""The league won't give the Pacers a nationally televised game",The tourney will be Tyrese first game nationwide. Let's get that W against the Pistons Friday so it's a home game on our City Edition court wearing our Indy uniforms.,pacers,14,https://www.reddit.com/r/pacers/comments/180zt5o/the_league_wont_give_the_pacers_a_nationally/
2024-07-04,1720090116,The darkest time-line I can imagine... ,"... is if the Sixers had been ""moved"" by the offer and a trade happened. ===",pacers,38,https://www.reddit.com/r/pacers/comments/1dv40w3/the_darkest_timeline_i_can_imagine/
2024-05-27,1716821661,"A live look at people that went to game three, went to the Snakepit at the Indy 500, and are getting ready for game four",,pacers,6,https://www.reddit.com/r/pacers/comments/1d1td32/a_live_look_at_people_that_went_to_game_three/
2024-05-21,1716304896,Had To Make Sure There Was No Confusion At The Irish Pub I Bartend At,,pacers,16,https://www.reddit.com/r/pacers/comments/1cxagyh/had_to_make_sure_there_was_no_confusion_at_the/
2023-12-05,1701745999,It's officially time to update this meme.,,pacers,11,https://www.reddit.com/r/pacers/comments/18b2b68/its_officially_time_to_update_this_meme/
2024-05-09,1715222652,Yall are craaazy,"Soooo much crazy overreacting in the game/post-game threads. We lost and it sucks, but we have over performed this year. We will be better next year. People screaming for Pascals head the way they did for Hali first game. Just insanity. Losing sucks and people get upset, but this team has done very well this year, and will only get bette next year. Just my two cents&",pacers,126,https://www.reddit.com/r/pacers/comments/1cnmre1/yall_are_craaazy/
2024-03-31,1711845358,More arenas should do this lmao,,pacers,11,https://www.reddit.com/r/pacers/comments/1brx61p/more_arenas_should_do_this_lmao/
2024-01-25,1706154615,Jalen Smith hosted a group of more than 30 youth for tonights Kickin It With Stix. They went on a tour of the facility and then Jalen spent time answering their questions and gave them a safe space to talk about the challenges theyre facing,"This is so cool of him to do, shoutout to Stix",pacers,12,https://www.reddit.com/r/pacers/comments/19f06zw/jalen_smith_hosted_a_group_of_more_than_30_youth/
2024-06-26,1719440569,"Free agent F OG Anunoby intends to sign a five-year, $212.5 million contract to return to the New York Knicks",,pacers,172,https://www.reddit.com/r/pacers/comments/1dpbdgh/free_agent_f_og_anunoby_intends_to_sign_a/
2024-06-27,1719497896,Bronny James,"Its pretty clear that the only place Bronny winds up is LA at 55. Hear me out. 

Lebron knocked us out of the playoffs 5 times in 7 years. Beat us in the IST last year. Has gone 60-34 against us career, including 20-10 in the playoffs. Caused a few broken TV remotes for my household.  

Were not going to be able to get revenge on the court. The only time wed be able to is in the Finals, and as much as Id love that, odds are against it. 

What if we take Bronny at 50, stash him deeeeeep on the bench and then cut him as soon as Lebron retires? If Lebron wants him bad enough, he pays a Kings ransom. If not, it at least sours Lebrons relationship with the Lakers front office, and possibly destroys his relationship with his son. 

Thoughts?

/s",pacers,73,https://www.reddit.com/r/pacers/comments/1dpsec0/bronny_james/
2024-04-25,1714059199,I just wanted to show off my homemade Pacers earrings that I got to wear to the game against the Bucks on Tuesday!,Not pictured: gold pants &amp; salty Bucks fans,pacers,23,https://www.reddit.com/r/pacers/comments/1ccuyre/i_just_wanted_to_show_off_my_homemade_pacers/
2024-01-02,1704166474,"Post-Game Thread: Pacers beat the Bucks, 122 - 113",,pacers,211,https://www.reddit.com/r/pacers/comments/18wfgn0/postgame_thread_pacers_beat_the_bucks_122_113/
