date_utc,timestamp,title,text,subreddit,comments,url
2024-05-26,1716689616,TJ Mconnell,,pacers,7,https://www.reddit.com/r/pacers/comments/1d0rbqe/tj_mconnell/
2024-05-19,1716156114,Tyrese Haliburton ,That is all. ,pacers,2,https://www.reddit.com/r/pacers/comments/1cvzn4v/tyrese_haliburton/
2024-05-13,1715610833,The Bucks subs obsession with the Pacers is legitimately unhinged,,pacers,77,https://www.reddit.com/r/pacers/comments/1cr0tnj/the_bucks_subs_obsession_with_the_pacers_is/
2024-04-30,1714490934,"Shams: Giannis, Damian Lillard Likely Out for Bucks vs. Pacers Game 5 with Injuries ",,pacers,51,https://www.reddit.com/r/pacers/comments/1cgvnwx/shams_giannis_damian_lillard_likely_out_for_bucks/
2024-03-13,1710296034,Myles Turner,That is all.,pacers,31,https://www.reddit.com/r/pacers/comments/1bdfuqc/myles_turner/
2024-03-11,1710117549,TJ McConnell does not care about your defensive reputation. TJ McConnell is above your defense,,pacers,4,https://www.reddit.com/r/pacers/comments/1bbq2bm/tj_mcconnell_does_not_care_about_your_defensive/
2024-01-25,1706202792,Draymond Green on Mathurin - (@AlexGoldenNBA),"Alex Golden tweeted this earlier and I thought you might enjoy reading it.

Draymond Green on the Pacers: 

Whether they (Indiana) can ultimately push this thing to where we all want to go, the key to that is&BENNEDICT MATHURIN. 

That kid I think has a great deal of potential. Hes a go getter. Hes not soft at all. You aint bullying him, he aint backing down. He can shoot it well enough&he can handle it, hes pretty athletic&Bennedict Mathurin is the key to that team. 

I love his potential. I love that draft pick for the Pacers and I think hes on a good trajectory. It doesnt happen overnight. Thats a part of the growth, thats a part of getting young guys and grooming them. But what Bennedict Mathurin can become will decide ultimately what that franchise can become.

Draymond continues: 

Tyrese is great, hes one of the better point guards in this league for sure. Pascal Siakam: champion, All-NBA, All-Star. Myles Turner is a great rim protector, knock the 3 down, athletic, will finish on you. Buddy, we know Buddys shooting it&but Bennedict Mathurin is the key. His growth will ultimately determine how far the Indiana Pacers can take it.",pacers,40,https://www.reddit.com/r/pacers/comments/19feb9o/draymond_green_on_mathurin_alexgoldennba/
2024-01-17,1705520975,DEAL IS DONE EVERYBODY GET TF IN HERE!!!,"Lets fucking gooooooo!!!!!


[https://www.nba.com/news/raptors-pacers-pascal-siakam-trade](https://www.nba.com/news/raptors-pacers-pascal-siakam-trade)",pacers,51,https://www.reddit.com/r/pacers/comments/1995t6z/deal_is_done_everybody_get_tf_in_here/
2024-01-05,1704446742,I still cant believe this quote is actually real.,,pacers,18,https://www.reddit.com/r/pacers/comments/18z2w14/i_still_cant_believe_this_quote_is_actually_real/
2023-12-08,1702055643,"Referees admit they messed up on TJ McConnell travel call. ""We missed this one.""","From the NBA Referees official account on Twitter: https://twitter.com/officialnbarefs/status/1733125694454944165?s=46

""We missed this one. TJ does not gather the ball until his left foot is on the floor. He then takes a legal 1-2 (right-left) as he goes into his driving shot attempt. This was a legal play and should not have been called a travel.""",pacers,30,https://www.reddit.com/r/pacers/comments/18drkev/referees_admit_they_messed_up_on_tj_mcconnell/
2023-11-08,1699432532,"Rick Carlisle on Mathurin: ""If all youre gonna do is judge our team and his success on whether or not he scores 20 then youre gonna be disappointed and youre not thinking the right way""","Rick Carlisle went on the Wake Up Call after the Spurs game. Heres what he had to say about Benn.

I thought Benn played one of his best games last night. He only had 10-points but he played within the system, he ran hard, he defended really well and he was efficient scoring the ball. I thought last night was great.

If all youre gonna do is judge our team and his success on whether or not he scores 20 then youre gonna be disappointed and youre not thinking the right way  and thats where we are.",pacers,40,https://www.reddit.com/r/pacers/comments/17qhaye/rick_carlisle_on_mathurin_if_all_youre_gonna_do/
2024-07-12,1720786987,Indianakin joins the Conference Finalist Council,,pacers,9,https://www.reddit.com/r/pacers/comments/1e1gbul/indianakin_joins_the_conference_finalist_council/
2024-07-01,1719826584,"[Adrian Wojnarowski] BREAKING: Free agent F Paul George has agreed on a four-year, $212 million maximum contract with the Philadelphia 76ers. ","Boston is running it back. New York trades for Mikal Bridges and re-signs Anunoby. Sixers acquire PG along with some other pieces. Magic snag KCP, a big time asset who was a key piece in the Denver championship run. Not to mention, we still have the Bucks, Cavs, and Heat to worry about. 

Its time to manage expectations for the upcoming season. Our road to success just got a lot harder. ",pacers,65,https://www.reddit.com/r/pacers/comments/1dsovye/adrian_wojnarowski_breaking_free_agent_f_paul/
2024-05-19,1716157606,Never forget Knicks all dressed up in black for their own funeral,,pacers,3,https://www.reddit.com/r/pacers/comments/1cw06hs/never_forget_knicks_all_dressed_up_in_black_for/
2024-05-18,1716052626,It's not a Victory. It's...,,pacers,6,https://www.reddit.com/r/pacers/comments/1cv26pz/its_not_a_victory_its/
2024-04-25,1714004722,Whats this guys issue with Indiana?,"I really give no gravity to anything Draymond has to say, but he went out of his way to disparage Indy during all-star weekend and now this. Did we do something to him personally?",pacers,87,https://www.reddit.com/r/pacers/comments/1cce81s/whats_this_guys_issue_with_indiana/
2024-03-09,1710017888,Only One Man Can Replace Benny,,pacers,12,https://www.reddit.com/r/pacers/comments/1bas0vv/only_one_man_can_replace_benny/
2024-02-29,1709175563,"Post-Game Thread: Pacers beat the Pelicans, 123 - 114",,pacers,122,https://www.reddit.com/r/pacers/comments/1b2ppou/postgame_thread_pacers_beat_the_pelicans_123_114/
2024-01-24,1706065331,"[Highlight] Pacers rookie Ben Sheppard shows off the hustle by saving the ball from going out-of-bounds, diving on the ball to force a lose ball, getting the steal and completing the and-1!",,pacers,23,https://www.reddit.com/r/pacers/comments/19e6xwj/highlight_pacers_rookie_ben_sheppard_shows_off/
2024-08-07,1723032087,To good to no share,,pacers,12,https://www.reddit.com/r/pacers/comments/1em9ye0/to_good_to_no_share/
2024-05-19,1716160533,Vibes are IMMACULATE Lets go Pacers!,,pacers,3,https://www.reddit.com/r/pacers/comments/1cw18pp/vibes_are_immaculate_lets_go_pacers/
2024-05-04,1714789409,I was wrong about Toppin. ,"Well, when Pacers acquired Obi Toppin in the offseason, I was pretty skeptical to say the least. In a post here, I questioned why they would want to add another player that doesn't rebound and play defense; while only providing cherry picking runouts.

Now, I can say I was wrong in more ways than one. First, he's been dependable as any; 82 games played. Second, l've found myself cheering because of a great Toppin block, strong contest or even a contested rebound more times than I can remember. Third, the guy shot 40% from 3. Lastly, it's been inspiring watching him fly and attack the rim countless times each game for momentum changing plays.

Then, to Top it off, he's our leading scorer in a series clinching game 6. He played great and has been a huge part of the team's success this season.

It's only fitting the story now leads us to New York and Madison Square Garden. Toppins coming home, with a new jersey and&&a new game. ",pacers,53,https://www.reddit.com/r/pacers/comments/1cjppdx/i_was_wrong_about_toppin/
2024-04-27,1714230310,Myles being a 20+ ppg scorer in front of my eyes,,pacers,14,https://www.reddit.com/r/pacers/comments/1cegmc4/myles_being_a_20_ppg_scorer_in_front_of_my_eyes/
2024-04-14,1713123383,Its deer hunting season,,pacers,9,https://www.reddit.com/r/pacers/comments/1c421to/its_deer_hunting_season/
2024-04-14,1713108297,The Athletic s Final Grade,This team continues to improve and can handle anyone on any given night. Im excited for the playoffs to start so I can actually watch them. ,pacers,30,https://www.reddit.com/r/pacers/comments/1c3w3kk/the_athletic_s_final_grade/
2024-02-21,1708555473,"Former Pacers star Jermaine O'Neal opens up about 'Malice at the Palace,' felt 'criminalized'",,pacers,51,https://www.reddit.com/r/pacers/comments/1awpvh1/former_pacers_star_jermaine_oneal_opens_up_about/
2024-02-08,1707421579,DOUGGIE MCBUCKETS IS BACK,THE RETURN,pacers,20,https://www.reddit.com/r/pacers/comments/1am4ct1/douggie_mcbuckets_is_back/
2024-01-22,1705936740,Carlisle on playing Jarace as a SF:,"He didnt play any 4 at all tonight, so.  What Im seeing is, hes a guy capable of playing at 3.  He has good size at 3.  Hes moving his feet and staying in front of people at 3.  And, playing with more and more presence.  So those things are great to see.

When asked more:

Hes had some reps in practice.  & It doesnt mean hell always play 3, he can certainly play 4, hes been playing it in G League games.  The more Im going through this, I like playing with size.  Size that can move, and make plays, and stay in front of people, is even better.  And tonight, with Pascal, with Obi, and with Walker, we have some guys who are bigger guys that were doing a pretty good job of staying in front of people

Thoughts on Jarace as a 3/4 in the future?",pacers,66,https://www.reddit.com/r/pacers/comments/19cxy0w/carlisle_on_playing_jarace_as_a_sf/
2024-01-18,1705594162,"Pascal Siakam preferred the Pacers, who will be looking to make Indiana his permanent home. (Paywall: Story in Comments)",,pacers,29,https://www.reddit.com/r/pacers/comments/199tmfn/pascal_siakam_preferred_the_pacers_who_will_be/
2023-11-07,1699358985,"Pacers win by 41, score most points in franchise history, and the top three highlights shown on the ESPN app are from the Spurs?? Wheres the respect?",,pacers,41,https://www.reddit.com/r/pacers/comments/17psv97/pacers_win_by_41_score_most_points_in_franchise/
2024-10-19,1729373556,Anyone know what we are doing with the 15th roster spot?,"Freeman doesn't make sense cause we can two way him, and the 15th spot is often non guaranteed.
Are we leaving it open?",pacers,47,https://www.reddit.com/r/pacers/comments/1g7j8wd/anyone_know_what_we_are_doing_with_the_15th/
2024-04-29,1714404779,Bucks fans when they look at their regular season record vs the Pacers when they were healthy,,pacers,8,https://www.reddit.com/r/pacers/comments/1cg22z3/bucks_fans_when_they_look_at_their_regular_season/
2024-03-26,1711419009,Ben Sheppard getting his first career start! ,,pacers,10,https://www.reddit.com/r/pacers/comments/1bnwbn5/ben_sheppard_getting_his_first_career_start/
2023-12-12,1702347739,"Mathurin in 37 minutes off the bench: 30 points on 10-for-17 shooting, 7 rebounds, 8 assists and 2 steals","Here's how his performance tonight matches up with his other top career games: 

|Rk|Player|Date|Opp|MP|TRB|AST|STL|PTS|GmScV|
|-:|:-|:-|:-|-:|-:|-:|-:|-:|-:|
|1|Bennedict Mathurin|2022-10-29|BRK|33|5|2|0|32|24.1|
|2|Bennedict Mathurin|2023-03-29|MIL|41|9|2|2|29|24.0|
|3|Bennedict Mathurin|2023-11-09|MIL|36|11|2|1|26|23.2|
|4|Bennedict Mathurin|2023-01-29|MEM|31|8|3|1|27|21.3|
|5|Bennedict Mathurin|2023-04-09|NYK|37|3|6|0|26|20.9|
|6|Bennedict Mathurin|2022-10-21|SAS|28|5|2|0|26|20.4|
|7|Bennedict Mathurin|2023-01-24|CHI|34|7|2|0|26|20.4|


Provided by [Stathead.com](https://www.sports-reference.com/sharing.html?utm_source=direct&amp;utm_medium=Share&amp;utm_campaign=ShareTool): [View Stathead Tool Used](https://stathead.com/basketball/player-game-finder.cgi?utm_source=direct&amp;utm_medium=Share&amp;utm_campaign=ShareTool)
Generated 12/11/2023.",pacers,20,https://www.reddit.com/r/pacers/comments/18gb62c/mathurin_in_37_minutes_off_the_bench_30_points_on/
2023-11-11,1699724866,"Very obvious, but crazy fact to me... Tyrese Haliburton is still on his rookie contract and really has only played 3 seasons in the NBA. Most guys don't peak until year 6.",,pacers,24,https://www.reddit.com/r/pacers/comments/17szm28/very_obvious_but_crazy_fact_to_me_tyrese/
2024-08-15,1723732162,"[Fred Katz] The Knicks home opener is set for Oct. 25 against the Pacers, league sources say.",,pacers,75,https://www.reddit.com/r/pacers/comments/1eswn08/fred_katz_the_knicks_home_opener_is_set_for_oct/
2024-07-31,1722459093,All this iso ball from team USA is really making me miss watching the Pacers offense ,,pacers,20,https://www.reddit.com/r/pacers/comments/1egy266/all_this_iso_ball_from_team_usa_is_really_making/
2024-05-28,1716864213,At least we dont need to listen to Doris anymore?,On a serious note proud of our boys and looking forward to next year,pacers,18,https://www.reddit.com/r/pacers/comments/1d296td/at_least_we_dont_need_to_listen_to_doris_anymore/
2024-05-25,1716596794,Game 3,,pacers,5,https://www.reddit.com/r/pacers/comments/1czzmxu/game_3/
2024-05-18,1716002690,"ESPN  halftime show is a hilarious joke, as is officiating ","Storyline at halftime on ESPN was well Brunson had a bad first, and as soon as he picks it up and becomes his normal self the Pacers are in trouble. If the Pacers are only up 10 or so at half with Brunson playing like this, theyre in trouble.

Fast forward to the end of the game. Brunson finishes with 31 and the Knicks still cant even see anything resembling victory. Could not even get close. Knicks had no answers as a team.

The Knicks are not a dramatically better team than the Pacers. This is a very even series. 

If it wasnt for some poorly timed bad calls in game 1, this series could well have ended tonight and the Knicks would be going home.

Go Pacers. Cant wait for some (qualifying) Racers and Pacers on Sunday. 

",pacers,36,https://www.reddit.com/r/pacers/comments/1cunzxa/espn_halftime_show_is_a_hilarious_joke_as_is/
2024-05-09,1715290436,OG Anunoby listed as OUT for Game 3 against the Pacers,,pacers,132,https://www.reddit.com/r/pacers/comments/1co8o7o/og_anunoby_listed_as_out_for_game_3_against_the/
2024-04-22,1713749460,The Indiana Pacers Franchise Player,,pacers,53,https://www.reddit.com/r/pacers/comments/1c9yhz1/the_indiana_pacers_franchise_player/
2024-04-16,1713296301,Ringer has the Pacers with 2nd best odds to win the East,"https://nbarankings.theringer.com/playoff-odds
",pacers,39,https://www.reddit.com/r/pacers/comments/1c5p6jv/ringer_has_the_pacers_with_2nd_best_odds_to_win/
2024-03-31,1711894632,"Happy Easter Lads, Hali =",,pacers,17,https://www.reddit.com/r/pacers/comments/1bsbfvp/happy_easter_lads_hali/
2024-02-07,1707272467,All of us tonight...,"... Every night really. We just love digging holes to climb out of. >7< Can't say enough about the ""no quit"" attitude this group has. We're gonna be a menace in the playoffs.",pacers,12,https://www.reddit.com/r/pacers/comments/1akrxit/all_of_us_tonight/
2024-01-29,1706549715,"The plan is to play tomorrow for me, Tyrese Haliburton says at practice. He will assess how he feels in the morning.",,pacers,34,https://www.reddit.com/r/pacers/comments/1ae10ev/the_plan_is_to_play_tomorrow_for_me_tyrese/
2024-01-17,1705519978,The Eyes of a True Magician,"This man said youll take Bruce and these late round 25+ picks and youll give me what I want. 

Remember all the overpay complaints in Bruces deal? 

Amazing work keeping our young core for nothing but scraps and low value picks to get Pascal.

I salute you KP",pacers,13,https://www.reddit.com/r/pacers/comments/1995e4k/the_eyes_of_a_true_magician/
2023-12-06,1701906901,NBA posted an hour of Haliburton highlights,,pacers,18,https://www.reddit.com/r/pacers/comments/18ci2aq/nba_posted_an_hour_of_haliburton_highlights/
2024-05-24,1716513692,Pascal to finish the half,,pacers,9,https://www.reddit.com/r/pacers/comments/1cz93ow/pascal_to_finish_the_half/
2024-05-09,1715232262,This Sub Needs to Toughen Up,"We couldnt beat a Knicks team that lost a quarter of Brunson and Anunoby. This wasnt the officiating (like Game 1), this wasnt the coaching (yeah, McConnell maybe should have been guarding Brunson), we lacked the grit in that second half. We played like we had the lead until we didnt. Lets stop looking for excuses and ask more of our team. We cant have Siakam and Turner disappear. Lets bring in back home and tie this up, otherwise we dont deserve to have even gotten this far.",pacers,25,https://www.reddit.com/r/pacers/comments/1cnpkfm/this_sub_needs_to_toughen_up/
2024-04-21,1713716276,MY HOUSE IS PLAYOFFS READY. THE QUESTION IS ARE YOU?!?!?,,pacers,14,https://www.reddit.com/r/pacers/comments/1c9lu85/my_house_is_playoffs_ready_the_question_is_are_you/
2024-04-02,1712021606,HALI IS OFFICIALLY BACK,,pacers,11,https://www.reddit.com/r/pacers/comments/1btm91o/hali_is_officially_back/
2024-03-23,1711170381,THE INDIANA PACERS ARE NOW A GAME AND A HALF ABOVE THE PLAY-IN =O,,pacers,21,https://www.reddit.com/r/pacers/comments/1blkb4q/the_indiana_pacers_are_now_a_game_and_a_half/
2024-03-14,1710381463,HIM ,,pacers,16,https://www.reddit.com/r/pacers/comments/1be9pab/him/
2024-01-20,1705794504,Thoughts on this?,,pacers,95,https://www.reddit.com/r/pacers/comments/19bpjw6/thoughts_on_this/
2024-01-13,1705119351,Why make any trades? This team is young and just keeps getting better,"1. Some folks throw Obis name in as someone theyd trade, but keep in mind this is his first year getting extended minutes, in a clearly defined role with a team. He looks better every game. 

2. Buddy hasnt looked great at all times to start the year, but hes still one of the best long range shooters in the league, and his defense has looked so much better recently. He plays an important role on our team. 

3. We dont know this teams ceiling. We keep beating good teams, and were showing extended consistency against others. What are we chasing, exactly, when we dont even know this teams limit?

4. I am convinced free agents will want to play here in the future. We are literally setting records for best offensive statistics. We may not get the absolute best free agent available, but Im convinced we can garner significant FA interest nonetheless. Why trade for Siakam, for example, when its reported he wants to come here in the off season? And even if that calculated risk doesnt pay off, we know Jarace will be there soon.

Obviously our GM has to do his job and explore every possibility. But can somebody please explain why we should make any trades whatsoever this season? This team is fun. Weve transcended all expectations already. Lets ride it out.",pacers,94,https://www.reddit.com/r/pacers/comments/195f9a8/why_make_any_trades_this_team_is_young_and_just/
2024-09-18,1726696829,Pre-season sessions day 2: part 1,,pacers,16,https://www.reddit.com/r/pacers/comments/1fk4wbd/preseason_sessions_day_2_part_1/
2024-08-01,1722530926,TJ popped the Bubble 4 years ago with 53 points,"Most Pacers points scored in a single game

1. Reggie Miller: 57 points, 11/28/1992

2. Jermaine O-Neal: 55 points, 1/4/2005

3. T.J. Warren: 53 points, 8/1/2020",pacers,11,https://www.reddit.com/r/pacers/comments/1ehli3r/tj_popped_the_bubble_4_years_ago_with_53_points/
2024-07-08,1720445163,Team USA tries to spin a basketball on their finger,,pacers,16,https://www.reddit.com/r/pacers/comments/1dy8vrt/team_usa_tries_to_spin_a_basketball_on_their/
2024-04-26,1714154803,"guide us, lisan pascal-gaib",,pacers,7,https://www.reddit.com/r/pacers/comments/1cds7it/guide_us_lisan_pascalgaib/
2024-04-19,1713534504,Siakam last time he was in the playoffs: 22.8 ppg 7.2 rpg 5.8 apg 1.2 spg 1.0 bpg 56% ts,Also notably had 32/9/6 on 13-22 shooting in last years play-in,pacers,19,https://www.reddit.com/r/pacers/comments/1c7xc77/siakam_last_time_he_was_in_the_playoffs_228_ppg/
2024-02-06,1707261804,"Indianas Tyrese Haliburton, Myles Turner and Bennedict Mathurin will team up for the NBA Skills Challenge at All-Star Weekend",https://x.com/shamscharania/status/1755007249984930201?s=46&amp;t=A7RNrt-CJvtXGsvjKm2lCg,pacers,18,https://www.reddit.com/r/pacers/comments/1ako186/indianas_tyrese_haliburton_myles_turner_and/
2024-01-09,1704819452,Stop Playing So Hard,"You know, the Pacers really need learn their place. How dare they show emotion and fight hard to win games in January. Sure we've beat the Bucks 4 times and split our series with the Celtics, but those don't count. They should just roll over and let the ""big dogs"" win. 

Obvious /S",pacers,30,https://www.reddit.com/r/pacers/comments/192je8t/stop_playing_so_hard/
2023-10-29,1698568139,THIS IS AN AARON NESMITH APPRECIATION POST,He is a core part of the squad KEEP THIS MAN AT ALL COSTS,pacers,25,https://www.reddit.com/r/pacers/comments/17iyhvm/this_is_an_aaron_nesmith_appreciation_post/
2023-10-29,1698544779,"We currently have the best PG and most depth at the position in franchise history. Feels great knowing at least one of these players is always on the court. We've had some good point guards throughout the years, but nothing like this.",,pacers,15,https://www.reddit.com/r/pacers/comments/17iss56/we_currently_have_the_best_pg_and_most_depth_at/
