date_utc,timestamp,title,text,subreddit,comments,url
NA,NA,NA,NA,NA,NA,NA
2024-02-10,1707575758,Dodged a bullet,,pacers,32,https://www.reddit.com/r/pacers/comments/1anhojm/dodged_a_bullet/
2024-01-27,1706320088,Upvote to Support Nesmiths Family Line,"Booker elbowed Nesmith in the groin and tried to end his family line. Ref straight up ignored it.

Booker is dirty and the refs are terrible.",pacers,5,https://www.reddit.com/r/pacers/comments/1abz9wk/upvote_to_support_nesmiths_family_line/
2024-01-17,1705529361,Pascal Siakam is a perfect fit for the Pacers (from a Raptors fan),"Seeing a lot of Pacers fans posting in the Raps subs asking for opinions on Siakam.

imo hes still an All-NBA talent. The last 2-3 years hes been held back by not only being on a bad team, but being in a really bad fit. Hes the type of guy that you surround with shooters, and until the OG trade we didnt have a single shooter in the starting lineup.

Hes the most elite that a second option can be, and pairing him with a playmaking first option like Haliburton is going to be a phenomenal pairing. Also having a stretch 5 in Turner and the shooters yall have around him, I think youll be a genuine contender.

Personality wise hes one of the most positive guys Ive watched, hes always having fun and his come up story is pretty cool. For those who dont know, he only started playing ball at like age 17, got drafted late and worked his way up to all-NBA. He has mad hustle, crazy physicality and size and I think as a second option and in a winning environment youre gonna see his defence level back up.

His whole career hes been a late bloomer, I think hes gonna play his best basketball on the Pacers. Hes extremely underrated as a playmaker as well, with the lack of spacing idk how hes averaged 5-6 assists per game, with the time hes gonna have in the paint hes gonna always be a scoring threat and if he gets doubled he almost always makes the right pass out.

Gonna have to start tuning into some Pacers games!",pacers,13,https://www.reddit.com/r/pacers/comments/1999b4e/pascal_siakam_is_a_perfect_fit_for_the_pacers/
2023-12-05,1701744777,Unreal performance.,,pacers,3,https://www.reddit.com/r/pacers/comments/18b1ws4/unreal_performance/
2023-11-15,1700067801,Love to see it,,pacers,19,https://www.reddit.com/r/pacers/comments/17vy5gn/love_to_see_it/
2024-09-04,1725416076,Reggie Miller in 18 Seasons,,pacers,36,https://www.reddit.com/r/pacers/comments/1f8hzzi/reggie_miller_in_18_seasons/
2024-08-29,1724944154,12th Square - Most athletic Pacer of all time?,,pacers,179,https://www.reddit.com/r/pacers/comments/1f44u05/12th_square_most_athletic_pacer_of_all_time/
2024-05-28,1716863297,"Flagrant? no wayyy, in fact thats barely even a foul",,pacers,47,https://www.reddit.com/r/pacers/comments/1d28wmb/flagrant_no_wayyy_in_fact_thats_barely_even_a_foul/
2024-05-15,1715802007,Let's be real,"Home court advantage has been huge in this series, we can all see it clearly. 

The probable outcome of this series is the Knicks win in 7. I don't think the Pacers will give up a game at home, and will finish the playoffs undefeated in Gainbridge. That's massive. 

Game 7 will be a slugfest. I'm not saying the Pacers don't have a chance, if they play like they did in game 1 and maybe even bring some of the energy from games 3, 4, and 6, they'll have a shot. But it seems more likely than not that it's not in the cards to win in MSG.

THAT BEING SAID

This series will do so much more for our team development going into next year and especially our next playoff run than anything that's happened up to this point (even, and especially, the Bucks series). The young players have now seen what it takes to compete in the playoffs, and will have learned many lessons about what to do and not to do in high pressure situations. 

So, we get through the end of this series, wipe the board clean, get some rest, get everybody right, and come back next year with a clean slate of 82 (plus) games ready to take it even further. 

Losing to the Knicks sucks, but it even took Reggie a few tries to get over that hump. The two franchises will be tied at 4-4 against each other in the playoffs, and it seems likely we'll meet again next year. 

Losing in MSG is frustrating, especially when it seems rather clear the changes that need to be made. It's hard to account for a guy like Brunson doing his thing though. But the future is brighter than it's ever been.

And just think, had things gone slightly differently this year, we could've been in the play in and lost and not even gotten this experience. 

We're gonna be alright. ",pacers,26,https://www.reddit.com/r/pacers/comments/1cstqsr/lets_be_real/
2024-05-10,1715351066,"""Members of the NYK organization are upset with how Jalen Brunson is being officiated""","&gt;""Amid the discourse over fouls/officiating in Knicks-Pacers,  league sources say members of NYK organization are upset with how Jalen Brunson is being officiated. Members of the organization feel that hes being grabbed/hit up and down the floor and its gone unnoticed by refs.""

Via Ian Begley on Twitter.

Hahahahaha.  I mean, why not I suppose?   But I think this is why you just shup up and play.",pacers,118,https://www.reddit.com/r/pacers/comments/1coqsui/members_of_the_nyk_organization_are_upset_with/
2024-04-07,1712533880,"We beat the Heat, one step closer to playoffs. Bring out the dancing crabs!!!!",,pacers,3,https://www.reddit.com/r/pacers/comments/1byjbip/we_beat_the_heat_one_step_closer_to_playoffs/
2024-04-03,1712117812,Chris and Quinn at C is disrespectful. ,,pacers,66,https://www.reddit.com/r/pacers/comments/1bujhw2/chris_and_quinn_at_c_is_disrespectful/
2024-03-11,1710117088,"Pacers win, bring out the dancing crabs!!!!",,pacers,3,https://www.reddit.com/r/pacers/comments/1bbpwb6/pacers_win_bring_out_the_dancing_crabs/
2024-02-26,1708906505,"Back to back wins, lets go! Bring out the dancing crabs!!!",,pacers,3,https://www.reddit.com/r/pacers/comments/1b03klg/back_to_back_wins_lets_go_bring_out_the_dancing/
2024-02-23,1708717795,Siakam Mid Range,I didnt realize before the trade how good of a mid range shooter that Pascal is. Every time he shoots from 10-15 feet I swear it goes in. Super important skill set in the playoffs.,pacers,24,https://www.reddit.com/r/pacers/comments/1ay9uhi/siakam_mid_range/
2024-01-23,1706016090,"[Kevin Bowen] Rick Carlisle says Tyrese Haliburton (hamstring) will not play tonight. Going to sit him for the next 3 gamesDenver, Philly, Phoenix. Not a re-injury. Just injury recover management type stuff.",,pacers,116,https://www.reddit.com/r/pacers/comments/19doac2/kevin_bowen_rick_carlisle_says_tyrese_haliburton/
2023-12-08,1701997478,Tyrese Haliburton MVP Appreciation Thread! 27 points | 15 assists | 7 rebounds | 0 turnovers,,pacers,3,https://www.reddit.com/r/pacers/comments/18darm6/tyrese_haliburton_mvp_appreciation_thread_27/
2024-09-06,1725629988,Upgraded my NBA2K Olympic Benchwarmer Edition SUBSTANTIALLY ,,pacers,3,https://www.reddit.com/r/pacers/comments/1fafg27/upgraded_my_nba2k_olympic_benchwarmer_edition/
2024-06-28,1719534313,Indiana Pacers Reportedly Add Purdue's Lance Jones to NBA Summer League Roster,,pacers,34,https://www.reddit.com/r/pacers/comments/1dq6j3n/indiana_pacers_reportedly_add_purdues_lance_jones/
2024-05-20,1716237829,Isaiah Jackson,"A lot of flowers being handed out after beating the Knicks, and just wondering how people are feeling about Mr. Jackson? Personally I'm very surprised that Jalen Smith isn't our backup C through the playoffs, but I can't argue because I-Jax has been fantastic! 

His relentless energy, switchability, and straight athleticism has been a nice wrinkle in the bench unit. I have no idea what the plan is going forward with him, but I'm certainly not worried if Stix gets a nice offer and we can't afford to keep him.",pacers,53,https://www.reddit.com/r/pacers/comments/1cwpx18/isaiah_jackson/
2024-05-19,1716156216,ECF bound,,pacers,2,https://www.reddit.com/r/pacers/comments/1cvzofj/ecf_bound/
2024-05-02,1714610257,Get used to it. The Playoffs are hard.,"Take a deep breath. This is the playoffs, which hopefully the Pacers are gonna be part of for the years to come.

Ive been watching the Pacers since the Knicks rivalry was born. Its never easy to win a series. Things tend to play out unexpectedly. It can be torture as a fan, but dont let one game get you too down, epecially when the Pacers are still leading the series.
",pacers,33,https://www.reddit.com/r/pacers/comments/1ci28eq/get_used_to_it_the_playoffs_are_hard/
2024-04-29,1714351966,MYLES TURNER MASSIVE POSTER =3=3=3=3,MYLES TURNER MASSIVE POSTER =3=3=3=3,pacers,11,https://www.reddit.com/r/pacers/comments/1cfm67r/myles_turner_massive_poster/
2024-04-05,1712327578,New logo for LA this season,,pacers,12,https://www.reddit.com/r/pacers/comments/1bwjjyz/new_logo_for_la_this_season/
2024-03-03,1709504684,"[Wojnarowski] The Indiana Pacers are converting two-way G/F Kendall Brown on a new three-year deal, sources tell ESPN. Brown was the 48th overall pick in the 2022 NBA Draft.",,pacers,35,https://www.reddit.com/r/pacers/comments/1b5u0ld/wojnarowski_the_indiana_pacers_are_converting/
2024-02-23,1708654651,First game back from the All Star Break is a win. Bring out the dancing crabs!!,,pacers,0,https://www.reddit.com/r/pacers/comments/1axp0x8/first_game_back_from_the_all_star_break_is_a_win/
2024-02-20,1708443309,JJ giving lots of love to Indy and Tyrese. Such a breath of fresh air after all the disrespect Indy got from the media during All-Star weekend.,"Never liked JJ while he was playing, but hes become one of the only people in basketball media that I actually thoroughly enjoy listening to. He also has about an hour segment with Tyrese thats a great watch if yall have the time. ",pacers,15,https://www.reddit.com/r/pacers/comments/1avkho4/jj_giving_lots_of_love_to_indy_and_tyrese_such_a/
2024-02-19,1708321091,Well get em when it really matters... ,,pacers,11,https://www.reddit.com/r/pacers/comments/1aufr22/well_get_em_when_it_really_matters/
2024-02-08,1707422359,Doug McDermott jersey swap,I whipped it together as fast as I could.,pacers,3,https://www.reddit.com/r/pacers/comments/1am4o48/doug_mcdermott_jersey_swap/
2023-12-14,1702529712,FYI: Game Footage Shows The Pacers Never Had The Game Ball To Begin With,,pacers,29,https://www.reddit.com/r/pacers/comments/18i0up9/fyi_game_footage_shows_the_pacers_never_had_the/
2023-12-08,1701996481,Myles Turner with the game of his career tonight =O=O=O,,pacers,18,https://www.reddit.com/r/pacers/comments/18dafoo/myles_turner_with_the_game_of_his_career_tonight/
2023-11-25,1700882563,Pacers win!!! ,,pacers,3,https://www.reddit.com/r/pacers/comments/183aaxw/pacers_win/
2023-10-29,1698544306,"Post-Game Thread: Tyrese went for the kill as the Pacers beat the Cavs, 125 - 113",,pacers,119,https://www.reddit.com/r/pacers/comments/17isn7r/postgame_thread_tyrese_went_for_the_kill_as_the/
2024-08-16,1723851823,Launching a campaign to get TJ the last spot on this. ,,pacers,21,https://www.reddit.com/r/pacers/comments/1eu3l4y/launching_a_campaign_to_get_tj_the_last_spot_on/
2024-05-23,1716486990,"Knicks Rumors: OG Anunoby May Test Free Agency, Consider Contracts from Other Teams",,pacers,94,https://www.reddit.com/r/pacers/comments/1cyz4uc/knicks_rumors_og_anunoby_may_test_free_agency/
2024-05-19,1716087064,Siakam haters should check out the Mavs,"Kyrie headed to Dallas in a late season trade last year, and they missed the playoffs. Fit was questioned, etc. This year theyre a 50 win team in the western conference finals, and look pretty good together. Next year with a full offseason and full regular season with Pascal, I bet well be laughing at those who were questioning whether we should keep him.",pacers,50,https://www.reddit.com/r/pacers/comments/1cve957/siakam_haters_should_check_out_the_mavs/
2024-05-15,1715746332,Thoughts,,pacers,241,https://www.reddit.com/r/pacers/comments/1csc3ba/thoughts/
2024-05-11,1715393646,Lol tagging Beverlys podcast,,pacers,5,https://www.reddit.com/r/pacers/comments/1cp6pij/lol_tagging_beverlys_podcast/
2024-05-10,1715362237,35K aint nothing to a pimp,,pacers,5,https://www.reddit.com/r/pacers/comments/1cov5bs/35k_aint_nothing_to_a_pimp/
2024-03-06,1709734888,How are we feeling Rick?,,pacers,4,https://www.reddit.com/r/pacers/comments/1b80vmp/how_are_we_feeling_rick/
2024-02-29,1709240496,Day 29 of 29! Pacer Jersey Designs! What a run its been!,,pacers,15,https://www.reddit.com/r/pacers/comments/1b3b8nk/day_29_of_29_pacer_jersey_designs_what_a_run_its/
2024-02-08,1707421577,"[Woj] The Spurs are trading Doug McDermott to the Pacers, sources tell ESPN.",,pacers,71,https://www.reddit.com/r/pacers/comments/1am4cs9/woj_the_spurs_are_trading_doug_mcdermott_to_the/
2024-02-07,1707272477,"Post-Game Thread: Pacers beat the Rockets, 132 - 129",,pacers,129,https://www.reddit.com/r/pacers/comments/1akrxmx/postgame_thread_pacers_beat_the_rockets_132_129/
2024-01-13,1705113858,Who you got?,,pacers,15,https://www.reddit.com/r/pacers/comments/195dg3k/who_you_got/
2024-01-09,1704763191,[Charania] Indiana Pacers say All-Star Tyrese Haliburton has suffered a left hamstring strain.,,pacers,67,https://www.reddit.com/r/pacers/comments/19222o8/charania_indiana_pacers_say_allstar_tyrese/
2024-01-02,1704164824,F BOBBY PORTIS,,pacers,21,https://www.reddit.com/r/pacers/comments/18wewaw/f_bobby_portis/
2023-12-14,1702528078,"Carlisle: ""What happened after the game was unfortunate. There was a misunderstanding about the game ball. It was Oscar Tshiebwe's first NBA point. So we always get the game ball. We grabbed the ball and a couple of minutes later several of their players ended up in our hallway.""",,pacers,146,https://www.reddit.com/r/pacers/comments/18i0dmp/carlisle_what_happened_after_the_game_was/
2023-11-10,1699587327,He is inevitable,,pacers,17,https://www.reddit.com/r/pacers/comments/17rv7cn/he_is_inevitable/
2024-07-02,1719939633,"[Wojnarowski] Free agent center James Wiseman has agreed on a two-year contract with the Indiana Pacers, sources tell ESPN. Wiseman was the No. 2 overall pick in the 2020 NBA Draft.",,pacers,19,https://www.reddit.com/r/pacers/comments/1dtqudi/wojnarowski_free_agent_center_james_wiseman_has/
2024-06-12,1718202249,[Highlight] Caitlin Clark Blocks TJ McConnell's Shot at Pacers/Fever Media Event,,pacers,14,https://www.reddit.com/r/pacers/comments/1de7xc2/highlight_caitlin_clark_blocks_tj_mcconnells_shot/
2024-05-24,1716548740,"If Rese's injury is serious, he should be sat for the rest of the series. ","If he's playing through injury, we're probably not gonna win anyway. Why risk long term damage to Rese by pushing him to play when he's not healthy?",pacers,139,https://www.reddit.com/r/pacers/comments/1czi4qj/if_reses_injury_is_serious_he_should_be_sat_for/
2024-05-19,1716135889,WOJ: Anunoby and Hart expected to play in Game 7.,,pacers,93,https://www.reddit.com/r/pacers/comments/1cvs4yj/woj_anunoby_and_hart_expected_to_play_in_game_7/
2024-05-17,1715970644,Fake Tough Guy Donte DiCostanza,"Rich parents, Elite Private school, flops a lot, looks like George from Seinfeld with a fade, pretty tough",pacers,18,https://www.reddit.com/r/pacers/comments/1cuclo9/fake_tough_guy_donte_dicostanza/
2024-03-23,1711214771,"11 games remaining and if these standings hold, I see a clear path to the conference finals. ",,pacers,57,https://www.reddit.com/r/pacers/comments/1blxn5p/11_games_remaining_and_if_these_standings_hold_i/
2024-03-23,1711163873,Hello Were Back department? Id like to file a claim,,pacers,3,https://www.reddit.com/r/pacers/comments/1blic9a/hello_were_back_department_id_like_to_file_a_claim/
2024-02-22,1708645845,Let's Go Pacers!,,pacers,8,https://www.reddit.com/r/pacers/comments/1axltes/lets_go_pacers/
2024-02-18,1708233002,Tyrese Haliburton and Myles Turner weren't buying Bennedict Mathurin when he said winning the Skills Challenge was his top moment of All Star weekend after he won Rising Stars MVP on Friday,,pacers,5,https://www.reddit.com/r/pacers/comments/1atm909/tyrese_haliburton_and_myles_turner_werent_buying/
2024-02-10,1707584151,"[Tony East] Complicating matters were Hield's desires. Gregg Doyel reported in the Indianapolis Star Friday morning that Hield asked to be traded, and AllPacers confirmed that fact with a league source. The Pacers filled that request.",,pacers,86,https://www.reddit.com/r/pacers/comments/1ankpna/tony_east_complicating_matters_were_hields/
2024-02-01,1706799611,Yall ready to see the real King of New York tonight?,,pacers,30,https://www.reddit.com/r/pacers/comments/1agcxyd/yall_ready_to_see_the_real_king_of_new_york/
2024-01-19,1705671273,I haven't slept...,"I pulled an all nighter. Last night's game triggered a manic high and I haven't been able to come back down. This team is better than sex. I can't wait for tonight's game hopefully we don't shit the bed.

It's all good though, I used the adrenaline to finish my physics lab. I used a cat to charge a metal rod and transfer the charge to metal balls to examine coulombs law. Cool stuff. I'm grabbing breakfast now. Have a nice day =
 ",pacers,40,https://www.reddit.com/r/pacers/comments/19aj7jx/i_havent_slept/
2024-01-04,1704389234,Observation from the game - Jarace and Rick,"My tickets are about 15 rows back from the Pacers bench so I sometimes get to see some things that you miss on tv. Last night, about 45 seconds after Jarace checked in, Rick called a timeout and was absolutely livid at Jarace for his lack of effort. He threw the clipboard down and immediately started yelling at him. Jarace could not have looked less interested in what Rick was saying. There was some very uneasy vibes from those 2. 

This might have just been a blip with no significance but it sure seemed like something that is a problem. I wouldnt be surprised to see Jarace as a trade piece.",pacers,88,https://www.reddit.com/r/pacers/comments/18yikra/observation_from_the_game_jarace_and_rick/
2023-12-14,1702571320,POV: Youre in the Pacers locker room after taking the reserve game ball for the rookie who scored his first NBA points,Meanwhile the actual game ball was with the Bucks the entire time lol,pacers,31,https://www.reddit.com/r/pacers/comments/18icez6/pov_youre_in_the_pacers_locker_room_after_taking/
2024-09-27,1727455018,"Myles Turners contract should be discussed. Do we keep him? If so, what does his contract look like?","Myles Turner is currently our third best player. He averaged 17 and 6 for the season on 52% from the field, which is a solid stat-line for a third option. I remember seeing some stat about hos the Tyrese Haliburton and Myles Turner pick and pop was one of the top scoring plays in the league. 

Although he averaged similar numbers in the playoffs, he was absolutely a level above what he was in the regular season. After the ASB, it seemed like his shot-blocking ability came back to him, and he was putting everyone on a poster. All of this makes him super valuable to this team.

However, this also means that Myles Turner is going to get looked at by *other* teams. That allusive stretch five title is a very valuable asset to any team. I think every team in the league besides the ones that already have those shot-blocking three point shooting centers would absolutely love to have him. 

I think it is absolutely crucial to keep him. Chad Buchanan has made it very clear that he wants Turner to stay. With that being said, we know we cant pay everyone. Pascal did take a substantial pay cut, opting to not take the max contract, but we did have to pay Obi Toppin, Andrew Nembhard, and TJ McConnell. 

What are your thoughts?

",pacers,128,https://www.reddit.com/r/pacers/comments/1fqs0lh/myles_turners_contract_should_be_discussed_do_we/
2024-06-02,1717357757,Definitely my new favorite shirt,Got it from obsessed with graphic tees one of the first things that pops up when you search Reggie miller choke tee looked at a lot of options but this one was the best choice to me because theres no background. Its like a die-cut of Reggie printed right on the shirt.,pacers,19,https://www.reddit.com/r/pacers/comments/1d6lojl/definitely_my_new_favorite_shirt/
2024-05-28,1716894707,"""Dad, what were the 2023-24 Pacers like?""",,pacers,3,https://www.reddit.com/r/pacers/comments/1d2gwl1/dad_what_were_the_202324_pacers_like/
2024-05-23,1716501097,We already have an OG Anunoby with Aaron Nesmith,,pacers,53,https://www.reddit.com/r/pacers/comments/1cz4sm8/we_already_have_an_og_anunoby_with_aaron_nesmith/
2024-05-08,1715199194,[Charania] Indianapolis Police is investigating the incident between Patrick Beverley and a fan during Game 6 of Bucks-Pacers series; detectives confirm to me and @MikeVorkunov they are working with Gainbridge Fieldhouse to review video footage and plan to speak with the parties involved.,,pacers,38,https://www.reddit.com/r/pacers/comments/1cne6eu/charania_indianapolis_police_is_investigating_the/
2024-05-07,1715049604,"Somebody had to do it, guys. This is where each referee from tonight's game was born","Zach Arba - New York, New York
Sean Wright - New York, New York
Ray Acosta - Elizabeth, New Jersey
Tyler Ford - Lima, Ohio
",pacers,53,https://www.reddit.com/r/pacers/comments/1cm1cxr/somebody_had_to_do_it_guys_this_is_where_each/
2024-05-06,1715031386,May the spirit of the Great Wall of Hibbert be with the Pacers during this series,"and may the Pacers run Mach 10 all game, every game",pacers,5,https://www.reddit.com/r/pacers/comments/1cluvfp/may_the_spirit_of_the_great_wall_of_hibbert_be/
2024-04-29,1714398378,Bobby Sucks,,pacers,6,https://www.reddit.com/r/pacers/comments/1cfzicr/bobby_sucks/
2024-04-09,1712665869,"On T.J. McConnell going from out of the Pacers rotation in the season opener to becoming an indispensable, crucial piece the team relies on:",,pacers,8,https://www.reddit.com/r/pacers/comments/1bzqzkb/on_tj_mcconnell_going_from_out_of_the_pacers/
2024-03-23,1711219503,Gotta Go Fast,,pacers,8,https://www.reddit.com/r/pacers/comments/1blziyr/gotta_go_fast/
2024-02-07,1707273054,Tyrese Haliburton talks so much trash to Dillon Brooks after dagger vs Rockets,,pacers,32,https://www.reddit.com/r/pacers/comments/1aks4mf/tyrese_haliburton_talks_so_much_trash_to_dillon/
2024-01-31,1706729264,[Agness] The IST Championship game WILL count towards Haliburton's games played,,pacers,14,https://www.reddit.com/r/pacers/comments/1afq99j/agness_the_ist_championship_game_will_count/
2024-01-30,1706649789,Bennedict Mathurin and Oscar Tshiebwe will be playing in the Rising Stars game!,,pacers,27,https://www.reddit.com/r/pacers/comments/1aezrva/bennedict_mathurin_and_oscar_tshiebwe_will_be/
2024-01-20,1705718309,Tyrese was mic'd up last night. He joined the Sacramento fans booing Buddy >#,,pacers,19,https://www.reddit.com/r/pacers/comments/19b18l7/tyrese_was_micd_up_last_night_he_joined_the/
2023-12-03,1701574313,A win without Haliburton? Celebration dancing crabs!!!!,,pacers,6,https://www.reddit.com/r/pacers/comments/189kk4z/a_win_without_haliburton_celebration_dancing_crabs/
2024-08-16,1723818725,Sixth Day: Who is the most annoying player in team history?,"Funniest - Results

1) Lance Stephenson

2) Scott Pollard

3) Orlando Johnson

4) Jeff Teague

5) TJ McConnell",pacers,174,https://www.reddit.com/r/pacers/comments/1etqbzc/sixth_day_who_is_the_most_annoying_player_in_team/
2024-07-17,1721233493,I love watching Tyrese Haliburton have to stand in the corner like a spot-up shooter ,Thank you Steve Kerr very cool,pacers,70,https://www.reddit.com/r/pacers/comments/1e5mg4p/i_love_watching_tyrese_haliburton_have_to_stand/
2024-05-27,1716843626,Today we celebrate...,,pacers,5,https://www.reddit.com/r/pacers/comments/1d226i8/today_we_celebrate/
2024-05-19,1716127014,"Game Thread: Indiana Pacers @ New York Knicks, Game 7, May 19th, 2024. 3:30PM","Home Team|**May 19th, 2024**|Away Team
:-----------:|:---------------:|:------------:
[] (/r/nyknicks)|**vs**| [] (/r/pacers)
|3-3|[](/r/espn)|3-3
|Knicks||Pacers
||**Time: 3:30**|
||**[Game Preview](https://www.nba.com/pacers/news/preview-pacers-knicks-240519)**|
|||
||**Pacers Betting Odds**|
|*Spread*|*ML*|*O/U*|
|+3.5|+140|208.5|
#**Projected Starters**
**Pacers**  
"" **PG -** Tyrese Haliburton  
"" **SG -** Andrew Nembhard                                       
"" **SF -** Aaron Nesmith                                                        
"" **PF -** Pascal Siakam                                   
"" **C -** Myles Turner                              

**Knicks**    
"" **PG -** Jalen Brunson     
"" **SG -** Miles McBride                   
"" **SF -** Donte DiVincenzo  
"" **PF -** Josh Hart                                
"" **C -** Isaiah Hartenstein        
                           
_____
#**Injuries**

**Pacers**        
"" Bennedict Mathurin - Out (Right Shoulder Labral Tear)       
                   
**Knicks**    
"" Josh Hart - Questionable (Strained Abdominal)     
"" OG Anunoby - Questionable (Left Hamstring Strain)     
"" Bojan Bogdanovic - Out (Left Foot Surgery)   
"" Mitchell Robinson - Out (Left Ankle Stress Injury)  
"" Julius Randle - Out (Right Shoulder Surgery)",pacers,4100,https://www.reddit.com/r/pacers/comments/1cvov12/game_thread_indiana_pacers_new_york_knicks_game_7/
2024-04-04,1712202954,"This fanbase cant take any loss without turning into a we dont deserve the playoffs, Haliburton is a fraud, why live fest. And then if we beat OKC everyone will be happy again. Literally bipolar",,pacers,68,https://www.reddit.com/r/pacers/comments/1bvdnys/this_fanbase_cant_take_any_loss_without_turning/
2024-03-29,1711702566,Savage Bandwagon Callout,,pacers,18,https://www.reddit.com/r/pacers/comments/1bqkivb/savage_bandwagon_callout/
2024-03-26,1711452795,"Woke up and saw a Pacers win, bring out the dancing crabs! ",,pacers,4,https://www.reddit.com/r/pacers/comments/1bo5mvv/woke_up_and_saw_a_pacers_win_bring_out_the/
