date_utc,timestamp,title,text,subreddit,comments,url
2024-05-26,1716731644,Resigning Pascal Siakam has to be a huge priority for the Pacers,I'm sure there will be plenty of teams looking to sign him in the offseason after the numbers he has been putting up in the playoffs.,pacers,69,https://www.reddit.com/r/pacers/comments/1d11vh8/resigning_pascal_siakam_has_to_be_a_huge_priority/
2024-05-22,1716393328,ESPNs spent more time today talking about the Knicks than the two teams actually playing in the ECF,,pacers,21,https://www.reddit.com/r/pacers/comments/1cy3omj/espns_spent_more_time_today_talking_about_the/
2024-05-07,1715045934,Name a more iconic trio,,pacers,33,https://www.reddit.com/r/pacers/comments/1cm046v/name_a_more_iconic_trio/
2024-05-04,1714834039,Thanks for coming Pacers,Nobody thinks we have a chance,pacers,338,https://www.reddit.com/r/pacers/comments/1ck1zp4/thanks_for_coming_pacers/
2024-04-16,1713285643,"Got a chance to go see the new murals, super cool",,pacers,16,https://www.reddit.com/r/pacers/comments/1c5kqhc/got_a_chance_to_go_see_the_new_murals_super_cool/
2024-04-16,1713277541,"[Woj] The Milwaukee Bucks are preparing to be without two-time MVP Giannis Antetokounmpo for the start of their opening round series against the Indiana Pacers, but are hopeful treatment on his left calf strain will allow him to return sometime later in the series.",,pacers,110,https://www.reddit.com/r/pacers/comments/1c5hfde/woj_the_milwaukee_bucks_are_preparing_to_be/
2023-11-29,1701243703,You guys are well liked in Sacramento,,pacers,22,https://www.reddit.com/r/pacers/comments/186k233/you_guys_are_well_liked_in_sacramento/
2024-10-22,1729610256,2024-25... BEGIN!!!,,pacers,14,https://www.reddit.com/r/pacers/comments/1g9kn8q/202425_begin/
2024-05-19,1716156104,TJ with another award,,pacers,2,https://www.reddit.com/r/pacers/comments/1cvzmz6/tj_with_another_award/
2024-04-22,1713744597,I hate Basketball,Everything is Pain.,pacers,131,https://www.reddit.com/r/pacers/comments/1c9wvtg/i_hate_basketball/
2024-01-17,1705526465,You guys got a special player in Siakam,"Hey just wanted to give my perspective as a Raptors fan on what you guys are getting in Siakam. He has been carrying the Raptors offence the past several years with very crowded spacing where he is driving into 5 defenders and still scoring. His ability to wiggle through space, stretch out and score at the rim is unlike any other player in the league which makes him a very tough cover for most teams. He is also a very good mid range shooter, and an above average defender. Even though his 3 point shooting isnt amazing he can still space the floor and knock em down, especially from the corners. We really did not build a good team around him in Toronto and so I think he is undervalued by a lot of fans around the league. With the Pacers spacing and with Haliburton diming him up, his efficiency should improve. Also hes just a hard worker overall, first guy in the gym, last guy out. I also think he will re-sign given that hes not the type of guy who craves a big market team, he just wants to win. I will definitely be tuning into a lot more Pacers games in the future, you guys are a lot closer to contenders now after this trade!",pacers,50,https://www.reddit.com/r/pacers/comments/19984ie/you_guys_got_a_special_player_in_siakam/
2024-05-28,1716868597,"The people who say ""Fire Carlisle' needs to shut up.",Y'all made it all the way to the conference finals so there should be any complaining about the coaching or anything like that. ,pacers,59,https://www.reddit.com/r/pacers/comments/1d2ahtw/the_people_who_say_fire_carlisle_needs_to_shut_up/
2024-05-28,1716856275,Shut up Doris,"My family thinks I've lost it. I've developed a habit of saying ""shut up Doris"" every time her trashy smoker voice comes thru the tv. ",pacers,41,https://www.reddit.com/r/pacers/comments/1d26pge/shut_up_doris/
2024-05-11,1715470793,"[Scott Agness] Myles Turners massive block on Josh Hart with 2:03 to go - tied at 102- was the correct call, per league source with access to tracking technology.",,pacers,21,https://www.reddit.com/r/pacers/comments/1cpuf48/scott_agness_myles_turners_massive_block_on_josh/
2024-05-03,1714707884,OFFICIAL: The Indiana Pacers will square off against the New York Knicks in Round 2 of the 2024 NBA Playoffs.,,pacers,152,https://www.reddit.com/r/pacers/comments/1ciz5ol/official_the_indiana_pacers_will_square_off/
2024-04-27,1714178354,COPE ALERT!!!,,pacers,55,https://www.reddit.com/r/pacers/comments/1ce1f3y/cope_alert/
2024-04-15,1713218959,3 pacers on here =%,TJ McConnell is the = ,pacers,17,https://www.reddit.com/r/pacers/comments/1c4z6jp/3_pacers_on_here/
2024-09-30,1727728705,Our Own Little Big Three  ,"No, it isnt a big three, but I love this trio. They are going to kill it this season. Go Pacers!",pacers,17,https://www.reddit.com/r/pacers/comments/1ft5yc6/our_own_little_big_three/
2024-05-25,1716662391,[WOJ] ESPN Sources: Indiana Pacers All-NBA G Tyrese Haliburton is unlikely to play Game 3 vs. the Boston Celtics tonight with a left hamstring injury. Boston leads the Eastern Conference Finals 2-0.,,pacers,195,https://www.reddit.com/r/pacers/comments/1d0iim2/woj_espn_sources_indiana_pacers_allnba_g_tyrese/
2024-05-04,1714849969,I think I accidentally created art,,pacers,11,https://www.reddit.com/r/pacers/comments/1ck7zn3/i_think_i_accidentally_created_art/
2024-04-23,1713916479,"I am wearing EVERY SINGLE ARTICLE OF PACERS CLOTHING I OWN. 5 shirts, 5 jerseys, 2 hats, and a pair of shorts. I AM VERY UNCOMFORTABLE BUT ITS FOR THE LOVE OF THE GAME",,pacers,24,https://www.reddit.com/r/pacers/comments/1cbjyzx/i_am_wearing_every_single_article_of_pacers/
2024-04-14,1713126391,Pascal Siakam,Some love for this guy ,pacers,17,https://www.reddit.com/r/pacers/comments/1c43aou/pascal_siakam/
2024-03-22,1711075938,[East] The Bucks just beat the Nets. The Pacers have clinched a spot in at least the Play-In tournament. They will play beyond the regular season.,,pacers,28,https://www.reddit.com/r/pacers/comments/1bkp4z4/east_the_bucks_just_beat_the_nets_the_pacers_have/
2024-08-22,1724330311,FTK,,pacers,13,https://www.reddit.com/r/pacers/comments/1eyi96b/ftk/
2024-05-18,1716001505,"WE WON, GAME 7 AWAITS. BRING OUT THE DANCING CRABS!!!!! ",,pacers,9,https://www.reddit.com/r/pacers/comments/1cunn3u/we_won_game_7_awaits_bring_out_the_dancing_crabs/
2024-05-11,1715448775,It's Floppin' Time!,"Had to make it, Brunson deserves this meme.>#",pacers,40,https://www.reddit.com/r/pacers/comments/1cpmp3o/its_floppin_time/
2024-10-24,1729746778,"[Alex Golden] Enrique Freeman will get a game ball tonight for scoring his first NBA Points. Thankfully, he wont have a Greek Freak chasing him down for it in Detroit.",,pacers,9,https://www.reddit.com/r/pacers/comments/1gav4fe/alex_golden_enrique_freeman_will_get_a_game_ball/
2024-10-09,1728438555,"Seeing the Pacers play again was great, but I can't wait to start watching games called by the best duo in NBA",,pacers,14,https://www.reddit.com/r/pacers/comments/1fzgjtp/seeing_the_pacers_play_again_was_great_but_i_cant/
2024-09-10,1725978659,Joe knows what's up,,pacers,37,https://www.reddit.com/r/pacers/comments/1fdja4z/joe_knows_whats_up/
2024-06-22,1719085428,had to show em,,pacers,12,https://www.reddit.com/r/pacers/comments/1dm3rqz/had_to_show_em/
2024-05-26,1716739476,"Hot take, Carlisle is actually a great coach ","In general, coaches are judged by the results based on how much talent is on the roster

IE, Suns with two superstars and three all stars out in the first round= Horrible coaching

The opposite is also true
I mean, the Knicks were fairly mid. But this team all year beat teams with a LOT more talent than ours.  We are two years into a rebuild and in the ECF playing a team that's 14 games better than the second best team.  A team with a NET of 11.  And a team with over 30 wins against above .509 teams.

They have two superstars and 4 all star caliber players.  (Maybe even 5).  

Having a chance to win where the second best players have been Myles Turner (game 3) or Pascal (game 1 and 2) is amazing.  That's a huge gap in talent and he's overachieved by that measure

Not saying he didn't make a mistake in game 1 not calling a TO, but that's the only cardinal sin I can see.  The overall job has been absolutely amazing

We are blessed to have a HOF coach, not the other way around ",pacers,60,https://www.reddit.com/r/pacers/comments/1d14m52/hot_take_carlisle_is_actually_a_great_coach/
2024-05-28,1716863884,"Post-Game Thread: Pacers' season ends in a loss to the Celtics, 105 - 102",,pacers,726,https://www.reddit.com/r/pacers/comments/1d2935w/postgame_thread_pacers_season_ends_in_a_loss_to/
2024-05-26,1716766008,About Rick...,"He's not even close to being on the hot seat by the way. Conference finals run, IST finals run, one of the best offenses of all time, young players progressing, etc. This season has been PHENOMENAL. Yes he makes mistakes, but he's our best option. These knee jerk reactions I've been seeing about him are insane",pacers,49,https://www.reddit.com/r/pacers/comments/1d1e39b/about_rick/
2024-04-19,1713494595,2024 Playoffs Hype Video - Believe by Reggie Miller,,pacers,17,https://www.reddit.com/r/pacers/comments/1c7m2zq/2024_playoffs_hype_video_believe_by_reggie_miller/
2024-01-04,1704391341,Tyrese first in Eastern Guards All Star Voting by 400K votes,,pacers,27,https://www.reddit.com/r/pacers/comments/18yjfga/tyrese_first_in_eastern_guards_all_star_voting_by/
2024-01-26,1706236861,"Post-Game Thread: Pascal gets a trouble double as the Pacers beat the Sixers, 134 - 122",,pacers,160,https://www.reddit.com/r/pacers/comments/1ab7ple/postgame_thread_pascal_gets_a_trouble_double_as/
2024-10-20,1729433461,Is there a coach with more swag than Rick Carlisle?,Courtsey of Pacers Facebook page,pacers,10,https://www.reddit.com/r/pacers/comments/1g7zks2/is_there_a_coach_with_more_swag_than_rick_carlisle/
2024-06-27,1719520779,Pacers get Johnny Furphy out of Kansas 35th overall,,pacers,100,https://www.reddit.com/r/pacers/comments/1dq1jfy/pacers_get_johnny_furphy_out_of_kansas_35th/
2024-04-24,1713928340,Tonights TRUE mvp,"I vote for Coach Jenny, giving stick to Bobby Portis in the clapping fray following Nembys menacing foul or whatever the fuck it was called when he stared down Dame on the floor in the 2nd. I think that helped push Nemby into the red. ",pacers,33,https://www.reddit.com/r/pacers/comments/1cbo122/tonights_true_mvp/
2024-01-09,1704806145,Haliburton update,,pacers,48,https://www.reddit.com/r/pacers/comments/192egoq/haliburton_update/
2024-08-16,1723819584,Nembhard really got under Currys skin,,pacers,45,https://www.reddit.com/r/pacers/comments/1etqorn/nembhard_really_got_under_currys_skin/
2024-07-10,1720572485,Tyrese Haliburton and Andrew Nembhard will go head to head in tomorrows exhibition game. USA vs. CANADA,,pacers,21,https://www.reddit.com/r/pacers/comments/1dzimtq/tyrese_haliburton_and_andrew_nembhard_will_go/
2024-06-10,1718032696,I miss it,,pacers,25,https://www.reddit.com/r/pacers/comments/1dco1ay/i_miss_it/
2024-03-21,1711032056,"Tyrese Haliburton on sports gambling: ""To half the world, Im just helping them make money on DraftKings or whatever. Im a prop.",[https://twitter.com/romeovillekid/status/1770252690825613332?t=P1s7GYknxdrUbRWaOCfOVw](https://twitter.com/romeovillekid/status/1770252690825613332?t=P1s7GYknxdrUbRWaOCfOVw),pacers,130,https://www.reddit.com/r/pacers/comments/1bk83wn/tyrese_haliburton_on_sports_gambling_to_half_the/
2023-12-31,1703988833,"Third Player in NBA History to Have Back 2 Back 20 Assist Games! (Magic, Stockton, Haliburton)",,pacers,22,https://www.reddit.com/r/pacers/comments/18uwo8o/third_player_in_nba_history_to_have_back_2_back/
2023-12-05,1701744739,The #2 seed INDIANA PACERS ARE GOING TO THE IN SEASON TOURNAMENT SEMIFINALS IN LAS VEGAS!,,pacers,17,https://www.reddit.com/r/pacers/comments/18b1wdd/the_2_seed_indiana_pacers_are_going_to_the_in/
2024-07-12,1720754630,Why did Myles Turner get so aggressive randomly?,"Myles Turner has always been criticized for his lack of assertiveness in the painted area. I cant exactly put my finger on when it happened, but at some point he flipped a switch and immediately started putting everyone on a poster and slamming it down with power instead of laying it up. The question is rhetorical, but I just want to praise him for his change in mindset. ",pacers,55,https://www.reddit.com/r/pacers/comments/1e17jfn/why_did_myles_turner_get_so_aggressive_randomly/
2024-05-29,1716955196,He would cook either of these clown ass West teams. ECF was the real finals,,pacers,41,https://www.reddit.com/r/pacers/comments/1d3385l/he_would_cook_either_of_these_clown_ass_west/
2024-01-24,1706060226,Petition to ban r/amongoofyninja,Please help me get this bum banned I have yet to see him put out a positive or informational post. He posts 3 times a day as well please help us get rid of him.,pacers,130,https://www.reddit.com/r/pacers/comments/19e5691/petition_to_ban_ramongoofyninja/
2024-05-27,1716787033,I never want this guy to leave. EVER,,pacers,24,https://www.reddit.com/r/pacers/comments/1d1k4v5/i_never_want_this_guy_to_leave_ever/
2024-05-09,1715216121,Shoutout Ben Sheppard,Is it just me or is he shooting lights out so far in the postseason? This dude does not play like a rookie.,pacers,40,https://www.reddit.com/r/pacers/comments/1cnkl9t/shoutout_ben_sheppard/
2024-01-04,1704336352,"Post-Game Thread: Pacers beat the Bucks...again, 142 - 130",,pacers,198,https://www.reddit.com/r/pacers/comments/18y24sc/postgame_thread_pacers_beat_the_bucksagain_142_130/
2023-12-07,1701986377,[Wojnarowski] Tyrese Haliburton is letting other stars around the league know he wants to team up with them on the Pacers. The Pacers have aggressively pursued players like Pascal Siakam and OG Anunoby over the past year. Indiana is ready to push the chips all-in around Haliburton.,,pacers,72,https://www.reddit.com/r/pacers/comments/18d6uby/wojnarowski_tyrese_haliburton_is_letting_other/
2024-08-10,1723325603,TFW Tyrese Haliburton gets a gold medal and makes an ECF before you,,pacers,35,https://www.reddit.com/r/pacers/comments/1ep3z32/tfw_tyrese_haliburton_gets_a_gold_medal_and_makes/
2024-05-07,1715048928,WHAT I SAW THIS GAME.,,pacers,29,https://www.reddit.com/r/pacers/comments/1cm14ra/what_i_saw_this_game/
2024-02-07,1707309473,Reggie's still got it,,pacers,41,https://www.reddit.com/r/pacers/comments/1al1z0c/reggies_still_got_it/
2024-05-11,1715458137,Nemby Stretch My Hands,,pacers,28,https://www.reddit.com/r/pacers/comments/1cpq0h2/nemby_stretch_my_hands/
2024-05-21,1716296616,ECF day. =< ,,pacers,10,https://www.reddit.com/r/pacers/comments/1cx7e6i/ecf_day/
2024-05-07,1715047987,The FBI needs to investigate Adam Silver and the Refs,"This is literally criminal behavior. Refs consistently favoring big market teams like Lakers and Knicks is beyond suspicious. Don't need a warrant, just go into Adam Silver's office now and start collecting the incriminating information.",pacers,126,https://www.reddit.com/r/pacers/comments/1cm0t5a/the_fbi_needs_to_investigate_adam_silver_and_the/
2023-11-30,1701315724,I guess I forgot about this... respect.,,pacers,16,https://www.reddit.com/r/pacers/comments/1878vjg/i_guess_i_forgot_about_this_respect/
2024-05-28,1716863967,Was a fun run Pacers=5= ,"Although we lost, we have lots to celebrate this year and a lot to look forward to. If you asked me in October, Id say wed be 6th seed at best, and a first round exit. Thank you Pacers >",pacers,50,https://www.reddit.com/r/pacers/comments/1d2943r/was_a_fun_run_pacers/
2024-05-13,1715635773,2 Minutes of Completely Objective ESPN Commentary | Streamable,,pacers,80,https://www.reddit.com/r/pacers/comments/1crb0zx/2_minutes_of_completely_objective_espn_commentary/
2024-06-29,1719623629,BRUNSON HALIBURTON STARE DOWN,https://x.com/wweonfox/status/1806855263325974630?s=46&amp;t=M04nfYv50vHKTePyR136Pw,pacers,20,https://www.reddit.com/r/pacers/comments/1dqzgof/brunson_haliburton_stare_down/
2024-06-10,1718042800,"Obi Toppin entering free agency, Indiana Pacers GM says team 'would like to continue the relationship'",,pacers,80,https://www.reddit.com/r/pacers/comments/1dcs58b/obi_toppin_entering_free_agency_indiana_pacers_gm/
2024-01-17,1705519886,"[Wojnarowski] Pascal Siakam is excited about the deal to the Pacers and expected to be eager to work out a new contract with the franchise this summer, sources tell ESPN. Siakam can be a free agent in July.",,pacers,60,https://www.reddit.com/r/pacers/comments/1995cqf/wojnarowski_pascal_siakam_is_excited_about_the/
2024-05-18,1716000899,= ,,pacers,10,https://www.reddit.com/r/pacers/comments/1cunglp/_/
2024-05-11,1715436226,Knicks Privilege,"Seriously, how many garbage calls to you have to get to attempt something like this?
",pacers,66,https://www.reddit.com/r/pacers/comments/1cpi7wf/knicks_privilege/
2024-03-30,1711818277,Tj mcconnel might just be the goat,,pacers,20,https://www.reddit.com/r/pacers/comments/1brmps1/tj_mcconnel_might_just_be_the_goat/
2024-03-18,1710788760,Congrats to Myles for entering the Pacers top ten all time in appearances! ,Pretty crazy. ,pacers,13,https://www.reddit.com/r/pacers/comments/1bhyw93/congrats_to_myles_for_entering_the_pacers_top_ten/
2023-11-10,1699583812,Three wins in a week?!?! Bring out the crabs!!!,,pacers,20,https://www.reddit.com/r/pacers/comments/17ru2tv/three_wins_in_a_week_bring_out_the_crabs/
2024-07-24,1721826560,"Woj: Nembhard 3 years, $59 million extension. ",https://x.com/wojespn/status/1816097948163272772?s=46&amp;t=r1lSJ8-JC9v9hcrkDTVDRg,pacers,38,https://www.reddit.com/r/pacers/comments/1eb12ib/woj_nembhard_3_years_59_million_extension/
2024-04-30,1714444794,Game 5 poster,,pacers,34,https://www.reddit.com/r/pacers/comments/1cgi02g/game_5_poster/
2024-04-28,1714319988,"Giannis, Dame ruled OUT for todays game ","As expected, Antetokounmpo and Damian Lillard (Achilles) have both been downgraded from doubtful to out. Khris Middleton (ankle) remains probable",pacers,92,https://www.reddit.com/r/pacers/comments/1cf9qwi/giannis_dame_ruled_out_for_todays_game/
2024-07-08,1720460746,Pascal Siakam Re-signs!,,pacers,55,https://www.reddit.com/r/pacers/comments/1dyf4il/pascal_siakam_resigns/
2024-06-28,1719582677,"ESPN: Pacers get an A for the draft, pick the 5th best player",,pacers,83,https://www.reddit.com/r/pacers/comments/1dqk4h4/espn_pacers_get_an_a_for_the_draft_pick_the_5th/
2024-05-22,1716352892,"Rick Carlisle's response to the free throw discrepancy at the end of regulation - ""My daughter already has to sit out semester of college, I can't have her to take a whole year off.""","[https://youtu.be/39Tml4iYiao?si=BGLPPCSVzvEv1MHl&amp;t=153](https://youtu.be/39Tml4iYiao?si=BGLPPCSVzvEv1MHl&amp;t=153)

Title. I thought that was a hilarious response.

Also for what it's worth. Rick took blame for not calling a timeout on the inbound, and they were looking to foul up 3 but with JB catching it at the 3 point line and Pascal late to get over, Pascal pulled up and didn't foul so he wouldn't give up a 4 point play.",pacers,30,https://www.reddit.com/r/pacers/comments/1cxrzi3/rick_carlisles_response_to_the_free_throw/
2024-04-27,1714185074,Myles and Siakam joined me for Dinner after a fantastic win!,"Eat well, lads!",pacers,29,https://www.reddit.com/r/pacers/comments/1ce3n20/myles_and_siakam_joined_me_for_dinner_after_a/
2023-12-05,1701744658,Haliburton go brrr and Pacers win back to back games??? Bring out the dancing crabs!!!!,,pacers,17,https://www.reddit.com/r/pacers/comments/18b1vg3/haliburton_go_brrr_and_pacers_win_back_to_back/
2024-05-24,1716562504,"In commemoration of Pascal's historic zero FTs this series, take a minute to remember the iconic tweet that arguably started the concept of ""ethical hoops""",,pacers,20,https://www.reddit.com/r/pacers/comments/1czmofk/in_commemoration_of_pascals_historic_zero_fts/
2024-05-22,1716346530,Ngl this one hurt ,,pacers,114,https://www.reddit.com/r/pacers/comments/1cxq4bp/ngl_this_one_hurt/
2024-05-19,1716156253,BING BONG!,,pacers,4,https://www.reddit.com/r/pacers/comments/1cvzown/bing_bong/
2024-07-24,1721835402,[Highlight] Nembhard steps back for three to take the lead...BANG! | ECSF G3,,pacers,26,https://www.reddit.com/r/pacers/comments/1eb4ico/highlight_nembhard_steps_back_for_three_to_take/
2024-05-03,1714701755,"Seriously, big ups to Middleton","Dude has always been about balling and putting it all on the floor. As Pacer fans, we can only hope one of our young guys develops into that kind of dog.",pacers,43,https://www.reddit.com/r/pacers/comments/1cix81j/seriously_big_ups_to_middleton/
2024-04-24,1713927480,PLAYOFF WIN!!! Bring out the dancing crabs!!!,,pacers,15,https://www.reddit.com/r/pacers/comments/1cbnr3z/playoff_win_bring_out_the_dancing_crabs/
2024-09-19,1726757571,Leaked NBA Cup court,,pacers,33,https://www.reddit.com/r/pacers/comments/1fkms28/leaked_nba_cup_court/
2024-07-01,1719840569,"[WOJ] Free agent center Jalen Smith has agreed on a three-year, $27 million contract with the Chicago Bulls, sources tell ESPN. Smiths agents at 
@KlutchSports reached deal with Bulls front office overnight.",,pacers,76,https://www.reddit.com/r/pacers/comments/1dsszxk/woj_free_agent_center_jalen_smith_has_agreed_on_a/
2024-05-07,1715089559,"OFF MY CHEST: I'm angry about the refs, to say the least. But I gotta hand it to the Knicks fans, they generally seem to be aware they got 'lucky' with the calls at the end. And other than the last minute or two, this was a really well played game, proud of our guys. Pacers in 6. ","And can we please stop criticizing Halliburton? Dude is CLEARLY playing hurt--he's not at superstar level at the moment, but he's running the offense, and doing his best to help, and we absolutely NEED him--even at his reduced level--to win this series. ",pacers,138,https://www.reddit.com/r/pacers/comments/1cmcaiv/off_my_chest_im_angry_about_the_refs_to_say_the/
2023-11-25,1700878001,The Ankle Collector,,pacers,19,https://www.reddit.com/r/pacers/comments/1838sby/the_ankle_collector/
2024-05-12,1715555330,who says this cant be a big three when this guy plays like an all star for 87% of the playoffs?,,pacers,28,https://www.reddit.com/r/pacers/comments/1cqkpv6/who_says_this_cant_be_a_big_three_when_this_guy/
2024-01-26,1706239148,Indiana Pacers (@Pacers) on X - I want to make this home. Pascal Siakam after tonights win.,,pacers,21,https://www.reddit.com/r/pacers/comments/1ab8hvb/indiana_pacers_pacers_on_x_i_want_to_make_this/
2024-09-14,1726341106,[NBACentral] Indiana Fevers Caitlin Clark has set the WNBA record for most assists in a single season,"1. Caitlin Clark: 321 assists  2024

2. Alyssa Thomas: 316 assists  2023

3. Courtney Vandersloot: 314 assists  2023

4. Courtney Vandersloot: 300 assists  2019

5. Alyssa Thomas: 293 assists  2024",pacers,25,https://www.reddit.com/r/pacers/comments/1fgtirb/nbacentral_indiana_fevers_caitlin_clark_has_set/
2024-06-12,1718152915,Tyrese making moves in Indy ,,pacers,20,https://www.reddit.com/r/pacers/comments/1ddtwks/tyrese_making_moves_in_indy/
2024-05-27,1716777609,We will win 4 in a row. They will make a movie about it.,,pacers,81,https://www.reddit.com/r/pacers/comments/1d1hk5n/we_will_win_4_in_a_row_they_will_make_a_movie/
2024-03-13,1710292779,The most underrated man in basketball.,,pacers,24,https://www.reddit.com/r/pacers/comments/1bdeo2v/the_most_underrated_man_in_basketball/
2024-06-11,1718069422,"Am I crazy, or is this guy wearing a James Johnson jersey at the Stanley Cup Finals?",,pacers,14,https://www.reddit.com/r/pacers/comments/1dd2bzn/am_i_crazy_or_is_this_guy_wearing_a_james_johnson/
2024-05-12,1715550973,"Post-Game Thread: Pacers beat the Knicks, 121 - 89",,pacers,255,https://www.reddit.com/r/pacers/comments/1cqj5hc/postgame_thread_pacers_beat_the_knicks_121_89/
2024-05-26,1716699618,The Celtics have been classy,"Credit to the Celtics. They have all the reason in the world to be cocky, but they have been really classy in this series. Hindsight we very easily could be leading the series, but we choked 2/3 away. Hopefully this is motivation for us moving forward.
",pacers,170,https://www.reddit.com/r/pacers/comments/1d0u07p/the_celtics_have_been_classy/
2024-05-19,1716157291,Congratulations ,"Knicks fan here . Credit is due for the way your guys showed up in game 7 . Absolutely tremendous . Wish you guys luck in the next round . Hopefully we can run it back next year with both teams healthy , and none of these crazy narratives . 

Good luck , and Godspeed ",pacers,68,https://www.reddit.com/r/pacers/comments/1cw02ey/congratulations/
2024-04-15,1713222552,Haliburton is chosen to represent USA Basketball for the 2024 Paris Olympics,,pacers,25,https://www.reddit.com/r/pacers/comments/1c50lbf/haliburton_is_chosen_to_represent_usa_basketball/
2024-03-14,1710457932,Haliburton splits,,pacers,110,https://www.reddit.com/r/pacers/comments/1bez2jq/haliburton_splits/
2024-04-03,1712150371,Made this frame by frame animation of two Haliburton ankle snatchers from a couple months back. Thought you guys would appreciate it. Let me know what yall think!,@supedoesart on IG if anyone wants to see more of my work!,pacers,27,https://www.reddit.com/r/pacers/comments/1busep1/made_this_frame_by_frame_animation_of_two/
2024-01-17,1705519204,"[WOJ] BREAKING: The Indiana Pacers are finalizing a trade to acquire All-Star F Pascal Siakam in a deal that will send Bruce Brown, Jordan Nwora and three first-round picks to the Toronto Raptors. New Orleans will be a third team in deal, sending Kira Lewis to the Raptors.",,pacers,153,https://www.reddit.com/r/pacers/comments/19952ii/woj_breaking_the_indiana_pacers_are_finalizing_a/
